,User ID,Count,Unnamed: 0,Date,Tweet Count,Tweet Location,Tweet,label,Clean,city
95,109149190.0,5,5765,2023-02-06,1885,"Bandar Lampung, Lampung",bismillah yok pak ganjar for presiden pranowo,Negative,fenomena maraknya kader partai politik yang akhirnya hijrah dan bergabung ke nasdem dinilai tak lepas dari langkah nasdem mengusung sebagai calon pada pemilu mendatang,Bandar Lampung
96,384190172.0,5,315,2023-04-11,1558,Sanggau,ganjar gak akan jadi presiden th belum saatnya belum bisa seperti jokowi entahlah kalau th lagi,Negative,alhamdulillah dukungan utk mas di pilpres hadir di tingkat desa bismillah mas the next ri aamiin sir relawan pemilugembira,Sanggau
97,384190172.0,5,2453,2023-03-12,906,,luar biasa bgt pokoknya pak ganjar pranowo calon presiden,Negative,masyarakat kendal jateng mendeklarasikan diri sbg relawan utk memenangkan mas di jateng sbg ri yuk bersatu amp berjuang brsm utk mas di pilpres sir relawan,
98,384190172.0,5,2517,2023-03-11,13727,singapore,saya pilih ganjar pranowo sebagai bakal calon presiden di,Negative,ujung dr ikhtiar kita utk memenangkan mas adalah dgn mengetuk pintu langit spt yg dilakukan tmnx sekber jateng aamiin kan setiap doa yg terbaik utk mas agar terpilih jd ri di aamiin sir relawan,singapore
99,384190172.0,5,7363,2023-01-24,10238,NKRI,yang norak elu umar kerjaan cuma moles si abud jelekin ganjar begitu terus sampe nanti pak ganjar dilantik jadi presiden,Negative,masyarakat banten begitu antusias menyambut kedatangan mas bismillah mas bisa terpilih jadi ri aamiin,NKRI
100,384190172.0,5,7665,2023-01-23,96,,ganjar pranowo next presiden asli pribumi indonesia,Negative,dukungan untuk mas jadi ri terus berlanjut dan bertambah kali ini dukungan datang dari masyarakat di pulau kalimantangaungkan terus semangat dan dukungan kalian untuk mas mewujudkan indonesia yang sejahtera sir,
101,18129942.0,4,3781,2023-02-25,22718,In ur head,solusinya sih periode kalo kata saya kalo ga ya den ganjar jadi presiden,Negative,koordinator juru bicara dpp partai demokrat herzaky mahendra putra menyatakan partainya sudah secara resmi mendeklarasikan sebagai bakal calon bacapres yang akan mereka usung pada pemilihan pilpres,In ur head
102,18129942.0,4,4074,2023-02-23,4651,,presiden ganjar pranowo,Negative,hari ini pks akan mendeklarasikan sebagai bakal calon,
103,18129942.0,4,6359,2023-02-01,3,,calon presiden indodonesia pak ganjar pranowo,Negative,jokowi mengaku tak mau ikut campur dengan langkah partai nasdem mengusung sebagai calon,
104,18129942.0,4,6971,2023-01-27,1369,"Palu Barat, Indonesia",warga dukung ganjar presiden pranowo,Negative,partai nasdem demokrat dan pks di ambang kesepakatan mengusung sebagai calon pada pemilu,Palu Barat
