,Date,User ID,Tweet,label,Clean
6343,2023-02-01,173434541.0,bismillahbiizdnillah pak anies presiden ri di tahun,Negative,bismillahbiizdnillah pak di tahun
6346,2023-02-01,218426063.0,krpanasan ni yee thresshold sudah terpenuhi tinggal pdi  dan kroconya ngusung siapa sementara jokowi pingin lanjut periode mantappp semoga anies jadi presiden supaya cebong stress,Positive,krpanasan yee thresshold sudah terpenuhi tinggal pdi dan kroconya ngusung siapa sementara jokowi pingin lanjut periode mantappp semoga jadi supaya cebong stress
6348,2023-02-01,69183155.0,presiden jokowi buka suara usai disebut pertemuannya dengan ketua umum partai nasdem membahas soal deklarasi anies baswedan sebagai calon presiden,Positive,jokowi buka suara usai disebut pertemuannya dengan ketua umum partai nasdem membahas soal deklarasi sebagai
6353,2023-02-01,2718336037.0,nando asmara koordinator koalisi perubahan dari partai keadilan sejahtera pks sohibul iman secara resmi memberi dukungan kepadaanies baswedansebagai calon presiden untuk pilpres anies memenuhi semua kriteria yg telah ditetapkan oleh majelis syura partai,Positive,nando asmara koordinator koalisi perubahan dari partai keadilan sejahtera pks sohibul iman secara resmi memberi dukungan kepadaanies baswedansebagai untuk memenuhi semua kriteria telah ditetapkan oleh majelis syura partai
6358,2023-02-01,1891951603.0,presiden sudah ada jangan memaksakan pak anies,Negative,sudah ada jangan memaksakan pak
6359,2023-02-01,18129942.0,jokowi mengaku tak mau ikut campur dengan langkah partai nasdem mengusung anies baswedan sebagai calon presiden,Positive,jokowi mengaku tak mau ikut campur dengan langkah partai nasdem mengusung sebagai
6362,2023-02-01,68381793.0,saya doakan jika anies jadi presiden ke anda pasti jadi komisaris bumn saya doakan yg kenceng amin,Positive,saya doakan jika jadi ke anda pasti jadi komisaris bumn saya doakan kenceng amin
6366,2023-02-01,3158832157.0,panik atau panik pastilah panik dan ketakutan krn dukungan rakyat indonesia kepada anies baswedan menjadi presiden ri semakin luar biasa,Negative,panik atau panik pastilah panik dan ketakutan dukungan rakyat kepada menjadi semakin luar
6373,2023-02-01,2388988494.0,alhamdulillah satu langkah sdh di lalui semoga allo swt meridhoi pak anies jadi presiden periode dst kami rakyat sdh rindu sosok presiden yg kebijakannya benar pro rakyat kecil dan presiden yg hadir utk semua golongan di negeri tercinta ini,Positive,alhamdulillah satu langkah di lalui semoga allo swt meridhoi pak jadi periode dst kami rakyat rindu sosok kebijakannya benar pro rakyat kecil dan hadir semua golongan di negeri tercinta ini
6382,2023-02-01,1036666722.0,mudahan pak anies benar menjadi presiden ri bismillah,Positive,mudahan pak benar menjadi bismillah
6388,2023-02-01,2458628236.0,semoga allah swt menjadikan pak anies sebagai presiden ri,Negative,semoga allah swt menjadikan pak sebagai
6392,2023-02-01,1695601676.0,saya dukung sepenuh hati anies jadi presiden ke,Positive,saya dukung sepenuh hati jadi ke
6396,2023-01-31,23772644.0,pks menyatakan mengusung anies baswedan sebagai bakal calon presiden adapun koalisi indonesia bersatu golkar pan ppp telah melirik ridwan kamil berikut delapan hal yang sejauh ini diketahui tentang peta koalisi pilpres,Positive,pks menyatakan mengusung sebagai bakal adapun koalisi bersatu golkar pan ppp telah melirik ridwan kamil berikut delapan hal yang sejauh ini diketahui tentang peta koalisi
6399,2023-01-31,112126632.0,partai di parlemen atau non parlemen semoga koalisi makin kuat dan bersatu dengan ummat ummat dan wadah perjuangannya selayaknya menyambut momentum ini ummat bersama pak anies untuk presiden tahun,Positive,partai di parlemen atau non parlemen semoga koalisi makin kuat dan bersatu dengan ummat ummat dan wadah perjuangannya selayaknya menyambut momentum ini ummat bersama pak untuk tahun
6401,2023-01-31,1611933612.0,id alhamdulillah anies presiden,Positive,id alhamdulillah
6402,2023-01-31,2855045856.0,anies baswedan for presiden oligarki cemas,Negative,for oligarki cemas
6411,2023-01-31,3158832157.0,menejelang buzzerp recehan makin panik dan ketakutan anies baswedan presiden ri pilihan rakyat indonesia,Negative,menejelang buzzerp recehan makin panik dan ketakutan pilihan rakyat
6417,2023-01-31,2181287628.0,rakyat cerdasbuzzerp tukang fitnah sedang bingung hadapi kenyataan anies presiden ri buzzerp akan kehilangan pekerjaan sbg tukang fitnah hehehe,Negative,rakyat cerdasbuzzerp tukang fitnah sedang bingung hadapi kenyataan buzzerp akan kehilangan pekerjaan sbg tukang fitnah hehehe
6418,2023-01-31,306615832.0,lawan oligarki yang menyengsarakan rakyat selamatkan indonesia anies presiden ri,Negative,lawan oligarki yang menyengsarakan rakyat selamatkan
6423,2023-01-31,2696971124.0,chotimah masha allah calon presiden ku dimanapun beliau pergi selalu di cintai dan di kerumunin oleh ribuan lovernya anies president bukan yg lain,Positive,chotimah masha allah ku dimanapun beliau pergi selalu di cintai dan di kerumunin oleh ribuan lovernya president bukan lain
6425,2023-01-31,60329492.0,perjanjiannya buat pemilu untuk presiden yg menjabat yg skrng dijabat jokowi katanya hasil surveynya diatas anies tp skrng kok melempem gini,Positive,perjanjiannya buat untuk menjabat skrng dijabat jokowi katanya hasil surveynya diatas skrng kok melempem
6431,2023-01-31,229873184.0,bismillahirohmanirrahim ya allah semoga indonesia di pimpin oleh pemimpin yg amanahsemoga pak anies menjadi pemimpin negara kamibantu kamikabulkan doa kami ya allah semoga pak anies menang pemilu dan mjadi presiden kami ya allah,Positive,bismillahirohmanirrahim allah semoga di pimpin oleh pemimpin amanahsemoga pak menjadi pemimpin negara kamibantu kamikabulkan doa kami allah semoga pak menang dan mjadi kami allah
6437,2023-01-31,1536117570.0,smoga bpk anies bisa jadi presiden indonesia yg ke aamiin,Positive,smoga bpk bisa jadi ke aamiin
6441,2023-01-31,714641761.0,tertib rapih duduk nya hampir terisi penuh kursinya dan alhmdllh cukup buat bekal hari moga pa anies jadi presiden berikut nya amiin,Positive,tertib rapih duduk hampir terisi penuh kursinya dan alhmdllh cukup buat bekal hari moga jadi berikut amiin
6443,2023-01-31,878059062.0,alhamdulillahinsyaa alloh panies menjadi presiden,Positive,alhamdulillahinsyaa alloh panies menjadi
6444,2023-01-31,1885408254.0,yuk kita antar pak anies baswedan jadi presiden ri pada nanti,Negative,yuk kita antar pak jadi pada nanti
6451,2023-01-31,64635651.0,bakal calon presiden anies baswedan mengucap syukur karena mendapatkan tiket untuk maju di pilpres tiga partai politik demokrat nasdem dan pks resmi memutuskan mengusung anies baswedan jadi calon presiden di pilpres mendatang,Positive,bakal mengucap syukur karena mendapatkan tiket untuk maju di tiga partai politik demokrat nasdem dan pks resmi memutuskan mengusung jadi di mendatang
6458,2023-01-31,1971816528.0,asmara tolak semua capres dan wapres dari partai licik nista kebo nyungsep dan partai penjilat penguasa oligarki seluruh indonesia dukung anies baswedan menjadi presiden ri,Positive,asmara tolak semua capres dan wapres dari partai licik nista kebo nyungsep dan partai penjilat penguasa oligarki seluruh dukung menjadi
6461,2023-01-31,46693036.0,dukungan partai keadilan sejahtera secara resmi membuat anies rasyid baswedan memegang tiket untuk mendaftar sebagai calon presiden capres,Positive,dukungan partai keadilan sejahtera secara resmi membuat rasyid memegang tiket untuk mendaftar sebagai capres
6463,2023-01-31,161742024.0,inismyname selamat berjuang mas dodo saya doakan semoga perjuangannya bisa membawa pak prabowo berhasil jadi menteri pertahanan ri kembali th dibawah presiden ri bapak anies baswedan aamiin ya robb tetap silaturahmi ya kang mas,Positive,selamat berjuang mas dodo saya doakan semoga perjuangannya bisa membawa pak berhasil jadi menteri pertahanan kembali th dibawah bapak aamiin robb tetap silaturahmi kang mas
6465,2023-01-31,2431310970.0,jika pak jokowi komplain ke surya paloh tentang deklarasi anies tanpa komunikasi itu wajar nasdem sebagai partai koalisi sudah seharusnya berkomunikasi disamping itu masa jabatan presiden kan masih berjalan sampai,Negative,jika pak jokowi komplain ke surya paloh tentang deklarasi tanpa komunikasi itu wajar nasdem sebagai partai koalisi sudah seharusnya berkomunikasi disamping itu masa jabatan kan masih berjalan sampai
6476,2023-01-31,3236555617.0,ak anies baswedan the nex presiden the best,Positive,ak the nex the best
6481,2023-01-31,2558197662.0,kenapa penting harus memilih presiden karena usaha indonesia perubahan yang berkeadilan kesejahteraan kesetaraan hanya anies yg sudah membuktikan di jakarta selama tahun saatnya indonesia dipimpin anies,Positive,kenapa penting harus memilih karena usaha perubahan yang berkeadilan kesejahteraan kesetaraan hanya sudah membuktikan di jakarta selama tahun saatnya dipimpin
6491,2023-01-31,306615832.0,mari bersatu lawan oligarki selamatkan indonesia selamatkan rakyat anies presiden ri,Positive,mari bersatu lawan oligarki selamatkan selamatkan rakyat
6493,2023-01-31,306615832.0,mari bersatu lawan oligarki selamatkan indonesia selamatkan rakyat anies presiden ri,Positive,mari bersatu lawan oligarki selamatkan selamatkan rakyat
6500,2023-01-31,306615832.0,semakin dijegal semakin didukung rakyat anies presiden ri,Positive,semakin dijegal semakin didukung rakyat
6507,2023-01-31,191077449.0,pak maaf kalau nanti anies jadi presiden ditahun pak jangan minta posisi dan jabatan ya,Negative,pak maaf kalau nanti jadi ditahun pak jangan minta posisi dan jabatan
6509,2023-01-31,2558197662.0,welcome to bima mr presiden sambutan luar biasa wes wayahe wes wancine anies presiden,Positive,welcome to bima mr sambutan luar wes wayahe wes wancine
6511,2023-01-31,468145932.0,relawan srikandi jatim kompak dukung dan kawal anies baswedan presiden ri,Positive,relawan srikandi jatim kompak dukung dan kawal
6515,2023-01-31,306615832.0,semakin dijegal semakin didukung rakyat anies presiden ri,Positive,semakin dijegal semakin didukung rakyat
6519,2023-01-31,20963426.0,kabar perombakan kabinet berembus setelah partai nasdem mendeklarasikan pencalonan anies baswedan sebagai presiden untuk pemilu lantas sejumlah politikus pdip mendesak jokowi mencopot menterimenteri yang berasal dari partai nasdem,Positive,kabar perombakan kabinet berembus setelah partai nasdem mendeklarasikan pencalonan sebagai untuk lantas sejumlah politikus pdip mendesak jokowi mencopot menterimenteri yang berasal dari partai nasdem
6520,2023-01-31,69183155.0,dukungan partai demokrat dan pks terhadap pencalonan anies baswedan sebagai calon presiden dianggap partai nasdem bersifat semi resmi,Positive,dukungan partai demokrat dan pks terhadap pencalonan sebagai dianggap partai nasdem bersifat semi resmi
6521,2023-01-31,69183155.0,partai keadilan sejahtera pks telah menyatakan dukungannya untuk anies baswedan sebagai calon presiden berikut poin pertimbangan pks dukung mantan gubernur dki jakarta tersebut,Positive,partai keadilan sejahtera pks telah menyatakan dukungannya untuk sebagai berikut poin pertimbangan pks dukung mantan gubernur dki jakarta tersebut
6523,2023-01-31,46693036.0,anies rasyid baswedan kini sudah mengantongi tiket untuk maju dalam pertarungan pemilu presiden setelah partai keadilan sejahtera pks menyusul partai nasdem dan demokrat secara resmi menyatakan dukungannya,Positive,rasyid kini sudah mengantongi tiket untuk maju dalam pertarungan setelah partai keadilan sejahtera pks menyusul partai nasdem dan demokrat secara resmi menyatakan dukungannya
6532,2023-01-31,88352716.0,dua politikus yang mengetahui isi pertemuan surya dan luhut bercerita keduanya sempat membahas hubungan nasdem dengan jokowi setelah partai itu mendeklarasikan anies baswedan sebagai calon presiden dalam pemilu pada oktober,Positive,dua politikus yang mengetahui isi pertemuan surya dan luhut bercerita keduanya sempat membahas hubungan nasdem dengan jokowi setelah partai itu mendeklarasikan sebagai dalam pada oktober
6533,2023-01-31,2391012962.0,ambil alphard di show room hiasa hasbi sesuai janjinyayg mengatakan anies tdk bisa mencalonkan presiden,Positive,ambil alphard di show room hiasa hasbi sesuai janjinyayg mengatakan bisa mencalonkan
6537,2023-01-31,82104835.0,pks nyatakan dukung anies baswedan di pemilu presiden,Positive,pks nyatakan dukung di
6541,2023-01-31,1724999989.0,id bisa yo bisa dong pilih pa anies jadi presiden siap kan,Positive,id bisa yo bisa dong pilih jadi siap kan
6542,2023-01-31,187428954.0,ganjar pranowo jadi tokoh yang paling banyak dipilih responden sebagai calon presiden capres dengan diikuti anies rasyid baswedan dengan serta gubernur jawa barat  ridwan kamil di posisi ketiga dengan,Negative,jadi tokoh yang paling banyak dipilih responden sebagai capres dengan diikuti rasyid dengan serta gubernur jawa barat ridwan kamil di posisi ketiga dengan
6545,2023-01-31,18129942.0,pks akhirnya secara resmi memberikan mendukung kepada anies baswedan sebagai calon presiden untuk pilpres,Positive,pks akhirnya secara resmi memberikan mendukung kepada sebagai untuk
6547,2023-01-31,2319203023.0,dngn koalisi partai besarinsyaallah akan ada perubahan bagi indonesia kedepanindonesia bngkit dngn koalisi perubahanmari kita dukung bersama bapak anies jadi presiden,Positive,dngn koalisi partai besarinsyaallah akan ada perubahan bagi kedepanindonesia bngkit dngn koalisi perubahanmari kita dukung bersama bapak jadi
6552,2023-01-31,3158832157.0,semakin dekat buzzerp makin panik dan ketakutan semakin banyak rakyat indonesia mendukung anies baswedan presiden ri buzzerp recehan siap dilelang murah,Negative,semakin dekat buzzerp makin panik dan ketakutan semakin banyak rakyat mendukung buzzerp recehan siap dilelang murah
6554,2023-01-31,1198792705.0,biiznillah semoga ikhtiar nasdem demokrat pks dan masyarakat yang ingin perubahan untuk negeri tercinta ini bisa meet dengan hak prerogatif allahqodarullah untuk anies rasyid baswedan presiden di dunia ini tidak ada yang tidak mungkin selalu ada keajaiban,Positive,biiznillah semoga ikhtiar nasdem demokrat pks dan masyarakat yang ingin perubahan untuk negeri tercinta ini bisa meet dengan hak prerogatif allahqodarullah untuk rasyid di dunia ini tidak ada yang tidak mungkin selalu ada keajaiban
6555,2023-01-31,202559038.0,resmi dukung anies baswedan presiden ri deklarasi pks tunggu presiden,Positive,resmi dukung deklarasi pks tunggu
6559,2023-01-31,46693036.0,kelompok relawan forum kemenangan anies forkanies menyambut gembira diumumkannya anies baswedan sebagai calon presiden capres yang diusung partai keadilan sejahtera pks menyusul sikap politik partai nasdem dan demokrat yang lebih dulu,Positive,kelompok relawan forum kemenangan forkanies menyambut gembira diumumkannya sebagai capres yang diusung partai keadilan sejahtera pks menyusul sikap politik partai nasdem dan demokrat yang lebih dulu
6560,2023-01-31,1067319098.0,resmi dukung anies baswedan presiden ri deklarasi pks tunggu presiden nasional bandung,Positive,resmi dukung deklarasi pks tunggu nasional bandung
6565,2023-01-31,1724999989.0,makanya piih pa anies jadi presiden banjir macet bisa di atasi kalo jadi presiden,Positive,makanya piih jadi banjir macet bisa di atasi jadi
6568,2023-01-31,1067319098.0,resmi dukung anies baswedan presiden ri deklarasi pks tunggu presiden nasional,Positive,resmi dukung deklarasi pks tunggu nasional
6579,2023-01-31,417513804.0,setuju negara ini bukan milik keluarga hapuskan dinastian jika bakal calon presiden anies baswedan berhasil memenangkan pilpres maka dipastikan dinasti jokowi akan berakhir ujar rocky,Positive,setuju negara ini bukan milik keluarga hapuskan dinastian jika bakal berhasil memenangkan maka dipastikan dinasti jokowi akan berakhir ujar rocky
6581,2023-01-31,46693036.0,kelompok relawan pendukung anies baswedan amanat indonesia anies merespons sangat positifpernyataan sikap partai keadilan sejahtera pks yang secara resmi mengusung anies baswedan sebagai calon presiden capres koordinator nasional amanat,Positive,kelompok relawan pendukung amanat merespons sangat positifpernyataan sikap partai keadilan sejahtera pks yang secara resmi mengusung sebagai capres koordinator nasional amanat
6588,2023-01-30,2718336037.0,koordinator koalisi perubahan dari partai keadilan sejahtera pks sohibul iman secara resmi memberi dukungan kepadaanies baswedansebagai calon presiden untuk pilpres,Positive,koordinator koalisi perubahan dari partai keadilan sejahtera pks sohibul iman secara resmi memberi dukungan kepadaanies baswedansebagai untuk
6589,2023-01-30,2718336037.0,koordinator koalisi perubahan dari partai keadilan sejahtera pks sohibul iman secara resmi memberi dukungan kepadaanies baswedansebagai calon presiden untuk pilpres,Positive,koordinator koalisi perubahan dari partai keadilan sejahtera pks sohibul iman secara resmi memberi dukungan kepadaanies baswedansebagai untuk
6590,2023-01-30,2718336037.0,koordinator koalisi perubahan dari partai keadilan sejahtera pks sohibul iman secara resmi memberi dukungan kepadaanies baswedansebagai calon presiden untuk pilpres,Positive,koordinator koalisi perubahan dari partai keadilan sejahtera pks sohibul iman secara resmi memberi dukungan kepadaanies baswedansebagai untuk
6591,2023-01-30,244402020.0,pks mendukung anies baswedan menjadi calon presiden,Positive,pks mendukung menjadi
6592,2023-01-30,4584408024.0,saya yakin itu puluhan juta anies presiden ke,Positive,saya yakin itu puluhan juta ke
6593,2023-01-30,2718336037.0,koordinator koalisi perubahan dari partai keadilan sejahtera pks sohibul iman secara resmi memberi dukungan kepadaanies baswedansebagai calon presiden untuk pilpres anies memenuhi semua kriteria yg telah ditetapkan oleh majelis syura partai,Positive,koordinator koalisi perubahan dari partai keadilan sejahtera pks sohibul iman secara resmi memberi dukungan kepadaanies baswedansebagai untuk memenuhi semua kriteria telah ditetapkan oleh majelis syura partai
6594,2023-01-30,2718336037.0,koordinator koalisi perubahan dari partai keadilan sejahtera pks sohibul iman secara resmi memberi dukungan kepadaanies baswedansebagai calon presiden untuk pilpres anies memenuhi semua kriteria yg telah ditetapkan oleh majelis syura partai,Positive,koordinator koalisi perubahan dari partai keadilan sejahtera pks sohibul iman secara resmi memberi dukungan kepadaanies baswedansebagai untuk memenuhi semua kriteria telah ditetapkan oleh majelis syura partai
6595,2023-01-30,568323360.0,pks siap menang bersama calon presiden ri bpk anies baswedan,Positive,pks siap menang bersama bpk
6599,2023-01-30,2152266583.0,kata penghulusy nikahkan pak anies dgn pks nasdemdemokratdgn mas kawinpresiden sahsahhhhhhhhhhh,Negative,kata penghulusy nikahkan pak pks nasdemdemokratdgn mas kawinpresiden sahsahhhhhhhhhhh
6602,2023-01-30,1611933612.0,alhamdulillah anies presiden,Positive,alhamdulillah
6604,2023-01-30,1611933612.0,alhamdulillah anies presiden,Positive,alhamdulillah
6605,2023-01-30,1611933612.0,alhamdulillah anies presiden,Positive,alhamdulillah
6615,2023-01-30,3242018473.0,ramalan ttg anies presiden indonesia akan terwujud dan kemungkinan banyak cebong mati kena serangan jantung minimal stroke,Negative,ramalan ttg akan terwujud dan kemungkinan banyak cebong mati kena serangan jantung minimal stroke
6619,2023-01-30,306615832.0,lawan oligarki selamatkan indonesia anies presiden ri,Positive,lawan oligarki selamatkan
6628,2023-01-30,46693036.0,anies rasyid baswedan kini sudah mengantongi tiket untuk maju dalam pertarungan pemilu presiden setelah partai keadilan sejahtera pks menyusul partai nasdem dan demokrat secara resmi menyatakan dukungannya wakil ketua majelis syura pks sohibul,Positive,rasyid kini sudah mengantongi tiket untuk maju dalam pertarungan setelah partai keadilan sejahtera pks menyusul partai nasdem dan demokrat secara resmi menyatakan dukungannya wakil ketua majelis syura pks sohibul
6634,2023-01-30,116823357.0,aamin anies presiden,Negative,aamin
6635,2023-01-30,46693036.0,wakil ketua majelis syura partai keadilan sejahtera pks  sohibul iman mengungkapkan alasan pihaknya mendukung anies baswedan sebagai calon presiden namun secara garis besar sosok anies baswedan merupakan figur capres yang ideal bagi pks menurut,Positive,wakil ketua majelis syura partai keadilan sejahtera pks sohibul iman mengungkapkan alasan pihaknya mendukung sebagai namun secara garis besar sosok merupakan figur capres yang ideal bagi pks menurut
6636,2023-01-30,46693036.0,wakil ketua majelis syura partai keadilan sejahtera pks sohibul iman mengemukakan sikap partainya mendukung pencalonan anies baswedan dalam pemilihan presiden pilpres pernyataan ini merupakan permulaan sebab secara organisasi pks akan,Positive,wakil ketua majelis syura partai keadilan sejahtera pks sohibul iman mengemukakan sikap partainya mendukung pencalonan dalam pemilihan pernyataan ini merupakan permulaan sebab secara organisasi pks akan
6639,2023-01-30,1451372822.0,pks nyatakan dukungannya terhadap anies baswedan jadi bakal calon presiden,Positive,pks nyatakan dukungannya terhadap jadi bakal
6640,2023-01-30,263711825.0,breaking news partai keadilan sejahtera pks resmi dukung anies baswedan bakal calon presiden,Positive,breaking news partai keadilan sejahtera pks resmi dukung bakal
6648,2023-01-30,65639033.0,pks dukung anies baswedan jadi calonpresiden lewat,Positive,pks dukung jadi calonpresiden lewat
6649,2023-01-30,46693036.0,perwakilan partai nasdem absen saat partai keadilan sejahtera pks menyampaikan sikap resminya mendukung anies baswedan sebagai calon presiden capres dukungan itu disampaikan perwakilan tim kecil anies baswedan sudirman said setelah tiba dari,Positive,perwakilan partai nasdem absen saat partai keadilan sejahtera pks menyampaikan sikap resminya mendukung sebagai capres dukungan itu disampaikan perwakilan tim kecil sudirman said setelah tiba dari
6650,2023-01-30,2270700511.0,fyi ya drun alinea terakhir memberi kisi bahwa pemenang presiden bukan anies seperti pendapat ainun najib yg sudah merasa jagoannya kalah dan menyalahkan jokowikarena dianggap mengatur semua tabahkan hatimu drun,Positive,fyi drun alinea terakhir memberi kisi bahwa pemenang bukan seperti pendapat ainun najib sudah merasa jagoannya kalah dan menyalahkan jokowikarena dianggap mengatur semua tabahkan hatimu drun
6651,2023-01-30,68930552.0,partai keadilan sejahtera pks secara resmi mengusung anies baswedan sebagai calon presiden capres pada pemilihan presiden pilpres hal itu diungkapkan wakil ketua majelis syuro pks moh sohibul iman senin malam,Positive,partai keadilan sejahtera pks secara resmi mengusung sebagai capres pada pemilihan hal itu diungkapkan wakil ketua majelis syuro pks moh sohibul iman senin malam
6652,2023-01-30,873034812.0,hal itu disampaikan saiful mujani research and consulting smrc saiful mujani yang mengungkapkan potensi ridwan kamil dapat menghambat prabowo dan anies yang kini digadang sebagai bakal calon presiden,Negative,hal itu disampaikan saiful mujani research and consulting smrc saiful mujani yang mengungkapkan potensi ridwan kamil dapat menghambat dan yang kini digadang sebagai bakal
6653,2023-01-30,68930552.0,pks resmi nyatakan bakal usung anies baswedan di pilpres menurut sohibul pihaknya menyatakan pernyataan tersebut untuk menjawab berbagai pertanyaan dari masyarakat terkait arah pks terhadap pilihan presiden di,Positive,pks resmi nyatakan bakal usung di menurut sohibul pihaknya menyatakan pernyataan tersebut untuk menjawab berbagai pertanyaan dari masyarakat terkait arah pks terhadap pilihan di
6655,2023-01-30,474977684.0,akhirnya alhamdulillahpks memutuskan semoga semua halangan dan rintangan dapat di lalui sehingga insya allah th anies baswedan presiden nya,Positive,akhirnya alhamdulillahpks memutuskan semoga semua halangan dan rintangan dapat di lalui sehingga insya allah th
6657,2023-01-30,375995332.0,partai keadilan sejahtera pks memutuskan untuk mendukung anies baswedan sebagai bakal calon presiden bel selengkapnya di,Positive,partai keadilan sejahtera pks memutuskan untuk mendukung sebagai bakal bel selengkapnya di
6659,2023-01-30,47596019.0,bergabung dengan koalisi perubahan bersama nasdem dan demokrat pks mengusung anies baswedan sebagai bakal calon presiden di pemilu,Positive,bergabung dengan koalisi perubahan bersama nasdem dan demokrat pks mengusung sebagai bakal di
6666,2023-01-30,55507370.0,pks mendukung anies baswedan menjadi calon presiden,Positive,pks mendukung menjadi
6673,2023-01-30,83867535.0,bismillahi tawakkalna alallahi laa hawla walaa quwwata illaa billah pks resmi usung anies baswedan sebagai calon presiden ri mohon izin sedulur sebangsa dan se tanah air,Negative,bismillahi tawakkalna alallahi laa hawla walaa quwwata illaa billah pks resmi usung sebagai mohon izin sedulur sebangsa dan se tanah air
6674,2023-01-30,260581544.0,penyambutan calon presiden bapak anies rasid baswedan masbagik lombok timur ntb keren ntb besok bima siap siap harus lebih keren lagi,Positive,penyambutan bapak rasid masbagik lombok timur ntb keren ntb besok bima siap siap harus lebih keren lagi
6675,2023-01-30,46693036.0,partai keadilan sejahtera pks secara resmi mengumumkan dukungan resmi kepada anies bawswedan sebagai calon presiden capres di pemilihan presiden pilpres hal ini disampaikan wakil ketua majelis syura pks sohibul iman di kawasan bandara,Positive,partai keadilan sejahtera pks secara resmi mengumumkan dukungan resmi kepada bawswedan sebagai capres di pemilihan hal ini disampaikan wakil ketua majelis syura pks sohibul iman di kawasan bandara
6679,2023-01-30,471013678.0,akhirnya koalisi perubahan mencalonkan bapak anies baswedan sebagai calon presiden pada pemilu,Negative,akhirnya koalisi perubahan mencalonkan bapak sebagai pada
