,Date,User ID,Tweet,label,Clean
4012,2023-02-23,69183155.0,partai keadilan sejahtera pks akhirnya mendeklarasikan anies rasyid baswedan sebagai calon presiden capres pemiu via detikbali,Positive,partai keadilan sejahtera pks akhirnya mendeklarasikan rasyid sebagai capres pemiu via detikbali
4013,2023-02-23,47274731.0,pks pajang baliho anies baswedan untuk presiden ri di markasnya,Negative,pks pajang baliho untuk di markasnya
4014,2023-02-23,64635651.0,mantan gubernur dki jakarta anies baswedan telah mengantongi tiket dari tiga partai politik parpol untuk maju sebagai calon presiden capres pada pilpres mendatang,Positive,mantan gubernur dki jakarta telah mengantongi tiket dari tiga partai politik parpol untuk maju sebagai capres pada mendatang
4016,2023-02-23,41730943.0,pks mulai pasang baliho anies baswedan presiden ri,Negative,pks mulai pasang baliho
4020,2023-02-23,18071520.0,pks resmi mengusung mantan gubernur dki jakarta anies baswedan sebagai bakal calon presiden dalam pemilu berita selengkapnya,Negative,pks resmi mengusung mantan gubernur dki jakarta sebagai bakal dalam berita selengkapnya
4021,2023-02-23,71436318.0,pks resmi mendeklarasikan sebagai calon presiden secara simbolis presiden pks ahmad syaikhu memberikan peci sebagai simbolis bentuk penetapan anies sebagai bakal calon presiden,Negative,pks resmi mendeklarasikan sebagai secara simbolis pks ahmad syaikhu memberikan peci sebagai simbolis bentuk penetapan sebagai bakal
4024,2023-02-23,3306771829.0,partai keadilan sejahtera resmi menyatakan mengusung anies baswedan sebagai bakal calon presiden di kontestasi dengan deklarasi ini pks jadi partai ketiga yang mendukung mantan gubernur dki jakarta ini setelah partai nasdem dan demokrat,Positive,partai keadilan sejahtera resmi menyatakan mengusung sebagai bakal di kontestasi dengan deklarasi ini pks jadi partai ketiga yang mendukung mantan gubernur dki jakarta ini setelah partai nasdem dan demokrat
4026,2023-02-23,375995332.0,partai keadilan sejahtera pks mendeklarasikan anies baswedan sebagai bakal calon presiden bacapres untuk pemilu pendeklarasian berlangsung di kantor dpp pks kamis siang paa,Positive,partai keadilan sejahtera pks mendeklarasikan sebagai bakal bacapres untuk pendeklarasian berlangsung di kantor dpp pks kamis siang paa
4030,2023-02-23,756374106.0,asmara anies didu saewad idha sir,Positive,asmara didu saewad idha sir
4031,2023-02-23,3128571781.0,pantun presiden pks untuk presiden ri pergi berjalan ke tanjung pinang berhenti sebentar memakan duren insya allah pks menang insya allah anies baswedan menjadi presiden depok,Positive,pantun pks untuk pergi berjalan ke tanjung pinang berhenti sebentar memakan duren insya allah pks menang insya allah menjadi depok
4032,2023-02-23,3591745814.0,asmara kita punya presiden anies rasyied baswedan phd,Positive,asmara kita punya rasyied phd
4035,2023-02-23,57261519.0,kata om ichu sampai saat ini cuma anies baswedan nih yang benarbenar punya tiket sebagai calon presiden caloncalon lain sepertinya masih seperti layanglayang putus saksikan hanya di youtube metrotvnews,Negative,kata om ichu sampai saat ini cuma yang benarbenar punya tiket sebagai caloncalon lain sepertinya masih seperti layanglayang putus saksikan hanya di youtube metrotvnews
4036,2023-02-23,23343960.0,presiden partai keadilan sejahtera pks ahmad syaikhu mengumumkan hasil musyawarah syura pks viii di mana mantan gubernur dki jakarta anies baswedan menjadi bakal calon presiden capres untuk pilpres lt,Positive,partai keadilan sejahtera pks ahmad syaikhu mengumumkan hasil musyawarah syura pks viii di mana mantan gubernur dki jakarta menjadi bakal capres untuk lt
4039,2023-02-23,69183155.0,kantor dpp pks di jalan tb simatupang jakarta selatan memasang baliho besar bergambar anies baswedan dalam baliho tertulis anies untuk presiden ri,Negative,kantor dpp pks di jalan tb simatupang jakarta selatan memasang baliho besar bergambar dalam baliho tertulis untuk
4040,2023-02-23,547044316.0,anies baswedan terima usungan pks sebagai calon presiden,Positive,terima usungan pks sebagai
4041,2023-02-23,456426648.0,momen pks deklarasi anies baswedan calon presiden di pemilu,Negative,momen pks deklarasi di
4042,2023-02-23,3306771829.0,partai keadilan sejahtera pks resmi mendeklarasikan dukungan kepada anies baswedan sebagai bakal calon presiden yang akan didukung di pilpres video pks deklarasi anies baswedan sebagai capres,Positive,partai keadilan sejahtera pks resmi mendeklarasikan dukungan kepada sebagai bakal yang akan didukung di video pks deklarasi sebagai capres
4045,2023-02-23,1052339653.0,sah pks resmi usung anies baswedan calon presiden ri,Positive,sah pks resmi usung
4046,2023-02-23,1315360284.0,bismillah mohon doanya partai keadilan sejahtera pks resmi mengusung anies baswedan sebagai bakal calon presiden ri tahun,Positive,bismillah mohon doanya partai keadilan sejahtera pks resmi mengusung sebagai bakal tahun
4049,2023-02-23,69183155.0,pks resmi mendeklarasikan anies baswedan sebagai calon presiden pks mengusung anies baswedan menyusul langkah partai nasdem yang telah mendeklarasikan terlebih dahulu,Positive,pks resmi mendeklarasikan sebagai pks mengusung menyusul langkah partai nasdem yang telah mendeklarasikan terlebih dahulu
4050,2023-02-23,393493493.0,partai keadilan sejahtera pks secara resmi memutuskan untuk mengusung anies baswedan sebagai bakal calon presiden bacapres republik indonesia di pemilu mendatang dalam musyawarah majelis syura viii di kantor dpp pks di jakarta kamis,Positive,partai keadilan sejahtera pks secara resmi memutuskan untuk mengusung sebagai bakal bacapres republik di mendatang dalam musyawarah majelis syura viii di kantor dpp pks di jakarta kamis
4051,2023-02-23,48306266.0,mengantar pak anies ke dpp pks untuk dideklarasikan menjadi bakal calon presiden ri tahun bismillah dkijakarta,Negative,mengantar pak ke dpp pks untuk dideklarasikan menjadi bakal tahun bismillah dkijakarta
4055,2023-02-23,484729792.0,cakep musyawarah dewan syuro untuk deklarasi anies calon presiden,Positive,cakep musyawarah dewan syuro untuk deklarasi
4059,2023-02-23,118646322.0,anies baswedan dan calon koalisi perubahan masih mematangkan nama bakal calon wakil presiden yang akan diusung pada pilpres,Negative,dan koalisi perubahan masih mematangkan nama bakal wakil yang akan diusung pada
4060,2023-02-23,2364118477.0,kok pada sewot ya biarkan saja anies jadi presiden tahun selama ini kalian kok diam saja komunis cina merongring sda dan junjungan kalian bersekongkol dg cina komunis lanjut pak aniesbiarkan anjing itu menggonggong,Negative,kok pada sewot biarkan saja jadi tahun selama ini kalian kok diam saja komunis cina merongring sda dan junjungan kalian bersekongkol cina komunis lanjut pak aniesbiarkan anjing itu menggonggong
4062,2023-02-23,241816808.0,bismillah partai keadilan sejahtera pks memutuskan mengusung anies baswedan sebagai bakal calon presiden pada pemilu hal ini diputuskan dalam musyawarah majelis syura viii yang berlangsung di kantor dptp pks di jakarta pada kamis,Positive,bismillah partai keadilan sejahtera pks memutuskan mengusung sebagai bakal pada hal ini diputuskan dalam musyawarah majelis syura viii yang berlangsung di kantor dptp pks di jakarta pada kamis
4071,2023-02-23,18129942.0,pks resmi mendeklarasikan anies baswedan sebagai bakal calon presiden atau capres,Negative,pks resmi mendeklarasikan sebagai bakal atau capres
4074,2023-02-23,18129942.0,hari ini pks akan mendeklarasikan anies baswedan sebagai bakal calon presiden,Negative,hari ini pks akan mendeklarasikan sebagai bakal
4075,2023-02-23,85805755.0,partai keadilan sejahtera pks resmi mendeklarasikan dukungan kepada aniesbaswedansebagai bakal calon presiden yang akan didukung di pilpres,Positive,partai keadilan sejahtera pks resmi mendeklarasikan dukungan kepada aniesbaswedansebagai bakal yang akan didukung di
4081,2023-02-23,18071520.0,pks resmi mengusung anies baswedan sebagai bakal calon presiden pada pilpres menurut presiden pks ahmad syaikhu anies adalah sosok pemimpin yang memiliki karakter nasionalis religius,Negative,pks resmi mengusung sebagai bakal pada menurut pks ahmad syaikhu adalah sosok pemimpin yang memiliki karakter nasionalis religius
4082,2023-02-23,4076746034.0,berdasarkan hasil musyawarah majelis syura pks viii yang digelar pada kamis februari bismillah resmi bakal calon presiden ri dari partai keadilan sejahtera bapak anies baswedan,Positive,berdasarkan hasil musyawarah majelis syura pks viii yang digelar pada kamis februari bismillah resmi bakal dari partai keadilan sejahtera bapak
4083,2023-02-23,2340155395.0,resmi dukung anies baswedan pks mudahmudahan allah takdirkan jadi presiden ri,Positive,resmi dukung pks mudahmudahan allah takdirkan jadi
4085,2023-02-23,18071520.0,pks resmi mengusung mantan gubernur dki jakarta anies baswedan sebagai bakal calon presiden pada pilpres,Negative,pks resmi mengusung mantan gubernur dki jakarta sebagai bakal pada
4086,2023-02-23,1103506188.0,pks deklarasi anies baswedan jadi bakal calon presiden,Negative,pks deklarasi jadi bakal
4087,2023-02-23,69183155.0,presiden pks ahmad syaikhu mengungkit darah biru anies baswedan anies dinilai memenuhi kriteria untuk diusung pks sebagai bacapres,Negative,pks ahmad syaikhu mengungkit darah biru dinilai memenuhi kriteria untuk diusung pks sebagai bacapres
4090,2023-02-23,69183155.0,presiden pks ahmad syaikhu ungkap tahapan panjang pks tentukan anies baswedan sebagai bacapres pks terima masukan dari daerah dan para tokoh,Positive,pks ahmad syaikhu ungkap tahapan panjang pks tentukan sebagai bacapres pks terima masukan dari daerah dan para tokoh
4091,2023-02-23,456426648.0,ketiga nama ini turut meramaikan bursa calon presiden di pemilu diambil dari lima lembaga survei berikut perkembangandata terkini terkait elektabilitas anies prabowo dan ganjar,Negative,ketiga nama ini turut meramaikan bursa di diambil dari lima lembaga berikut perkembangandata terkini terkait elektabilitas dan
4096,2023-02-23,118646322.0,partai keadilan sejahtera pks resmi mengusung anies baswedan sebagai calon presiden capres di pilpres,Positive,partai keadilan sejahtera pks resmi mengusung sebagai capres di
4097,2023-02-23,306615832.0,bismillah semoga alloh yang maha kuasa meridhoi dan melancarkan anies baswedan menjadi presiden ri,Positive,bismillah semoga alloh yang maha kuasa meridhoi dan melancarkan menjadi
4098,2023-02-23,91255162.0,pks menang anies baswedan presiden ri secara resmi menyatakan kesediaan beliau untuk menjadi bakal calon presiden di pemilu dari partai keadilan sejahtera,Positive,pks menang secara resmi menyatakan kesediaan beliau untuk menjadi bakal di dari partai keadilan sejahtera
4099,2023-02-23,1336081364.0,pergi berjalan ke tanjung pinang berhenti sebentar memakan duren insya allah pks menang insya allah anies baswedan menjadi presiden pantun  ahmad syaikhupresiden pks,Positive,pergi berjalan ke tanjung pinang berhenti sebentar memakan duren insya allah pks menang insya allah menjadi pantun ahmad syaikhupresiden pks
4100,2023-02-23,91255162.0,pks menang anies presiden ri penyerahan peci secara simbolis dari presiden pks  ahmad kepada bakal calon presiden ri bapak sebagai tanda dukungan partai keadilan sejahtera kepada anies baswedan di pemilihan umum,Positive,pks menang penyerahan peci secara simbolis dari pks ahmad kepada bakal bapak sebagai tanda dukungan partai keadilan sejahtera kepada di pemilihan umum
4101,2023-02-23,135728969.0,tidak hanya memiliki intergitas dan kapasitas saudara anies rasyid baswedan juga memiliki peluang menang yang besar dalam kontestasi pemilihan umum presiden tahun terang syaikhu,Positive,tidak hanya memiliki intergitas dan kapasitas saudara rasyid juga memiliki peluang menang yang besar dalam kontestasi pemilihan umum tahun terang syaikhu
4103,2023-02-23,48306266.0,dari atas andong mengiringi anies  baswedan menuju kantor dpp pks untuk didaulat menjadi bakal calon presiden ri,Positive,dari atas andong mengiringi menuju kantor dpp pks untuk didaulat menjadi bakal
4104,2023-02-23,135728969.0,dalam konferensi pers presiden pks ahmad syaikhu menyampaikan langsung hasil dari mms pks viii yang salah satunya adalah mengusung anies baswedan sebagai bakal calon presiden ri dalam pemilu,Negative,dalam konferensi pers pks ahmad syaikhu menyampaikan langsung hasil dari mms pks viii yang salah satunya adalah mengusung sebagai bakal dalam
4105,2023-02-23,4076746034.0,partai keadilan sejahtera pks memutuskan mengusung anies baswedan sebagai bakal calon presiden pada pemilu hal ini diputuskan dalam musyawarah majelis syura viii yang berlangsung di kantor dptp pks di jakarta pada kamis,Positive,partai keadilan sejahtera pks memutuskan mengusung sebagai bakal pada hal ini diputuskan dalam musyawarah majelis syura viii yang berlangsung di kantor dptp pks di jakarta pada kamis
4106,2023-02-23,135728969.0,partai keadilan sejahtera pks memutuskan mengusung anies baswedan sebagai bakal calon presiden pada pemilu hal ini diputuskan dalam musyawarah majelis syura viii yang berlangsung di kantor dptp pks di jakarta pada kamis,Positive,partai keadilan sejahtera pks memutuskan mengusung sebagai bakal pada hal ini diputuskan dalam musyawarah majelis syura viii yang berlangsung di kantor dptp pks di jakarta pada kamis
4107,2023-02-23,306615832.0,anies pemimpin merakyat presiden ri,Negative,pemimpin merakyat
4108,2023-02-23,118646322.0,pdip menegaskan tidak akan berkoalisi dengan partai politik parpol yang sudah mengusung anies baswedan sebagai calon presiden capres untuk pilpres,Positive,pdip menegaskan tidak akan berkoalisi dengan partai politik parpol yang sudah mengusung sebagai capres untuk
4112,2023-02-23,241816808.0,kamis feb mulai pukul wib disiarkan secara langsung dari kanal youtube pks tv akan mendeklarasikan anies baswedan sebagai bakal calon presiden ri live youtube anies baswedan untuk indonesia pks menang anies presiden,Positive,kamis feb mulai pukul wib disiarkan secara langsung dari kanal youtube pks tv akan mendeklarasikan sebagai bakal live youtube untuk pks menang
4113,2023-02-23,848614550.0,hari ini pks berencana deklarasikan anies baswedan sebagai bakal calon presiden,Negative,hari ini pks berencana deklarasikan sebagai bakal
4116,2023-02-23,1050527953.0,makan es di kota medan pulangnya ketemu joe biden pks dukung anies baswedan jadi presiden,Positive,makan es di kota medan pulangnya ketemu joe biden pks dukung jadi
4117,2023-02-23,178237411.0,wajar saja terjadi lautan massa warga dki antusiasmendukung sekali anies dapat dukungan partai utk jadi presiden ri mendatang banyak prestasi kerja yg sudah direalisasikan anies semasa gubernur dki itu bisa jadi inspirasi program kerja nasional,Positive,wajar saja terjadi lautan massa warga dki antusiasmendukung sekali dapat dukungan partai jadi mendatang banyak prestasi kerja sudah direalisasikan semasa gubernur dki itu bisa jadi inspirasi program kerja nasional
4120,2023-02-23,302315979.0,calon presiden indonesia bapak anies rasyid baswedan,Negative,bapak rasyid
4121,2023-02-23,1321955280.0,tonton deklarasi di dpp pks,Negative,tonton deklarasi di dpp pks
4122,2023-02-23,71436318.0,breaking news pks deklarasi anies baswedan sebagai calon presiden streaming di,Negative,breaking news pks deklarasi sebagai streaming di
4123,2023-02-23,1177860162.0,pks menang anies ins allah presiden ri,Positive,pks menang ins allah
4124,2023-02-23,118646322.0,pdip memberi selamat kepada calon koalisi perubahan atas kesepakatan untuk mengusung anies baswedan sebagai bakal calon presiden capres pada pilpres,Positive,pdip memberi selamat kepada koalisi perubahan atas kesepakatan untuk mengusung sebagai bakal capres pada
4126,2023-02-23,553451866.0,jokowi pasti punya perhitungan sendiri dan punya tim ahli yg bisa memprediksi presiden terpilih kalau anies diprediksi akan menang tentu sebaiknya jokowi tdk ambil jarak dan putus hub dg spnasdem,Positive,jokowi pasti punya perhitungan sendiri dan punya tim ahli bisa memprediksi terpilih kalau diprediksi akan menang tentu sebaiknya jokowi ambil jarak dan putus hub spnasdem
4132,2023-02-23,90832506.0,wakil ketua ms partai keadilan sejahtera pks memastikan bahwa pks akan mendeklarasikan anies baswedan sebagai calon presiden hnw deklarasi resmi pks hari ini memang diselenggarakan hanya oleh pks bukan berarti tidak diikuti oleh nasdem dan partai demokrat,Positive,wakil ketua ms partai keadilan sejahtera pks memastikan bahwa pks akan mendeklarasikan sebagai hnw deklarasi resmi pks hari ini memang diselenggarakan hanya oleh pks bukan berarti tidak diikuti oleh nasdem dan partai demokrat
4133,2023-02-23,103246870.0,hari ini insya allah mulai pukul wib disiarkan secara langsung dari kanal youtube pks tv dan pkstv jakarta akan mengumumkan sebagai bakal calon presiden ri anies baswedan untuk indonesia pks menang anies presiden,Positive,hari ini insya allah mulai pukul wib disiarkan secara langsung dari kanal youtube pks tv dan pkstv jakarta akan mengumumkan sebagai bakal untuk pks menang
4135,2023-02-23,375995332.0,partai keadilan sejahtera pks pada hari ini akan mendeklarasikan anies baswedan sebagai bakal calon presiden bacapres untuk pemilu selengkapnya,Positive,partai keadilan sejahtera pks pada hari ini akan mendeklarasikan sebagai bakal bacapres untuk selengkapnya
4136,2023-02-23,486675146.0,spa yg setuju silahkan retweet aniesandhika prakasacalon presiden,Positive,spa setuju silahkan retweet aniesandhika prakasacalon
4137,2023-02-23,69183155.0,nasdem menyebut hasil survei elektabilitas calon presiden pemilu litbang kompas tidak menurunkan semangat untuk memperkenalkan anies baswedan,Negative,nasdem menyebut hasil elektabilitas litbang kompas tidak menurunkan semangat untuk memperkenalkan
4138,2023-02-23,235105357.0,hari ini insya allah mulai pukul wib disiarkan secara langsung dari kanal youtube pks tv dan pkstv jakarta akan mendeklarasikan sebagai bakal calon presiden ri anies baswedan untuk indonesia pks menang anies presiden,Positive,hari ini insya allah mulai pukul wib disiarkan secara langsung dari kanal youtube pks tv dan pkstv jakarta akan mendeklarasikan sebagai bakal untuk pks menang
4143,2023-02-23,729388321.0,nasdem menyebut hasil survei elektabilitas calon presiden pemilu litbang kompas tidak menurunkan semangat untuk memperkenalkan anies baswedan,Negative,nasdem menyebut hasil elektabilitas litbang kompas tidak menurunkan semangat untuk memperkenalkan
4144,2023-02-23,485856546.0,anies presiden ri,Negative,
4145,2023-02-23,2455219674.0,pks menang anies baswedan presiden,Positive,pks menang
4146,2023-02-23,567132989.0,gak usah sokan kebal godaan setan setan itu gak lebih unggul dari manusia lihat kisah nabi sulaiman setan dan jin gak mungkin bikin hp dan main twiter sopan rendah hati tegas dan bermanfaat bagi nkri dukung anies presiden,Positive,usah sokan kebal godaan setan setan itu lebih unggul dari manusia lihat kisah nabi sulaiman setan dan jin mungkin bikin hp dan main twiter sopan rendah hati tegas dan bermanfaat bagi nkri dukung
4151,2023-02-23,485856546.0,anies presiden ri,Negative,
4152,2023-02-22,1575046236.0,chotimah repot amat mengulas capres lanjut nul sudah menjadi tugasmu melakukannya krn tugas kayak semakin berat jgn lupa minta tambah upah nya nul kamu benar chusnul chotimah,Positive,chotimah repot amat mengulas capres lanjut nul sudah menjadi tugasmu melakukannya tugas kayak semakin berat jgn lupa minta tambah upah nul kamu benar chusnul chotimah
4153,2023-02-22,747254550.0,relawan jokowi bacaleg nasdem dapil dki jakartaits time to change pa anies presiden,Negative,relawan jokowi bacaleg nasdem dapil dki jakartaits time to change
4161,2023-02-22,2612000071.0,inilah alsan kenapa anies ahy layak jadi presiden dan wakil presiden ahy sp,Negative,inilah alsan kenapa ahy layak jadi dan wakil ahy sp
4163,2023-02-22,2730933570.0,tidak ada yg kebetulan semua yg terjadi sdh tertulis sebelumnya ternyata paduan suara ini dipentaskan th yll insyaalloh anies presiden,Positive,tidak ada kebetulan semua terjadi tertulis sebelumnya ternyata paduan suara ini dipentaskan th yll insyaalloh
4164,2023-02-22,2308125870.0,cebongbuzzer anjing cari makan bela rezim jancokkkkk rezim abis loe pada dicari,Negative,cebongbuzzer anjing cari makan bela rezim jancokkkkk rezim abis loe pada dicari
4166,2023-02-22,103246870.0,pks menang anies presiden ri,Positive,pks menang
4168,2023-02-22,306615832.0,mari bergerak bersama lawan oligarki selamatkan indonesia anies presiden ri,Positive,mari bergerak bersama lawan oligarki selamatkan
4172,2023-02-22,306615832.0,rakyat bersatu lawan oligarki selamatkan indonesia anies presiden ri,Positive,rakyat bersatu lawan oligarki selamatkan
4193,2023-02-22,306615832.0,alhamdulillah tabarakalloh semoga alloh meridhoi dan melancarkan hajat pak anies baswedan dan partai partai pengusungnya anies baswedan presiden ri selamatkan indonesia insya alloh,Positive,alhamdulillah tabarakalloh semoga alloh meridhoi dan melancarkan hajat pak dan partai partai pengusungnya selamatkan insya alloh
4207,2023-02-22,990237626.0,sosok ketua umum partai demokrat agus harimurti yudhoyono ahy dinilai pantas menjadi calon wakil presiden cawapres mendampingi anies baswedan pada pemilu mendatang,Positive,sosok ketua umum partai demokrat agus harimurti yudhoyono ahy dinilai pantas menjadi wakil cawapres mendampingi pada mendatang
4211,2023-02-22,306615832.0,anies presiden ri,Negative,
4216,2023-02-22,85805755.0,ketua umum partai demokratagus harimurti yudhoyonoahy menyatakan mendukung mantan gubernur dki jakarta anies baswedan sebagai calon presiden di pilpres,Positive,ketua umum partai demokratagus harimurti yudhoyonoahy menyatakan mendukung mantan gubernur dki jakarta sebagai di
4227,2023-02-22,306615832.0,mari bersatu selamatkan indonesia anies presiden ri,Positive,mari bersatu selamatkan
4229,2023-02-22,306615832.0,mari bersama rakyat selamatkan indonesia anies presiden ri,Positive,mari bersama rakyat selamatkan
4232,2023-02-22,306615832.0,anies bersama rakyat tumbangkan oligarki selamatkan indonesia anies presiden ri,Positive,bersama rakyat tumbangkan oligarki selamatkan
4235,2023-02-22,2703213439.0,jeul anies semakin mantap presiden,Positive,jeul semakin mantap
4237,2023-02-22,205783184.0,alhamdulillah sahdpc relawan jagakarsa pasar minggu sir abw,Positive,alhamdulillah sahdpc relawan jagakarsa pasar minggu sir abw
4240,2023-02-22,306615832.0,anies berkoalisi dengan rakyat tumbangkan oligarki selamatkan indonesia anies presiden ri,Negative,berkoalisi dengan rakyat tumbangkan oligarki selamatkan
4242,2023-02-22,306615832.0,anies pemimpin cerdas dan jujur mari bersatu selamatkan indonesia anies presiden ri,Positive,pemimpin cerdas dan jujur mari bersatu selamatkan
4244,2023-02-22,485856546.0,id anies presiden ri,Negative,id
4245,2023-02-22,79984762.0,anies presiden insyallh,Positive,insyallh
4249,2023-02-22,103246870.0,selamat dan sukses rakernas pks terus membela dan melayani rakyat menang bersama rakyat pks menang anies presiden ri,Positive,selamat dan sukses rakernas pks terus membela dan melayani rakyat menang bersama rakyat pks menang
4256,2023-02-22,485856546.0,waras anies tetap presiden ri,Negative,waras tetap
4258,2023-02-22,306615832.0,rakyat butuh pemimpin cerdas dan jujur anies presiden ri,Positive,rakyat butuh pemimpin cerdas dan jujur
4259,2023-02-22,306615832.0,semakin dijegal semakin didukung rakyat anies presiden ri,Positive,semakin dijegal semakin didukung rakyat
4261,2023-02-22,2667428478.0,asmara gue akan mendukung anies baswedan presiden ri jika anies baswedan mengatakan didepan publik dan berjanji tidak akan menghidupkan kembali hti amp fpi,Positive,asmara gue akan mendukung jika mengatakan didepan publik dan berjanji tidak akan menghidupkan kembali hti fpi
4262,2023-02-22,103246870.0,selamat dan sukses rakernas pks terus membela dan melayani rakyat menang bersama rakyat pks menang anies presiden ri,Positive,selamat dan sukses rakernas pks terus membela dan melayani rakyat menang bersama rakyat pks menang
4264,2023-02-22,69492528.0,itu orang biasa saja tapi bisa bikin jutaan orang ketar ketir ada fenomena apa ya,Negative,itu orang saja tapi bisa bikin jutaan orang ketar ketir ada fenomena apa
4266,2023-02-22,2667428478.0,gue akan mendukung anies baswedan presiden ri jika anies baswedan mengatakan didepan publik dan berjanji tidak akan menghidupkan kembali hti amp fpi,Positive,gue akan mendukung jika mengatakan didepan publik dan berjanji tidak akan menghidupkan kembali hti fpi
4268,2023-02-21,485856546.0,lbs sangat percaya anies presiden ri,Negative,lbs sangat percaya
4269,2023-02-21,485856546.0,anies presiden ri,Negative,
4270,2023-02-21,189774285.0,bismillahanies for presiden ri insyaa allah,Positive,bismillahanies for insyaa allah
4278,2023-02-21,569901485.0,setelah satu hari sebelumnya ada mak lampir ngomongin ibu yg suka ngajihari ini pak anis baswedan amp ahy menghadiri dan disambut bergemuruh di acara bkmt,Positive,setelah satu hari sebelumnya ada mak lampir ngomongin ibu suka ngajihari ini pak ahy menghadiri dan disambut bergemuruh di acara bkmt
4285,2023-02-21,2714869507.0,pengamat politik menilai peluang gibran rakabuming menduduki kursi gubernur dki jakarta sangat berat jika nantinya anies baswedan terpilih menjadi presiden,Positive,pengamat politik menilai peluang gibran rakabuming menduduki kursi gubernur dki jakarta sangat berat jika nantinya terpilih menjadi
4289,2023-02-21,306615832.0,mari bersama anies kita lawan oligarki selamatkan indonesia anies presiden ri,Positive,mari bersama kita lawan oligarki selamatkan
4291,2023-02-21,485856546.0,anies tetap presiden ri,Negative,tetap
4292,2023-02-21,428008436.0,insya allah indonesia maju bersama pak anies presiden dan rakyat bersatu,Positive,insya allah maju bersama pak dan rakyat bersatu
4294,2023-02-21,485856546.0,anies tetap presiden ri,Negative,tetap
4295,2023-02-21,485856546.0,anies presiden,Negative,
