,Date,User ID,Tweet,label,Clean
1854,2023-03-19,2319203023.0,jika nanti bapak anies terpilih jadi presiden manusia kyak kau harus di binasakanindonesia butuh perubahan dari mausia anjing kayak kau ruhut,Negative,jika nanti bapak terpilih jadi manusia kyak kau harus di binasakanindonesia butuh perubahan dari mausia anjing kayak kau ruhut
1856,2023-03-19,89877164.0,teriakan presiden dari pendukung anies baswedan tujuan kita keadilan bagi seluruh rakyat indonesia,Positive,teriakan dari pendukung tujuan kita keadilan bagi seluruh rakyat
1857,2023-03-19,1052339653.0,bangagoengdua hidup masih paiiiit kl blom anies jd presiden ri thn,Negative,bangagoengdua hidup masih paiiiit blom thn
1862,2023-03-19,543930551.0,banten siap menangkan anies presiden ri id jakarta tv,Positive,banten siap menangkan id jakarta tv
1863,2023-03-19,747254550.0,jadi dprd dki presiden anies baswedan its time,Negative,jadi dprd dki its time
1864,2023-03-19,428008436.0,pak anies presiden ri insya allah,Positive,pak insya allah
1865,2023-03-19,136866901.0,samosir kerennn banget ya klu setelah rumah anak yatim di seluruh tanah air lebih di perhatikan dan dibantu oleh presiden dan negara terutama pendidikannya agar anak ini setelah dewasa mampu mandiri sangat layak kita kasih kesempatan kpd bang anies untuk mewujudkannya aamiin,Positive,samosir kerennn banget klu setelah rumah anak yatim di seluruh tanah air lebih di perhatikan dan dibantu oleh dan negara terutama pendidikannya agar anak ini setelah dewasa mampu mandiri sangat layak kita kasih kesempatan kpd bang untuk mewujudkannya aamiin
1868,2023-03-19,89877164.0,teriakan presiden dari pendukung anies baswedan tujuan kita keadilan bagi seluruh rakyat indonesia,Positive,teriakan dari pendukung tujuan kita keadilan bagi seluruh rakyat
1872,2023-03-19,375991552.0,ak rosiade anies baswedan pilihan terbaik buat presiden bukan yang lain,Positive,ak rosiade pilihan terbaik buat bukan yang lain
1876,2023-03-19,226082238.0,acara apel siaga pks banten dimulai sejak pukul wib hingga sore menghadirkan bakal calon gubernur banten  gembong  sumedi presiden pks  ahmad syaikhu ahmad dan bakal capres ri  anies baswedan,Negative,acara apel siaga pks banten dimulai sejak pukul wib hingga sore menghadirkan bakal gubernur banten gembong sumedi pks ahmad syaikhu ahmad dan bakal capres
1880,2023-03-19,191032546.0,kalo komen hrs fokus jgn ngeyel siapa yg meneriaki anies presiden para makmumjamaahhadirin apkh anies yg minta tdk blog kamu yg ktnya mau jd politisi diteriaki pleciden juga gak ada yg larang mk lihat konteksnya lihat kelakuan bawaslu yg offside,Positive,komen fokus jgn ngeyel siapa meneriaki para makmumjamaahhadirin apkh minta blog kamu ktnya mau politisi diteriaki pleciden juga ada larang mk lihat konteksnya lihat kelakuan bawaslu offside
1882,2023-03-19,191032546.0,kalo komen hrs fokus jgn ngeyel siapa yg meneriaki anies presiden para makmumjamaahhadirin apkh anies yg minta tdk blog kamu yg ktnya mau jd politisi diteriaki pleciden juga gak ada yg larang mk lihat konteksnya lihat kelakuan bawaslu yg offside,Positive,komen fokus jgn ngeyel siapa meneriaki para makmumjamaahhadirin apkh minta blog kamu ktnya mau politisi diteriaki pleciden juga ada larang mk lihat konteksnya lihat kelakuan bawaslu offside
1888,2023-03-19,68930552.0,aliansi relawan anies di kabupaten ende nusa tenggara timur mereka mendeklarasikan diri siap memenangkan anies baswedan sebagai presiden ri di,Positive,aliansi relawan di kabupaten ende nusa tenggara timur mereka mendeklarasikan diri siap memenangkan sebagai di
1892,2023-03-19,306615832.0,anies baswedan keturunan asli wong suroboyo merah putih darahnya presiden ri,Negative,keturunan asli wong suroboyo merah putih darahnya
1898,2023-03-19,46693036.0,bakal calon presiden ri anies baswedan dalam silaturahmi dan safari kebangsaan di jawa timur menyebut jawa timur menjadi titik awal menyalurkan gelora keadilan sosial bagi seluruh masyarakat indonesia slogan keadilan sosial ini kerap digaungkan,Positive,bakal dalam silaturahmi dan safari kebangsaan di jawa timur menyebut jawa timur menjadi titik awal menyalurkan gelora keadilan sosial bagi seluruh masyarakat slogan keadilan sosial ini kerap digaungkan
1901,2023-03-19,756374106.0,yg ada cuma tim horenya asmara anies didu saewad idha sir,Positive,ada cuma tim horenya asmara didu saewad idha sir
1905,2023-03-19,474704760.0,acara apel siaga pks banten dimulai sejak pukul wib hingga sore menghadirkan bakal calon gubernur banten  gembong  sumedi presiden pks  ahmad syaikhu ahmad dan bakal capres ri  anies baswedan,Negative,acara apel siaga pks banten dimulai sejak pukul wib hingga sore menghadirkan bakal gubernur banten gembong sumedi pks ahmad syaikhu ahmad dan bakal capres
1907,2023-03-19,109149190.0,calon presiden dari partai nasdem anies rasyid baswedan melakukan lawatan ke jawa timur jumat anies mengawalinya dengan salat jumat di masjid alakbar surabaya bersama rombongan anies bertemu tokohtokoh agama dan dilanjutkan dengan menunaikan salat jumat,Positive,dari partai nasdem rasyid melakukan lawatan ke jawa timur jumat mengawalinya dengan salat jumat di masjid alakbar surabaya bersama rombongan bertemu tokohtokoh agama dan dilanjutkan dengan menunaikan salat jumat
1909,2023-03-19,543930551.0,insyaallah anies presiden ri,Positive,insyaallah
1910,2023-03-19,543930551.0,anies for presiden ri,Negative,for
1914,2023-03-19,107319980.0,tetap konsisten menyuarakan anies baswedan sebagai calon presiden indonesia,Negative,tetap konsisten menyuarakan sebagai
1915,2023-03-19,306615832.0,pemimpin merakyat benar benar pro rakyat mari bersama sama dukung anies presiden ri untuk indonesia yang lebih baik maju damai adil dan sejahtera,Positive,pemimpin merakyat benar benar pro rakyat mari bersama sama dukung untuk yang lebih baik maju damai adil dan sejahtera
1916,2023-03-19,3158832157.0,makin mantab anies baswedan semakin kuat dukungan rakyat indonesia menjadi presiden ri,Positive,makin mantab semakin kuat dukungan rakyat menjadi
1917,2023-03-19,184738514.0,anies at the end mau menang atau kagak dlm pilpres atau anies akhirnya bisa nyalon apa tetap dihalangi dll bagi nasdem terpenting adl bgmn memanfaatkan moment ini bgmn memaksimalkan suara lewat kendaraan anies anies jd presiden itu sdh bonus,Positive,at the end mau menang atau kagak atau akhirnya bisa nyalon apa tetap dihalangi dll bagi nasdem terpenting adl bgmn memanfaatkan moment ini bgmn memaksimalkan suara lewat kendaraan itu bonus
1921,2023-03-19,221683270.0,nanti dia ngeles kan beda propinsi kan beda kepala daerah kan cuma anies yg mau jadi presiden ke,Negative,nanti dia ngeles kan beda propinsi kan beda kepala daerah kan cuma mau jadi ke
1930,2023-03-18,155580220.0,kan pinterpinter lu buzzer ngeles aja tiaptiap sudut gang sudah terpampang poster anies calon presiden yang ke,Positive,kan pinterpinter lu buzzer ngeles tiaptiap sudut gang sudah terpampang poster yang ke
1935,2023-03-18,3277399364.0,diisi tokohtokoh penting ini struktur relawan perannu for anies presiden,Positive,diisi tokohtokoh penting ini struktur relawan perannu for
1937,2023-03-18,47596019.0,diteriaki presiden anies baswedan sibuk layani warga foto di jalan tunjungan surabaya,Negative,diteriaki sibuk layani warga foto di jalan tunjungan surabaya
1939,2023-03-18,428008436.0,pak anies memang inteleksangat layak jadi presiden insya allah,Positive,pak memang inteleksangat layak jadi insya allah
1945,2023-03-18,2982945846.0,brani taruhanyang jadi presiden dipastikan bukan anies,Positive,brani taruhanyang jadi dipastikan bukan
1955,2023-03-18,1007868992.0,percaya sama saya anies baswedan tidak bakal jadi presiden silakan kalian mempolitisasi agama agama selalu kalian jadikan alat jualan,Negative,percaya sama saya tidak bakal jadi silakan kalian mempolitisasi agama agama selalu kalian jadikan alat jualan
1958,2023-03-18,68930552.0,ulama di kabupaten bangkalan madura jawa timur menilai anies rasyid baswedan cocok menjadi calon presiden di kontestasi pemilu,Negative,ulama di kabupaten bangkalan madura jawa timur menilai rasyid cocok menjadi di kontestasi
1961,2023-03-18,199609723.0,dpt tgs dr pimpinan krn stress lht masyarakat tdk bisa dibendung pemilu jls telak putaran anies baswedan presiden,Negative,tgs pimpinan stress lht masyarakat bisa dibendung jls telak putaran
1973,2023-03-18,2400825584.0,fahri sedang mengendrose ps maka selalu menyentil dan mendown grade anies baswedan agar jelek dimata para pemilih presiden thn dan uud ujung ujung nya duit,Negative,fahri sedang mengendrose ps maka selalu menyentil dan mendown grade agar jelek dimata para pemilih thn dan uud ujung ujung duit
1975,2023-03-18,485856546.0,anies presiden ri,Negative,
1979,2023-03-18,306615832.0,mari kita dukung anies presiden ri untuk indonesia maju damai adil dan makmur,Positive,mari kita dukung untuk maju damai adil dan makmur
1982,2023-03-18,306615832.0,hujan insya alloh menjadi berkah mengantarkan anies presiden ri,Positive,hujan insya alloh menjadi berkah mengantarkan
1983,2023-03-18,306615832.0,bersama rakyat dan para ulama mari kita dukung anies presiden ri selamatkan indonesia,Positive,bersama rakyat dan para ulama mari kita dukung selamatkan
1990,2023-03-18,109149190.0,dewan pimpinan wilayah dpw jawa timur menggelar simfoni kebangsaan yang dihadiri calon presiden dari partai nasdem kakak anies baswedan di dyandra convention center surabaya jawa timur jumat,Positive,dewan pimpinan wilayah dpw jawa timur menggelar simfoni kebangsaan yang dihadiri dari partai nasdem kakak di dyandra convention center surabaya jawa timur jumat
1994,2023-03-18,91745687.0,insya allah pak anies baswedan menjadi presiden indonesia ditahun dan membongkar mega korupsi  di menkeu dijaman presiden jokowi,Positive,insya allah pak menjadi ditahun dan membongkar mega korupsi di menkeu dijaman jokowi
2004,2023-03-18,284340910.0,anies baswedan ziarah makam syaikhona kholil bangkalan irwan setiawan ketua pks jatim membersamai anies baswedan selaku calon presiden ri pada ziarah ke makam syaikhona kholil bangkalan pada sabtu di bangkalan madura,Negative,ziarah makam syaikhona kholil bangkalan irwan setiawan ketua pks jatim membersamai selaku pada ziarah ke makam syaikhona kholil bangkalan pada sabtu di bangkalan madura
2007,2023-03-18,1153424046.0,chotimah kami turut berdoa semoga musra kaltim lancar dan bpk anies rasyid baswedan terpilih sbg presiden ri,Positive,chotimah kami turut berdoa semoga musra kaltim lancar dan bpk rasyid terpilih sbg
2008,2023-03-18,199609723.0,siswanto yg lg kampanye siapa kan lg sholat sls sholat masyarakat mau teriakin presiden dan siap dukung apa dilarang trs mau sholat dimana jg kl anies yg dtg mah rame aja,Positive,siswanto kampanye siapa kan sholat sls sholat masyarakat mau teriakin dan siap dukung apa dilarang trs mau sholat dimana mah rame
2009,2023-03-18,199609723.0,siswanto yg jls kami bangga dgn identitas islam dan dukung pa anies for presiden junjungan lu aja lg rebutan suara umat islam tuh dibantu cr masanya lah kasian pening kplnya,Positive,siswanto jls kami bangga identitas islam dan dukung for junjungan lu rebutan suara umat islam dibantu masanya lah pening kplnya
2010,2023-03-18,199609723.0,siswanto hanya org bodoh sj yg msh mau dipimpin kaum munafikun utk mensengsarakan rakyatnya dan bykan masyarakat menerima dan menyambut anies baswedan for presiden sian panik nih sptnya,Negative,siswanto hanya bodoh sj msh mau dipimpin kaum munafikun mensengsarakan rakyatnya dan bykan masyarakat menerima dan menyambut for sian panik sptnya
2011,2023-03-18,3158832157.0,makin dekat para pecundang sosmed makin panik dan ketakutan anies baswedan presiden ri,Negative,makin dekat para pecundang sosmed makin panik dan ketakutan
2014,2023-03-18,567132989.0,anies itu diplomat ulang pintar dan soleh cerdas dan cermat pro pribumi presiden nkri makin beradab,Positive,itu diplomat ulang pintar dan soleh cerdas dan cermat pro pribumi nkri makin beradab
2018,2023-03-18,959753028.0,siapa dulu dong presidennya kan pak gub jabar mencth pakde yg jg pakai buzzerp bhkn ada anggaran buzzerp dr apbn jd percuma sajalah protes hastag garang di medsos krn bakal dibungkam msh mau nunggu msh mau nunggu mas anies jd presiden knp gak lempar jumroh,Negative,siapa dulu dong presidennya kan pak gub jabar mencth pakde pakai buzzerp bhkn ada anggaran buzzerp apbn percuma sajalah protes hastag garang di medsos bakal dibungkam msh mau nunggu msh mau nunggu mas knp lempar jumroh
2026,2023-03-18,199609723.0,ydk tau bukan berarti tdk ada ya dan jg bukan berarti mau perduli krn misi sama toh asal tdk anies yg naik presiden mknya sgl cara dilakukan fgn penundaan pemilu dgn sgl macam dalih,Negative,ydk bukan berarti ada dan bukan berarti mau perduli misi sama toh asal naik mknya sgl cara dilakukan fgn penundaan sgl macam dalih
2028,2023-03-18,306615832.0,mari rakyat bersatu saatnya lawan oligarki selamatkan indonesia anies presiden ri,Positive,mari rakyat bersatu saatnya lawan oligarki selamatkan
2031,2023-03-18,85611078.0,harusnya menebar manfaat itu lebih baik semoga bapak kembali nyapres,Positive,harusnya menebar manfaat itu lebih baik semoga bapak kembali nyapres
2040,2023-03-17,236004490.0,kalian pada ga tahu presiden terpilih ya anies baswedan makanya bawaslu ingin menjatuhkan nama baik anies,Positive,kalian pada tahu terpilih makanya bawaslu ingin menjatuhkan nama baik
2049,2023-03-17,567132989.0,mastito yang sudah isi pasti dimusuhi orang yg takut miskin jika tidak berkuasa makin jelas anies layak diperjuangkan jadi presiden yes,Negative,mastito yang sudah isi pasti dimusuhi orang takut miskin jika tidak berkuasa makin jelas layak diperjuangkan jadi yes
2051,2023-03-17,567132989.0,partai pdx membuat rezim bajingan berkuasa penuh bahkan presiden konoha pun gagal berantas preman katanya pak anies satria baja hitam akan maju indonesia bebas preman dan pungli yg dibacking nenek lampir,Positive,partai pdx membuat rezim bajingan berkuasa penuh bahkan konoha pun gagal berantas preman katanya pak satria baja hitam akan maju bebas preman dan pungli dibacking nenek lampir
2059,2023-03-17,306615832.0,terlihat rakyat begitu mencintainya anies presiden ri,Positive,terlihat rakyat begitu mencintainya
2065,2023-03-17,306615832.0,anies baswedan wong suroboyo indonesia asli insya alloh presiden ri,Positive,wong suroboyo asli insya alloh
2069,2023-03-17,1709238618.0,mantap pak presiden era pdip habis karna akan jadi duel prabowo vs anies pdip anak bawang,Positive,mantap pak era pdip habis karna akan jadi duel vs pdip anak bawang
2070,2023-03-17,306615832.0,anies pemimpin yang merakyat menghormati para ulama presiden ri,Positive,pemimpin yang merakyat menghormati para ulama
2073,2023-03-17,306615832.0,asmara rakyat sudah tidak sabar mendukung anies presiden ri hidup rakyat hidup indonesia,Positive,asmara rakyat sudah tidak sabar mendukung hidup rakyat hidup
2074,2023-03-17,306615832.0,alhamdulillah jangan biarkan orang baik berjuang sendiri mari bersama dukung anies presiden ri,Positive,alhamdulillah jangan biarkan orang baik berjuang sendiri mari bersama dukung
2083,2023-03-17,199609723.0,otak lu kaga sampa bro jauh kemn lawan anies lah junjungan lu aja takut setengah mati sampe kirim buzzer busuk utk serang dr sgl arah walau akhirnya gagal dan masyarakat ttp semangat usung abas for presiden,Negative,otak lu kaga sampa bro jauh kemn lawan lah junjungan lu takut setengah mati sampe kirim buzzer busuk serang sgl arah walau akhirnya gagal dan masyarakat ttp semangat usung abas for
2088,2023-03-17,80559922.0,jawa timur mantap lho cak anies baswedan usai shalat jumat di masjid alakbar surabaya dikerubungi jamaah masjid yang berebut ingin bersalaman dengan calon presiden ri tsb video dari smara,Positive,jawa timur mantap lho cak usai shalat jumat di masjid alakbar surabaya dikerubungi jamaah masjid yang berebut ingin bersalaman dengan tsb video dari smara
2097,2023-03-17,2154315079.0,semakin kalian fitnah anies semakin mentereng dianya percuma kalian keluarkan narasi negatif kpd anies anies insyaallah presiden ri,Negative,semakin kalian fitnah semakin mentereng dianya percuma kalian keluarkan narasi negatif kpd insyaallah
2100,2023-03-17,1729938073.0,ewett insya alloh pak anies jadi presiden ri itu mereka yg bikin aturan bikin susah rakyat langsung penjarain aja pak anies,Negative,ewett insya alloh pak jadi itu mereka bikin aturan bikin susah rakyat langsung penjarain pak
2101,2023-03-17,306615832.0,bersama rakyat lakukan perubahan untuk indonesia lebih baik maju damai adil dan makmur anies presiden ri,Positive,bersama rakyat lakukan perubahan untuk lebih baik maju damai adil dan makmur
2106,2023-03-17,99684750.0,anies baswedan presiden indonesia,Negative,
2107,2023-03-17,30766806.0,anies baswedan presiden ri,Negative,
2109,2023-03-17,68930552.0,partai demokrat menilai ahy masih kandidat yang pas mendampingi bakal calon presiden anies baswedan pada pilpres,Positive,partai demokrat menilai ahy masih kandidat yang pas mendampingi bakal pada
2110,2023-03-17,2279797170.0,kita dukung anies agar terpilih sebagai presiden ri ke,Positive,kita dukung agar terpilih sebagai ke
2117,2023-03-17,18129942.0,anies baswedan membantah dirinya disebut mencuri start kampanye untuk pemilihan presiden,Negative,membantah dirinya disebut mencuri start kampanye untuk pemilihan
2119,2023-03-17,107319980.0,mengapa memilih anies baswedan sebagai presiden indonesia ini dia alasannya,Negative,mengapa memilih sebagai ini dia alasannya
2125,2023-03-17,72004620.0,saya yakin anies terpilih jadi presiden indonesia ke,Positive,saya yakin terpilih jadi ke
2128,2023-03-17,474746759.0,bisa jadi alloh akan memuliakan anies jd presiden kalau kebkaran sudah pasti karena ijin alloh kalau  salahkan bisa jd karena ijin kakak pembina,Negative,bisa jadi alloh akan memuliakan kalau kebkaran sudah pasti karena ijin alloh kalau salahkan bisa karena ijin kakak pembina
2133,2023-03-17,552523769.0,muhaimin ragu anies baswedan maju sebagai calon presiden,Negative,muhaimin ragu maju sebagai
2136,2023-03-16,626156275.0,lha itu kan hanya kelakuan segelintir warga jatim yang tidak ingin anies menang di jatim ketakutan mereka akan kekalahan semakin terlihat jelas sementara jutaan warga jatim lainnya banyak yang mendukung sebagai presiden di,Positive,lha itu kan hanya kelakuan segelintir warga jatim yang tidak ingin menang di jatim ketakutan mereka akan kekalahan semakin terlihat jelas sementara jutaan warga jatim lainnya banyak yang mendukung sebagai di
2141,2023-03-16,397106910.0,kasihan ni buzzer gw liat yg komen isinya buzzer semua yg notabene bukan org jawa timur xixixixi saking takut nya jadi pengangguran kalo anies jadi presiden mata pencaharian ngebuzzer hilang ya,Negative,kasihan buzzer liat komen isinya buzzer semua notabene bukan jawa timur xixixixi saking takut jadi pengangguran jadi mata pencaharian ngebuzzer hilang
2148,2023-03-16,269120479.0,ana pak anies insyaallah presiden aamiin,Positive,ana pak insyaallah aamiin
2157,2023-03-16,101783417.0,anies pasti presiden,Positive,pasti
2160,2023-03-16,306615832.0,pemimpin cerdas jujur dan tidak baperan anies presiden ri,Positive,pemimpin cerdas jujur dan tidak baperan
2162,2023-03-16,101783417.0,anies pasti presiden,Positive,pasti
2178,2023-03-16,30766806.0,anies baswedan pilihan tepat utk presiden ri sakseis jakarta utk endonesah,Negative,pilihan tepat sakseis jakarta endonesah
2190,2023-03-15,46693036.0,barisan mudamudi tergabung dalam sohib aniesahy mendeklarasikan pasangan ideal anies baswedan dan agus harimurti yudhoyono ahy untuk pemilihan presiden pilpres anies baswedan sebagai gubernur dki jakarta periode dan ahy sebagai,Positive,barisan mudamudi tergabung dalam sohib aniesahy mendeklarasikan pasangan ideal dan agus harimurti yudhoyono ahy untuk pemilihan sebagai gubernur dki jakarta periode dan ahy sebagai
2197,2023-03-15,3061150290.0,rakyat sdh rindu memiliki pemimpin seperti pak aniessmg pak anies presiden,Positive,rakyat rindu memiliki pemimpin seperti pak aniessmg pak
2198,2023-03-15,2891652854.0,sy sehat jasmaniamprohani tp mikir dl hrs pilih siapa presiden biarpun sy sehat blm tentu milih anies,Positive,sehat jasmaniamprohani mikir dl pilih siapa biarpun sehat tentu milih
2209,2023-03-15,30766806.0,anies baswedan for presiden,Negative,for
2210,2023-03-15,228935841.0,ganzo ralat saat ini presiden jokowi adalah presiden yang menjabat sebagai presiden ke ri berarti anies menjadi presiden ke akan menunggu tahun  tahun lagi,Negative,ganzo ralat saat ini jokowi adalah yang menjabat sebagai ke berarti menjadi ke akan menunggu tahun tahun lagi
2211,2023-03-15,228935841.0,ganzo saat ini presiden jokowi adalah presiden yang menjabat sebagai presiden ke ri berarti anies menjadi presiden ke akan menunggu tahun  tahun lagi,Negative,ganzo saat ini jokowi adalah yang menjabat sebagai ke berarti menjadi ke akan menunggu tahun tahun lagi
2212,2023-03-15,330865816.0,klo melihat petinggi kelakuannya kaya begini gak pada bermartabat membuat semakin mantab besuk pilih anies rasyid baswedan jadi presiden ri biidznillah,Positive,klo melihat petinggi kelakuannya kaya begini pada bermartabat membuat semakin mantab besuk pilih rasyid jadi biidznillah
2214,2023-03-15,2893917372.0,nanti saja pak saat pak anies baswedan menjadi presiden sikat habis para koruptor iblis yang berbentuk manusia,Negative,nanti saja pak saat pak menjadi sikat habis para koruptor iblis yang berbentuk manusia
2216,2023-03-15,306615832.0,anies pemimpin yang diharapkan rakyat presiden ri,Positive,pemimpin yang diharapkan rakyat
2222,2023-03-15,558873806.0,anies rasyid baswedan presiden insya allah,Positive,rasyid insya allah
2228,2023-03-15,158223726.0,istri saya thn jadi honorer gaji pertama dulu tahun rb sekarng di zaman pak jokowi masuk pk terimakasih pak jokowi semoga pak anies jadi presiden,Positive,istri saya thn jadi honorer gaji pertama dulu tahun rb sekarng di zaman pak jokowi masuk terimakasih pak jokowi semoga pak jadi
2240,2023-03-15,228935841.0,asmara dukung anies utk presiden ke,Positive,asmara dukung ke
2262,2023-03-14,213799922.0,bukan ganjar apalagi anies abu janda yakin prabowo bakal jadi presiden kalau meleset bakalg,Negative,bukan apalagi abu janda yakin bakal jadi kalau meleset bakalg
2280,2023-03-14,81386247.0,enggak laku bonghanya koruptor dan maling yg mau menyerahkan negara ini dipimpin org bodoh anies rb presiden ri th semoga,Positive,enggak laku bonghanya koruptor dan maling mau menyerahkan negara ini dipimpin bodoh rb th semoga
2289,2023-03-14,86311144.0,wkkww gini nih kalau ngetweet nafsu  denger briefing kakak pembina dulu pt bgr itu bumn anak buah erick tohir pas anies dia  dipake heru gubernur langsung diangkat dirut transjakartag tau titipan siapa apa jangan lo ngira anies udah presiden ysabar jangan kudeta,Positive,wkkww kalau ngetweet nafsu denger briefing kakak pembina dulu pt bgr itu bumn anak buah erick tohir pas dia dipake heru gubernur langsung diangkat dirut transjakartag titipan siapa apa jangan lo ngira udah ysabar jangan kudeta
2292,2023-03-14,1415417323.0,samosir go pak anies presiden,Negative,samosir go pak
2312,2023-03-14,3329869879.0,iya dehhpak anies kalah terus di surveykarna pak anies bukan presiden berdasar survey tapi dalam realita dan fakta nya nanti di,Positive,iya dehhpak kalah terus di surveykarna pak bukan berdasar tapi dalam realita dan fakta nanti di
2313,2023-03-14,88420786.0,koreksi bang anies baswedan presiden ri thn,Negative,koreksi bang thn
2316,2023-03-14,352858952.0,deg deg degkan partai berani memberikan keputusan calon presiden bpk anies baswedan tapi partai besar katanya berkuasa belum ada nyali kok sakit jantungnya buzerrp kambuh katanya gara pak anies di lamar partai jadi calon presiden ini,Positive,deg deg degkan partai berani memberikan keputusan bpk tapi partai besar katanya berkuasa belum ada nyali kok sakit jantungnya buzerrp kambuh katanya gara pak di lamar partai jadi ini
2317,2023-03-14,97694002.0,keadilan jangan lupa sekalian tandain gw ya drun kalo anies jadi presiden ke,Positive,keadilan jangan lupa sekalian tandain drun jadi ke
2318,2023-03-14,180112404.0,dari yg beredar sekrng bagi saya tak ada yg benar qualified jadi presiden tapi kalo nanti pilihannya tetap itu saja ya pilihlah yg paling sedikit cacadnya atau golput saya belum putuskan pilih anies karena nurut saya terlalu lunak kalo prabowo terlalu tua ganjar big no,Positive,dari beredar sekrng bagi saya tak ada benar qualified jadi tapi nanti pilihannya tetap itu saja pilihlah paling sedikit cacadnya atau golput saya belum putuskan pilih karena nurut saya terlalu lunak terlalu tua big no
2331,2023-03-14,111813142.0,chotimah jis akan jadi tempat pertandingan tingkat dunia setelah anies presiden nanti,Negative,chotimah jis akan jadi tempat pertandingan tingkat dunia setelah nanti
2334,2023-03-14,1913859108.0,yang penting jangan sampai tiga periode ya pak anies presiden,Positive,yang penting jangan sampai tiga periode pak
2343,2023-03-13,89575980.0,ketua mui kuningan nilai anies baswedan layak jadi presiden,Positive,ketua mui kuningan nilai layak jadi
2344,2023-03-13,141001653.0,ini orang masih aja bahas anies presiden ri baiknya saran gue lu fokus ma partai lu jgn sampe cuma jd partai seputaran ibukota aja,Positive,ini orang masih bahas baiknya saran gue lu fokus partai lu jgn sampe cuma partai seputaran ibukota
2347,2023-03-13,198888246.0,ps menang tp jkw yg jd presiden ps ga menang dan anies presiden aamiiiin,Negative,ps menang jkw ps menang dan aamiiiin
2349,2023-03-13,756374106.0,bening lagi asmara anies didu saewad idha sir,Positive,bening lagi asmara didu saewad idha sir
