,Date,User ID,Tweet Count,Tweet Location,Tweet,label,city
5251,2023-02-12,118369562.0,950,,percaya bahwa pak ganjar memiliki kesempatan menjadi presiden di tahun mendatang,Positive,nan
5253,2023-02-11,3010314504.0,15008,Indonesia,nanti ini pilihanku ganjar pranowo presiden,Positive,Indonesia
5255,2023-02-11,3158832157.0,189,,giat hari ini relawan sdg sumsel menjalin silaturahmi dan sinergitas dengan pondok pesantren subulussalam palembang kamis,Positive,nan
5257,2023-02-11,3158832157.0,412,"Jawa Tengah, Indonesia",rt kabarkedan mendukung ganjar jadi presiden pranowo,Positive,Jawa Tengah
5263,2023-02-11,2361180614.0,31317,,kalau pendukung anies dan ganjar perang terus di medsos presiden yg terpilih di prabowo asal pendukung prabowo santun santun dan tidak ikutan perang,Negative,nan
5266,2023-02-11,306615832.0,943,,santri nusantara doakan ganjar presiden pranowo,Positive,nan
5267,2023-02-11,306615832.0,893,"DKI Jakarta, Indonesia",apa ni yang di lakuin mak ganjar jabar untuk mencegah stunting penasaran ga sini mak kasih tau follow kami di untuk informasi lain dm kami,Positive,DKI Jakarta
5268,2023-02-11,518598645.0,459,"East Java, Indonesia",selamat kepada pak ganjar atas terpilihnya menjadi presiden ri tahun,Positive,East Java
5269,2023-02-11,518598645.0,755,,pak ganjar for presiden,Negative,nan
5270,2023-02-11,518598645.0,232,,pak ganjar pranowo presiden pilihan kami,Negative,nan
5271,2023-02-11,306615832.0,447,"Bali, Indonesia",ratusan petani tebu madiun dukung ganjar presiden pranowo,Negative,Bali
5278,2023-02-11,306615832.0,1434,"Lampung, Indonesia",dukung ganjar presiden ganjar pranowo bersih for ganjar terbaik pranowo,Positive,Lampung
5280,2023-02-11,306615832.0,80565,"Sukoharjo, Indonesia",para kiai sepuh dan habaib di kabupaten sukabumi mendoakan gubernur menjadi presiden ri di pilpres mereka menilai cuma ganjar yg memenuhi kriteria baik dari sisi kinerja akhlak maupun pemikiran setujuhhhh,Positive,Sukoharjo
5286,2023-02-11,3158832157.0,1885,"Bandar Lampung, Lampung",dukung ganjar untuk menjadi presiden pranowo,Positive,Bandar Lampung
5293,2023-02-11,2950033490.0,333,"Nusa Tenggara Timur, Indonesia",mak ganjar untuk pak ganjar presiden gass sampai pelosok negri,Positive,Nusa Tenggara Timur
5299,2023-02-11,2950033490.0,366,,ada sesuatu yang sangat istimewa tentang berbagi,Positive,nan
5307,2023-02-11,73050180.0,1256,,presiden adalah ganjar pranowo,Negative,nan
5309,2023-02-11,306615832.0,1434,"Lampung, Indonesia",dukung ganjar presiden ganjar pranowo bersih for ganjar terbaik pranowo,Positive,Lampung
5311,2023-02-11,521408698.0,447,"Bali, Indonesia",ganjar layak dan pantas jadi presiden pranowo,Positive,Bali
5315,2023-02-11,1087876332.0,129657,,lembaga survei poltracking indonesia merilis hasil survei terkait simulasi bakal pasangan calon presidenwakil presiden potensial pasloncaprescawapres yang cukup potensial adalahganjar pranowodanerick thohir,Negative,nan
5319,2023-02-11,306615832.0,366,,bak ganjar pranowo selalu dihati dan di nanti harus jadi,Positive,nan
5321,2023-02-11,306615832.0,427,,wapres dan pak ganjar pranowo resmikan pusat layanan usaha terpadu kumkm di tuntang kabupaten semarang,Negative,nan
5322,2023-02-11,306615832.0,6579,,dukungan buat ganjar untuk jd presiden ri menggema di seluruh pelosok nusantara,Positive,nan
5323,2023-02-11,3189327655.0,447,"Bali, Indonesia",ganjarist optimis dan bersepakat bahwa ganjar pranowo adalah sosok terbaik yang bisa menggantikan presiden joko widodo jokowi pada nanti,Positive,Bali
5332,2023-02-11,3158832157.0,1885,"Bandar Lampung, Lampung",dukung ganjar untuk menjadi presiden pranowo,Positive,Bandar Lampung
5333,2023-02-11,115807680.0,1083,"Nusa Tenggara Timur, Indonesia",ganjar pemimpin yang mempunyai banyak prestasi membuat dia layak menjadi presiden pranowo,Positive,Nusa Tenggara Timur
5339,2023-02-11,1054725038.0,4181,"Bali, Indonesia",yuk kita ramaikan kegiatan vote luar biasa untuk ganjar yang berlangsung pada jumat desember mari kita menangkan ganjar pranowo untuk presiden yang benar pilih ganjar,Positive,Bali
5342,2023-02-11,64605516.0,307495,"Jakarta Pusat, DKI Jakarta",smash voli ganjar hadir di kota sukabumi jawa barat yuk kita ramaikan kegiatan vote luar biasa untuk ganjar yang berlangsung pada jumat desember mari kita menangkan untuk presiden yang benar pilih ganjar,Positive,Jakarta Pusat
5348,2023-02-10,444353411.0,6119,,yang bisa menggantikan sosok presiden jokowi haruslah orang yang bisa melanjutkan kinerjanya dan ganjarist optimis bahwa sosok ganjar pranowo bisa maju dan bahkan menang dalam pilpres nanti,Positive,nan
5352,2023-02-10,567132989.0,214,,ganjarist telah bersepakat bahwa ganjar pranowo adalah sosok terbaik yang bisa menggantikan presiden joko widodo pada nanti untuk itu kami terus bergerak dan optimis perjuangan kami akan membuahkan hasil yang baik ganjarist optimis,Positive,nan
5353,2023-02-10,567132989.0,321512,Indonesia,ganjarist beserta sayapsayapnya tersebut merupakan organisasi relawan dari berbagai lapisan masyarakat yang secara sadar mendorong gubernur jawa tengah ganjar pranowo sebagai presiden pada nanti ganjarist optimis,Positive,Indonesia
5356,2023-02-10,216690473.0,4166,,relawan ganjarist yang terus bergerak menggaungkan ganjar pranowo penerus presiden jokowi ganjarist optimis pak ganjar akan jadi ri di nanti ayo ganjarist terus optimis,Positive,nan
5357,2023-02-10,306615832.0,111,,kelompok relawan ganjarist terus mendorong gubernur jawa tengah ganjar pranowo dalam pemilihan presiden pilpres nanti ganjarist optimis,Positive,nan
5359,2023-02-10,306615832.0,25664,"Jawa Barat, Indonesia",ganjarist beserta sayapsayapnya merupakan organisasi relawan dari berbagai lapisan masyarakat yang secara sadar mendorong ganjar pranowo sebagai presiden pada nanti ganjarist optimis,Positive,Jawa Barat
5361,2023-02-10,306615832.0,166,Indonesia,untuk relawan pak ganjar mantap deh menyosialisaikan pak ganjar sebagai kandidat calon presiden dan bijaknya adalah dengan menebar kebaikan dan bermanfaat bagi siapapun patut digugu dan ditiru nih ganjarist optimis,Positive,Indonesia
5362,2023-02-10,436200155.0,140,Indonesia,menyosialisaikan pak ganjar sebagai kandidat calon presiden dan bijaknya adalah dengan menebar kebaikan dan bermanfaat bagi siapa pun alright sir ganjarist optimis,Positive,Indonesia
5368,2023-02-10,2583033110.0,167,,ganjarist sukoharjo gelar silaturahmi optimis bergerak amp hadir dlm kemanusiaan ini merupakan salah satu cara kami mensosialisaikan pak ganjar sbgai kandidat calon presiden yaitu menebar kebaikan amp bermanfaat bagi siapapun ganjarist optimis,Positive,nan
5381,2023-02-10,306615832.0,311,,ganjarist mendeklarasikan dukungannya pada gubernur jawa tengah ganjar prabowo untuk maju sebagai calon presiden pada pemilu ganjarist optimis,Positive,nan
5386,2023-02-10,97885984.0,221,,nah ini baru mantul gaes dimana satuan relawan ganjarist sukoharjo gelar silaturahmi ganjarist optimis akan terus bergerak menyampaikan kinerja positif ganjar pranowo ganjar pranowo presiden,Positive,nan
5394,2023-02-10,91696918.0,296,,kami relawan ganjarist optimis bersama rakyat ganjar pranowo presiden ri nanti,Positive,nan
5397,2023-02-10,2838677479.0,37265,"Medan Kota, Indonesia",ganjar pranowo adalah capres yg potensial melanjutkan visi jokowi ganjarist beserta sayapsayapnya tersebut merupakan organisasi relawan dari berbagai lapisan masyarakat yang secara sadar mendorong gubernur jateng ganjar pranowo sebagai presiden pada ganjarist optimis,Positive,Medan Kota
5408,2023-02-10,486675146.0,245,,karena itu sebagai relawan jangan pernah menuntut untuk diberi tetapi berilah apa yang kita miliki untuk proses pemenangan ganjar pranowo sebagai presiden ri yang ke periode ganjarist optimis,Positive,nan
5418,2023-02-10,1687292678.0,167,,ganjarist optimis masalah ganjar pranowo jadi presiden pada ini adalah masalah bagaimana indonesia bebas dari radikalisme tetap terjaga kebhinnekaan persaudaraan antar anakbangsa kesamaan hak dan soal masa depan indonesia yang lebih baik,Positive,nan
5424,2023-02-10,715696111.0,37265,"Medan Kota, Indonesia",ganjarist optimis dan bersepakat bahwa ganjar pranowo adalah sosok terbaik yang bisa menggantikan presiden joko widodo jokowi pada nanti ganjar pranowo capres terbaik untuk krn sdh terbukti anti intoleransi selama menjabat jadi gubernur jateng,Positive,Medan Kota
5429,2023-02-10,1687292678.0,122,"Maros, Sulawesi Selatan",makganjar sulawesi selatan berbagi kebaikan,Positive,Maros
5432,2023-02-10,67265827.0,427,,ganjar pranowo diundang mudamuda budhis se indonesia soal kebangsaan,Negative,nan
5444,2023-02-10,92330754.0,497,Banten,ganjar pranowo calon terbaik untuk menjadi next presiden di pranowo,Positive,Banten
5449,2023-02-10,3038503512.0,189,,sdg sumsel salurkan bantuan sembako kepada lembaga panti asuhan di sumatera selatan,Negative,nan
5451,2023-02-09,2400825584.0,189,,sdg sumsel kembali bersafari menggalang dukungan untuk ganjar pranowo di sumatera selatan,Positive,nan
5458,2023-02-09,46693036.0,273,,kegiatan sparing basket bersama milenial kabupaten soppeng,Negative,nan
5493,2023-02-09,306615832.0,427,,demi keselamatan rakyat nya ganjar pranowo menghimbau agar hatihati merayakan tahun baru karena melihat cuaca yang sedang ekstrim akhiakhir ini,Positive,nan
5500,2023-02-09,1321955280.0,956,,doa yg dipanjatkan oleh para santri semoga barokah dan mampu mempermudah jalannya pak ganjar menjadi presiden nnti di mendatang aamiin,Positive,nan
5504,2023-02-09,244402020.0,619,,semoga doa bersama para santri dan barokah kemudahan bagi pak ganjar menjadi presiden di tahun mendatang,Positive,nan
5509,2023-02-09,2376831162.0,46898,,soal ganjar didesain untuk jadi presiden pada ipr saya sudah lama memprediksi itu,Positive,nan
5514,2023-02-09,306615832.0,339,"Ciracas, Indonesia",soal ganjar didesain untuk jadi presiden pada ipr saya sudah lama memprediksi itu,Positive,Ciracas
5519,2023-02-09,306615832.0,1885,"Bandar Lampung, Lampung",bismillah yok pak ganjar for presiden pranowo,Negative,Bandar Lampung
5520,2023-02-09,233451839.0,1885,"Bandar Lampung, Lampung",ganjar pranowo pantas jadi presiden pranowo,Negative,Bandar Lampung
5523,2023-02-09,3236618732.0,1885,"Bandar Lampung, Lampung",dukung ganjar untuk menjadi presiden pranowo,Positive,Bandar Lampung
5540,2023-02-09,236026399.0,6011,,soal desain pemilu muluskan ganjar presiden pks tuntut hasyim asyari jujur kepada publik kata fadli zon harus segera dilaporkan,Positive,nan
5542,2023-02-08,306615832.0,333,"Nusa Tenggara Timur, Indonesia",mak ganjar untuk pak ganjar berbagi kasih berbagi kebaikan untuk negri doc canvasing mak ganjar ntt flotim wotan ulumadowailebe info,Positive,Nusa Tenggara Timur
5562,2023-02-08,306615832.0,224141,Indonesia,soal desain pemilu muluskan ganjar presiden fadli zon harus segera dilaporkan,Positive,Indonesia
5567,2023-02-08,4699258362.0,1042,,perjuangan momentum terciptanya kemenangan presiden pak ganjar dan juga pdip berjaya,Negative,nan
5568,2023-02-08,114697372.0,14119,,prank jokowi untuk ps kalo kita amati seluruh buzzerp anjing peliharaan kompak usung ganjar bokep si rambut putih gak ada dukungan mereka ke ps diperkuat lagi dengan terbongkarnya settingan kpu ri untuk ganjar bokep sebagai presiden ri ps harus kerja keras sendiri,Positive,nan
5573,2023-02-08,1575046236.0,19924,Jakarta,coba cek lg tanggal nya baik deklarasi oktober acara bagi sembako dgn tulisan ganjar utk presiden dilakukan setelah deklarasi gak susah koq mencari berita nya klo mau,Positive,Jakarta
5574,2023-02-08,3551565558.0,1164,,pak ganjar ini menang bisa dipercaya menjadi presiden nanti,Positive,nan
5577,2023-02-08,306615832.0,2101,"Nusa Tenggara Barat, Indonesia",ganjar pranowo presiden indonesia pranowo,Positive,Nusa Tenggara Barat
5583,2023-02-08,46693036.0,95624,???? Pancasila,doa untuk indonesia dan ganjar pranowo presiden tahun dipanjatkan bersama santri santriwati dan masyarakat kota bandar lampung,Positive,???? Pancasila
5587,2023-02-08,3158832157.0,26556,Indonesia,sejuta doa santri nusantara untuk ganjar pranowo presiden di insyaallah cukup satu putaran,Positive,Indonesia
5591,2023-02-08,306615832.0,1434,"Lampung, Indonesia",kapan lagi punya presiden terbaik setelah jkw dukung ganjar terbaik maju pranowo,Positive,Lampung
5601,2023-02-08,124171593.0,447,"Jakarta Pusat, DKI Jakarta",perjuangan mari kita dukung dan kawal terus pak ganjar pranowo sampai maju di pilpres dan menjadi presiden ri ke,Positive,Jakarta Pusat
5610,2023-02-08,470864298.0,339,"Ciracas, Indonesia",hot news ketua kpu sebut ganjar sudah disiapkan jadi presiden rocky gerung angkat bicara,Positive,Ciracas
5619,2023-02-07,114697372.0,97335,,hot news ketua kpu sebut ganjar sudah disiapkan jadi presiden rocky gerung angkat bicara,Positive,nan
5644,2023-02-07,2385926900.0,15126,"Ponorogo, Indonesia",pks tuntut hasyim asyari jujur kepada publik soal desain ganjar presiden,Positive,Ponorogo
5666,2023-02-07,1609075705.0,1885,"Bandar Lampung, Lampung",kita kawal ganjar for presiden pranowo,Positive,Bandar Lampung
5672,2023-02-07,2703213439.0,2101,"Nusa Tenggara Barat, Indonesia",warga desa sulteng juga mndukung ganjar presiden pranowo,Negative,Nusa Tenggara Barat
5675,2023-02-07,306615832.0,176772,Indonesia,lembaga survei poltracking indonesia merilis hasil survei terkait simulasi bakal pasangan calon presidenwakil presiden potensial paslon caprescawapres yang cukup potensial adalah ganjar pranowo dan,Negative,Indonesia
5676,2023-02-07,306615832.0,1274,Seoul,para baju pinky mendukung pak ganjar dengan cinta untuk menjadi presiden,Positive,Seoul
5678,2023-02-07,2391012962.0,906,"Kota Medan, Sumatera Utara",pengemudi ojol dukung ganjar jadi presiden pranowo,Positive,Kota Medan
5679,2023-02-07,69183155.0,906,"Kota Medan, Sumatera Utara",ganjar sangat didukung masyarakat untuk jadi presiden pranowo,Positive,Kota Medan
5681,2023-02-07,990237626.0,14119,,kalo mmg benar sudah di design kayak gitu saran gue bagaimana kalo kita rame buat amp pasang spanduk yg isinya ucapan selamat kpd ganjar bokep amp erik bumn sebagai presidenwapres ri jadi gak usah ada pemilu buang duit rakyat lebih bagus lagi nkri tanpa presiden,Positive,nan
5689,2023-02-07,17128975.0,3294,"Denpasar Selatan, Indonesia",mantap masyarakat palu siap dukung ganjar presiden pranowo,Positive,Denpasar Selatan
5695,2023-02-06,2425211274.0,38642,,pks tuntut hasyim asyari jujur kepada publik soal desain ganjar presiden seharusnya kepengurusan kpu dibubarkan dan ganti pengurus baru yang netral,Positive,nan
5698,2023-02-06,756374106.0,374752,Indonesia,pks tuntut hasyim asyari jujur kepada publik soal desain ganjar presiden,Positive,Indonesia
5703,2023-02-06,30617522.0,1219,,sudah mantap pilih ganjar pranowo sebagai presiden pilihan cerdas generasi putih,Positive,nan
5708,2023-02-06,2894429496.0,619,,doa bersama warga asahan untuk ganjar menjadi presiden ri pranowo,Positive,nan
5720,2023-02-06,3158832157.0,376,,ribuan relawan ganjar dan ulama di malang gelar shalawat bersama dukung ganjar jadi presiden ri pranowo,Positive,nan
5742,2023-02-06,99431471.0,5630,Indonesia,calon presiden mantap pak ganjarsy siap jadi pendukung mu pemalang hadir,Positive,Indonesia
5754,2023-02-06,243567232.0,911,Maluku Utara,jbi the next presiden ganjar pranowo for pranowo,Positive,Maluku Utara
5758,2023-02-06,474704760.0,1434,"Lampung, Indonesia",kapan lagi punya presiden terbaik setelah jkw dukung ganjar terbaik maju pranowo,Positive,Lampung
5765,2023-02-06,109149190.0,1885,"Bandar Lampung, Lampung",bismillah yok pak ganjar for presiden pranowo,Negative,Bandar Lampung
5767,2023-02-06,135049271.0,447,"Bali, Indonesia",ganjar calon presiden pilihan rakyat dan didukung semua kalangan pranowo,Positive,Bali
5772,2023-02-06,69183155.0,1389,"Tanah Abang, Indonesia",pak ganjar pranowo memang sosok yang pantas untuk memimpin negeri ini banyak masyarakat yang mendukung beliau untuk maju di pilpres dan menjadi presiden ri ke,Positive,Tanah Abang
5782,2023-02-06,2893917372.0,753,,ganjar terbukti paling merakyat hasil survei smrc menunjukkan bahwa ganjar tokoh yang paling disukai rakyat menjadi presiden lock her up kim taehyung got the beat aib sooyoung gisele jihyo yoona tiffany jung hoseok alpha male taemin thank you dokyeom hyoyeon,Positive,nan
5787,2023-02-06,852327811.0,7,,lagi dan lagi elektabilitas survei calon presiden menunjukkan ganjar pranowo berada di kedudukan pertama kali ini dikeluarkan oleh charta politika indonesia gubernur jawa tengah itu menjadi capres idaman rakyat negeri ini jangan lupakan prestasi yang sedabrek,Negative,nan
5791,2023-02-06,2394584420.0,293,Bondowoso,ayo kita dukung pak ganjar pranowo untuk jadi presiden ri pranowo,Positive,Bondowoso
5793,2023-02-05,554297603.0,293,Bondowoso,selalu ada dukungan untuk ganjar pranowo jadi presiden ri pranowo,Positive,Bondowoso
5795,2023-02-05,270714651.0,376,,santri kyai dan ulama dukung ganjar jadi presiden ri pranowo,Positive,nan
5797,2023-02-05,4799732815.0,619,,kyai di bojonegoro dukung ganjar pranowo jadi presiden ri pranowo,Positive,nan
5798,2023-02-05,3193551429.0,376,,kyai muda di bojonegoro dukung deklarasi ganjar sebagai presiden indonesia pranowo,Positive,nan
5801,2023-02-05,4142445852.0,5818,Surabaya,charta politika jadi cawapres ganjar pranowo prabowo bisa menang pilpres satu putaran ketua umum partai gerindra prabowo subianto berpotensi memenangkan pemilihan presiden pilpres jika saja bersedia menjadi calon wakil presiden dari gubernur,Positive,Surabaya
5805,2023-02-05,46693036.0,1366,,saya dukung pak mencalonkan jadi capres tapi saya bakal pilih pak jadi presiden ri semoga mereka berdua nanti bisa menyatukan seluruh rakyat indonesia yg skrg sudah terkotak kotak sehat selalu pak ganjar pak anies,Positive,nan
5806,2023-02-05,2332839883.0,46794,,survei charta politika memperlihatkan empat simulasi sejumlah nama pasangan calon presiden dan wakil presiden caprescawapres pilpres hasilnya gubernur jawa tengah ganjar pranowo selalu menang besar siapapun pasangannya raihan tertinggi,Positive,nan
5811,2023-02-05,84994008.0,18487,,elektabilitas pak semakin tak terbendung hal ini membuktikan bahwa masyarakat menghendaki sosok gubernur jawa tengah ganjar pranowo menjadi presiden ri untuk calon lain mah semakin jauh ketinggal gassss,Positive,nan
5812,2023-02-05,2691990056.0,151,Banda Aceh,pak ganjar paling oke untuk presiden,Positive,Banda Aceh
5839,2023-02-05,3277399364.0,1885,"Bandar Lampung, Lampung",kita kawal ganjar for presiden pranowo,Positive,Bandar Lampung
5840,2023-02-05,2917057741.0,1885,"Bandar Lampung, Lampung",bismillah yok pak ganjar for presiden pranowo,Negative,Bandar Lampung
5843,2023-02-05,1538415270.0,1885,"Bandar Lampung, Lampung",dukung ganjar untuk menjadi presiden pranowo,Positive,Bandar Lampung
5844,2023-02-05,3116523529.0,295,"Palembang, Sumatera Selatan",relawan dukung ganjar presiden pranowo,Negative,Palembang
5847,2023-02-05,111544213.0,54107,"DKI Jakarta, Indonesia",ustaz sahabat usbat ganjar mengadakan istighosah amp doa bersama serta memberikan santunan terhadap yatim piatu amp dhuafa di desa sipaku area sumatera utara acara tsb merupakan bagian dari rangkaian deklarasi dukungan utk presiden,Positive,DKI Jakarta
5848,2023-02-05,2521720094.0,15008,Indonesia,untuk indonesia yg lebih maju hebat dan kuat ganjar presiden adalah pilihan tepat,Positive,Indonesia
5853,2023-02-05,3158832157.0,3238,,ratusan ulama dari golongan tuan guru dan masyarakat bersatu menyuarakan aspirasi ganjar presiden,Positive,nan
5861,2023-02-05,3319260420.0,684,,gubernur jateng ganjar pranowo insya allah bisa menjadi presiden ri aamiin aamiin aamiin aamiin aamiin aamiin aamiin,Positive,nan
5866,2023-02-05,72010193.0,189,,giat hari ini sdg sumsel datangi pengajian ibuibu di ogan komering ilir dan masyarakat miskin di musi rawas,Negative,nan
5869,2023-02-05,2703213439.0,366,,tetap ceria dan bahagia ketika dalam perjalanan menuju kebaikan,Positive,nan
5876,2023-02-05,634227637.0,342,,nama ganjar pranowo sebagai calon presiden selalu teratas,Positive,nan
5878,2023-02-05,79984762.0,343,,nama ganjar pranowo sebagai calon presiden selalu teratas,Positive,nan
5890,2023-02-04,843862123.0,1885,"Bandar Lampung, Lampung",dukung ganjar untuk menjadi presiden pranowo,Positive,Bandar Lampung
5892,2023-02-04,157926162.0,1274,"Bengkulu, Indonesia",mantap ganjar pranowo cocok jadi presiden pranowo,Positive,Bengkulu
5899,2023-02-04,156295569.0,295,"Palembang, Sumatera Selatan",dukung ganjar pranowo jadi presiden pranowo,Positive,Palembang
5900,2023-02-04,60329492.0,1428,papua barat,ganjar calon presiden pranowo,Positive,papua barat
5909,2023-02-04,256434417.0,1161349,Indonesia,hasil survei terbaru smrc tren suara untuk puan maharani sebagai bakal calon presiden melemah ganjar pranowo konsisten menempati peringkat pertama,Negative,Indonesia
5912,2023-02-04,1087876332.0,200,"Jember, Jawa Timur",komunitas peraga busana di maros gelar fashion show sekaligus deklarasi dukung ganjar presiden pernah rabu bobo the big di dingin argentina kaya raya ruu pprt train sore lee jeno beef,Positive,Jember
5919,2023-02-04,635867549.0,57933,,masyarakat pulau jawa ingin maju pilpres daya tarik ini di antaranya adalah memiliki hubungan dekat dengan presiden jokowi terus dikaitkan sebagai duet ganjar pranowo dan memiliki pengalaman kerja di pemerintahan,Positive,nan
5923,2023-02-04,2760921103.0,325,,ganjar dapat dukungan ulama banten jadi presiden pranowo,Positive,nan
5926,2023-02-04,2991016922.0,261,,ganjar dapat dukungan ulama banten jadi presiden pranowo,Positive,nan
5936,2023-02-04,306615832.0,105467,"Moscow, Russia",survei terbaru smrc menunjukkan pak masih menduduki peringkat pertama sebagai calon presiden dengan suara sebesar dari mei ke desember suara ganjar meningkat dari yang sebelumnya hallo buzerp firaunsehat kan,Positive,Moscow
5954,2023-02-04,1913042822.0,613,"Kalimantan Timur, Indonesia",memilih ganjar dan etho nantinya di jadi presiden amp wapres adalah pilihan yang rasional,Positive,Kalimantan Timur
5955,2023-02-04,3158832157.0,1256,,diy dukung ganjar di sebagai presiden ri,Positive,nan
5958,2023-02-04,3226946688.0,129,Aceh,gusgus nusantara deklarasi ganjar presiden indira ditto panglima tni jeno karina,Negative,Aceh
5962,2023-02-04,42432846.0,70,,gerakan anti korupsi pak ganjar rakyat dukung ganjar sudah pasti presiden pranowo,Positive,nan
5967,2023-02-04,60439335.0,125,,alasan kenapa menteri disebut pada pilpres kinerja dan prestasi beliau baik koneksi dg presiden jokowi dan ganjar pranowo di jateng masuk besar cawapres di pulau jawa dan menjadi anggota kehormatan banser et jawara di tanah jawa,Positive,nan
5978,2023-02-03,181571192.0,104,,ganjar for presiden pranowo,Positive,nan
5981,2023-02-03,3107745397.0,104,,ganjar membantu umkm pranowo,Positive,nan
5986,2023-02-03,500276997.0,144,"Central Borneo, Indonesia",orang muda ganjar kalimantan tengah mengadakan acara doa bersama lintas agama untuk bapak haji ganjar pranowo calon presiden,Negative,Central Borneo
5990,2023-02-03,2801993976.0,368,,siapa kita pak jokowi siapa kita pak ganjar presiden kita pak ganjar,Negative,nan
5994,2023-02-03,64635651.0,8,,saya semakin yakin kemampuan pak ganjar pranowo untuk memimpin indonesia menjadi presiden,Positive,nan
6005,2023-02-03,420391942.0,333,"Nusa Tenggara Timur, Indonesia",mak ganjar selalu setia untuk pak ganjar,Positive,Nusa Tenggara Timur
6007,2023-02-03,3306771829.0,198,,hasil rilis elektabilitas calon presiden di sejumlah lembaga survei kredibel indonesia selalu menempatkan ganjar pranowo teratas belum ditetapkan sebagai calon presiden saja sudah unggul apalagi iya kan,Positive,nan
6022,2023-02-03,18129942.0,1090,Banten,dukung ganjar pranowo sebagai presiden indonesia tahun pranowo,Positive,Banten
6025,2023-02-03,2558197662.0,1885,"Bandar Lampung, Lampung",bismillah yok pak ganjar for presiden pranowo,Negative,Bandar Lampung
6026,2023-02-03,786463285.0,1885,"Bandar Lampung, Lampung",ganjar pranowo pantas jadi presiden pranowo,Negative,Bandar Lampung
6036,2023-02-03,69183155.0,1528,"Way Kanan, Lampung",ganjar pranowo siap presiden pranowo,Positive,Way Kanan
6037,2023-02-03,375995332.0,26556,Indonesia,lagi dukungan warga jakarta untuk yg kampanye anies yg terus dapat dukungan ganjar terus bergerak ambil alih jakarta komunitas wartegpedagang pasar jakarta utara dukung ganjar jadi presiden,Positive,Indonesia
6040,2023-02-03,3189327655.0,190,,mak ganjar brebes,Negative,nan
6043,2023-02-03,2152266583.0,1133,"Kalimantan Tengah, Indonesia",gus gus nusantara blitar deklarasi ganjar presiden pranowo,Negative,Kalimantan Tengah
6054,2023-02-03,2703213439.0,122,"Maros, Sulawesi Selatan",makganjar sulawesi selatan berbagi kebaikan,Positive,Maros
6056,2023-02-03,144315786.0,28222,"Jakarta Utara, DKI Jakarta",deklarasi dukungan menjadi presiden lewat aksi kebudayaan kegiatan yg digelar di kabupaten bojonegoro jawa timur amp kabupaten maros sulawesi selatan ini menampilkan pertunjukan seni hingga lomba fashion show,Positive,Jakarta Utara
6074,2023-02-03,474977684.0,74,,gue yakin yang jadi presiden adalah pak ganjar pranowo,Positive,nan
6077,2023-02-03,85805755.0,107916,Indonesia,komunitas kolaborasi warteg kowarteg indonesia mengonsolidasikan dukungan ganjar presiden di pasar bambu kuning sunter agung tanjung priok,Positive,Indonesia
6079,2023-02-03,3158832157.0,1187,"Nusa Tenggara Timur, Indonesia",mari mendukung penuh pak ganjar jadi presiden pranowo,Positive,Nusa Tenggara Timur
6091,2023-02-02,704334060.0,951991,,kowarteg bersama ratusan pedagang pasar hingga tukang nasi goreng sejakarta utara memberikan dukungan untuk ganjar pranowo dalam pemilu presiden,Positive,nan
6095,2023-02-02,233451839.0,943,,emakemak di sulsel perkuat dukunhan ganjar prabowo presiden pranowo,Positive,nan
6097,2023-02-02,2558197662.0,1885,"Bandar Lampung, Lampung",kita kawal ganjar for presiden pranowo,Positive,Bandar Lampung
6100,2023-02-02,99365764.0,497,Banten,emakemak perkuat dukungan untuk ganjar pranowo presiden pranowo,Positive,Banten
6103,2023-02-02,402575852.0,744,,nakula semoga ganjar pranowo presiden,Positive,nan
