,Date,User ID,Tweet Count,Tweet Location,Tweet,label,Clean
4978,2023-02-25,252415154.0,125348,,pak anies bagus di kabinet presiden jokowi lanjut gub dki lanjut capres prabowo juga di kabinet jokowi dan pernah cawapres megawati dan juga ketua partai yg akan maju pemilu jadi sama maju capres nanti di nah terserah pemilih nanti,Positive,pak bagus di kabinet jokowi lanjut gub dki lanjut capres juga di kabinet jokowi dan pernah cawapres megawati dan juga ketua partai yg akan maju pemilu jadi sama maju capres nanti di nah terserah pemilih nanti
4982,2023-02-25,3533477712.0,37473,Indonesia,dukung prabowo subianto sebagai presiden republik indonesia,Positive,dukung subianto sebagai republik indonesia
4985,2023-02-25,576755999.0,293031,"Kebumen, Indonesia",atie iyes,Positive,atie iyes
4986,2023-02-25,576755999.0,293031,"Kebumen, Indonesia",atie lewat beliau sudah bamyak lahirkan pemimpin sekarang saatnya yang paling tepat beliau memimpin indonesia bissmillah,Negative,atie lewat beliau sudah bamyak lahirkan pemimpin sekarang saatnya yang paling tepat beliau memimpin indonesia bissmillah
5010,2023-02-25,235873212.0,3293,Banjarmasin Indonesia,inismyname fahnoor kalau nanti kandidat ada dan bpk masuk ke putaran kedua sptnya pak prabowo presiden ke doakan sehat aja para calon pemimpin ri yg benar menjaga nkri dgn kebhinekaan nya,Positive,inismyname fahnoor kalau nanti kandidat ada dan bpk masuk ke putaran kedua sptnya pak ke doakan sehat aja para calon pemimpin yg benar menjaga nkri dgn kebhinekaan nya
5013,2023-02-25,117449840.0,7244,SMS Only: 081388998480,chotimah pilih ridwan kamil sebagai presiden ri tahun nanti untuk indonesia yang hebat maju dan bersatu,Positive,chotimah pilih ridwan kamil sebagai tahun nanti untuk indonesia yang hebat maju dan bersatu
5015,2023-02-25,47596019.0,1699016,INDONESIA,hadiri rakorda gerindra sultra dasco ajak kader menangkan prabowo jadi presiden di pilpres,Positive,hadiri rakorda gerindra sultra dasco ajak kader menangkan jadi di pilpres
5018,2023-02-25,2341937407.0,130596,Permukaan Bumi ??,yap betul sekali gilagila emangnya gw udah sarap milih presiden ama caleg dprddpr ri dari lebih baik golput seumur hidup daripada milih mereka lagi,Positive,yap betul sekali gilagila emangnya gw udah sarap milih ama caleg dprddpr dari lebih baik golput seumur hidup daripada milih mereka lagi
5021,2023-02-25,1118334355.0,8234,,didu heryawan psrebo mohon maafkami hanya inginkan presiden kami,Positive,didu heryawan psrebo mohon maafkami hanya inginkan kami
5025,2023-02-24,3533477712.0,37473,Indonesia,indonesia membutuhkan kesinambungan sustainabaility pembangunan dukung prabowo ganjar sebagai presiden dan wakil presiden,Positive,indonesia membutuhkan kesinambungan sustainabaility pembangunan dukung sebagai dan wakil
5026,2023-02-24,3533477712.0,37473,Indonesia,dukung prabowo subianto sebagai presiden republik indonesia,Positive,dukung subianto sebagai republik indonesia
5029,2023-02-24,303583642.0,5977,Binjai ,prof bergerak dan soliditas untuk kemenangan partai golkar dan hrt presiden pada pemilu yuk semangat nurularifin,Positive,prof bergerak dan soliditas untuk kemenangan partai golkar dan hrt pada pemilu yuk semangat nurularifin
5033,2023-02-24,1058474317.0,48981,BANDAR LAMPUNG,sosok prabowo subianto kembali unggul sebagai bakal calon presiden pada pilpres versi survei lembaga geopolitik riset center grc,Negative,sosok subianto kembali unggul sebagai bakal calon pada pilpres versi survei lembaga geopolitik riset center grc
5036,2023-02-24,2416927724.0,6991,"Kuta, Indonesia",mujani setujudari awalpemilih anies ya dari kelompok ituitu sajapemilih pecundang kalitahun saya yakin akan terjadi hattrickkarena pemilihnya hanya pembenci presiden saat inibahkan bisa jadi berkurang dibanding karena pemuja pak sejati tak akan pilih anies,Negative,mujani setujudari awalpemilih ya dari kelompok ituitu sajapemilih pecundang kalitahun saya yakin akan terjadi hattrickkarena pemilihnya hanya pembenci saat inibahkan bisa jadi berkurang dibanding karena pemuja pak sejati tak akan pilih
5041,2023-02-24,2410032319.0,9571,Alam Bawah Sadar,karenanya adi beranggapan ketua umum dpp partai gerindra tersebut patut diperhitungkan dalam pemilihan presiden pilpres prabowo subianto prabowo pemersatu bangkit bersama,Positive,karenanya adi beranggapan ketua umum dpp partai gerindra tersebut patut diperhitungkan dalam pemilihan pilpres subianto pemersatu bangkit bersama
5067,2023-02-24,121143089.0,18712,"Old Trafford,Manchester",semoga saja dukungan yang di berikan presiden joko widodo memberikan dampak positif kepada prabowo subianto dalam mengarungi pemilihan presiden prabowo subianto,Positive,semoga saja dukungan yang di berikan joko widodo memberikan dampak positif kepada subianto dalam mengarungi pemilihan subianto
5068,2023-02-24,121143089.0,18712,"Old Trafford,Manchester",hal itu bisa di lihat dari elektabilitas prabowo subianto dalam pilpres prabowo menempati urutan pertama sebagai presiden indonesia prabowo subianto,Negative,hal itu bisa di lihat dari elektabilitas subianto dalam pilpres menempati urutan pertama sebagai indonesia subianto
5069,2023-02-24,121143089.0,18712,"Old Trafford,Manchester",pada pemilihan umum presiden nanti prabowo subianto kembali di calonkan oleh partai gerindra sebagai calon tunggal presiden republik indonesia prabowo subianto,Positive,pada pemilihan umum nanti subianto kembali di calonkan oleh partai gerindra sebagai calon tunggal republik indonesia subianto
5070,2023-02-24,567901123.0,12397,"Solok selatan, Sumatera Barat",loren aku jg gk yakin anies baswedan jd presiden berikutnya loren krn saya pernah mimpi nonton berita thn yg menyatakan presiden indonesia adl dgn wakilnya mhd,Negative,loren aku jg gk yakin jd berikutnya loren krn saya pernah mimpi nonton berita thn yg menyatakan indonesia adl dgn wakilnya mhd
5084,2023-02-24,79178176.0,26069,Jakarta Capital Region,kader gerindra semakin solid dan terus berjuang mewujudkan prabowo presiden dan gerindra menang,Positive,kader gerindra semakin solid dan terus berjuang mewujudkan dan gerindra menang
5088,2023-02-23,2887087309.0,15021,"DKI Jakarta, Indonesia",prabowo presiden,Negative,
5089,2023-02-23,2887087309.0,15021,"DKI Jakarta, Indonesia",prabowo presiden ingat pesan kami mrprabowonkri jgn sampe jatuh ketangan imigrant yamanlanjutkan apa yg telah anda rintis bersama jokowi dlm kabinet,Negative,ingat pesan kami mrprabowonkri jgn sampe jatuh ketangan imigrant yamanlanjutkan apa yg telah anda rintis bersama jokowi dlm kabinet
5090,2023-02-23,576755999.0,293031,"Kebumen, Indonesia",kumara alhamdulillah nanti jika beliau sudah di beri wewenang penuh,Positive,kumara alhamdulillah nanti jika beliau sudah di beri wewenang penuh
5098,2023-02-23,237292859.0,166,Aceh,langsung sja tanpa senggol kiri kanan presiden ri di,Positive,langsung sja tanpa senggol kiri kanan di
5100,2023-02-23,228317213.0,6794,Bandung-Bengkulu-Purwakarta,semoga presiden terpilih bukan dari kubu ini walaupun imposible juga sih,Positive,semoga terpilih bukan dari kubu ini walaupun imposible juga sih
5102,2023-02-23,1390109701.0,12125,World's City of Batik,raw min kalo pak prabowo mau nyalon presiden kabar ya,Negative,raw min kalo pak mau nyalon kabar ya
5103,2023-02-23,2226785863.0,254,"Jawa Timur, Indonesia",ini kayaknya sdh cukup jadi polling surve siapa yg akan jd presiden,Positive,ini kayaknya sdh cukup jadi polling surve siapa yg akan jd
5116,2023-02-23,57261519.0,1173653,,kata om ichu sampai saat ini cuma anies baswedan nih yang benarbenar punya tiket sebagai calon presiden caloncalon lain sepertinya masih seperti layanglayang putus saksikan hanya di youtube metrotvnews,Negative,kata om ichu sampai saat ini cuma nih yang benarbenar punya tiket sebagai calon caloncalon lain sepertinya masih seperti layanglayang putus saksikan hanya di youtube metrotvnews
5135,2023-02-23,456426648.0,769171,Indonesia,ketiga nama ini turut meramaikan bursa calon presiden di pemilu diambil dari lima lembaga survei berikut perkembangandata terkini terkait elektabilitas anies prabowo dan ganjar,Negative,ketiga nama ini turut meramaikan bursa calon di pemilu diambil dari lima lembaga survei berikut perkembangandata terkini terkait elektabilitas dan
5143,2023-02-23,15256823.0,137121,"Tangerang, Banten",sinyal restu berpasangan diberikan presiden jokowi utk prabowoerick bahkan presiden ungkapkan di dlm kabinet prabowo amp mendptkan dukungan utk ikut bertarung pd pilpres mendatang,Positive,sinyal restu berpasangan diberikan jokowi utk prabowoerick bahkan ungkapkan di dlm kabinet amp mendptkan dukungan utk ikut bertarung pd pilpres mendatang
5148,2023-02-23,2950549608.0,37265,"Medan Kota, Indonesia",menhan dan menteri bumn dinilai memiliki peluang besar berduet menjadi capres dan cawapres pada pilpres keduanya disebut presiden saat menghadiri acara bersama para pengusaha himpunan pengusaha muda indonesia hipmi,Positive,menhan dan menteri bumn dinilai memiliki peluang besar berduet menjadi capres dan cawapres pada pilpres keduanya disebut saat menghadiri acara bersama para pengusaha himpunan pengusaha muda indonesia hipmi
5169,2023-02-23,326453024.0,48726,,penyebutan nama menteri pertahanan prabowo subianto dan menteri bumn erick thohir oleh presiden jokowi sebagai figur yang maju sebagai capres cawapres dinilai sebagai sinyal dukungan untuk keduanya berpasangan pada kontestasi pilpres,Positive,penyebutan nama menteri pertahanan subianto dan menteri bumn erick thohir oleh jokowi sebagai figur yang maju sebagai capres cawapres dinilai sebagai sinyal dukungan untuk keduanya berpasangan pada kontestasi pilpres
5178,2023-02-22,252415154.0,125348,,setelah duduk menjabat menhan dlm kabinet jokowi yaa bekerja keras sesuai dengan tupoksi sebagai menhan di kabinet dan berada dibawah presiden siapapun dia sbg presidennya yaitu presiden jokowi ini benar keputusan menjalankan tugas sebagai menhan sampai pemilu,Positive,setelah duduk menjabat menhan dlm kabinet jokowi yaa bekerja keras sesuai dengan tupoksi sebagai menhan di kabinet dan berada dibawah siapapun dia sbg presidennya yaitu jokowi ini benar keputusan menjalankan tugas sebagai menhan sampai pemilu
5187,2023-02-22,252415154.0,125348,,itcomm semua tanpa keterkecualian bekerja di pemerintahan presiden jokowi mulai mulai dari jabatan kepala desa sampai kepala daerah termasuk anis baswedan sebagai mendikbud dan gubkada dki jadi gosah mandi bersih bau sabunnya masih nempel kok,Positive,itcomm semua tanpa keterkecualian bekerja di pemerintahan jokowi mulai mulai dari jabatan kepala desa sampai kepala daerah termasuk sebagai mendikbud dan gubkada dki jadi gosah mandi bersih bau sabunnya masih nempel kok
5237,2023-02-22,89877164.0,346611,"Jakarta, Indonesia",prabowo minta izin presiden maju di pilpres musni umar yang bukan menteri dan gubernur minta dukungan ulama dan rakyat,Positive,minta izin maju di pilpres musni umar yang bukan menteri dan gubernur minta dukungan ulama dan rakyat
5240,2023-02-22,2887087309.0,15021,"DKI Jakarta, Indonesia",prabowo presiden,Negative,
5251,2023-02-21,30617522.0,449091,"Jakarta, Indonesia",dianggap titisan soeharto prabowo diidamkan jadi presiden,Positive,dianggap titisan soeharto diidamkan jadi
5260,2023-02-21,215989357.0,7454,,gerindra kalau petani mau makmur pilih prabowo jadi presiden cnn indonesia,Positive,gerindra kalau petani mau makmur pilih jadi cnn indonesia
5272,2023-02-21,552523769.0,158642,Jakarta,pkb gadang cak imin presiden wakilnya bisa prabowo atau anies,Negative,pkb gadang cak imin wakilnya bisa atau
5280,2023-02-21,576755999.0,293031,"Kebumen, Indonesia",fahnoor yes,Positive,fahnoor yes
5282,2023-02-21,51948529.0,8940,Jakarta,survey amp polling indonesia spin merilis survei terbaru elektabilitas bakal capres hasil survei menunjukkan prabowo subianto menjadi sosok yang paling dipilih sebagai presiden apabila pemilu digelar sekarang,Negative,survey amp polling indonesia spin merilis survei terbaru elektabilitas bakal capres hasil survei menunjukkan subianto menjadi sosok yang paling dipilih sebagai apabila pemilu digelar sekarang
5284,2023-02-21,55507370.0,381001,Pulo Gadung,wakil ketua umum pkb jazilul fawaid berharap agar ketua umum pkb cak imin terpilih menjadi presiden di pilpres simak berita selengkapnya di politik,Positive,wakil ketua umum pkb jazilul fawaid berharap agar ketua umum pkb cak imin terpilih menjadi di pilpres simak berita selengkapnya di politik
5288,2023-02-21,465458275.0,12086,Pulau Impian,berita prabowo lantik pengurus ranting se kecamatan sinar peninjauan partai gerindra siap menangkan prabowo subianto presiden dan marjito bupati oku pada pemilu liputan online,Positive,berita lantik pengurus ranting se kecamatan sinar peninjauan partai gerindra siap menangkan subianto dan marjito bupati oku pada pemilu liputan online
5290,2023-02-21,465280582.0,13675,jakarta,ketua relawan jokowi hingga puluhan ormas di jabar dukung prabowo subianto presiden,Positive,ketua relawan jokowi hingga puluhan ormas di jabar dukung subianto
5293,2023-02-20,465458275.0,12086,Pulau Impian,berita prabowo pkb berharap prabowo subianto muhaimin presiden dan wapres suara pemred,Positive,berita pkb berharap subianto muhaimin dan wapres suara pemred
5296,2023-02-20,576755999.0,293031,"Kebumen, Indonesia",inismyname fahnoor agung ya dan semoga presiden,Positive,inismyname fahnoor agung ya dan semoga
5297,2023-02-20,576755999.0,293031,"Kebumen, Indonesia",inismyname fahnoor agung ngomong presiden,Negative,inismyname fahnoor agung ngomong
5308,2023-02-20,137560294.0,1932,"Denver, CO",kami kader partai gerindra jakarta timur siap memperjuangkan dan memenangkan pak prabowo menjadi presiden prabowo subianto,Positive,kami kader partai gerindra jakarta timur siap memperjuangkan dan memenangkan pak menjadi subianto
5309,2023-02-20,157865745.0,3762,,kami kader partai gerindra jakarta timur siap memperjuangkan dan memenangkan pak prabowo menjadi presiden prabowo subianto,Positive,kami kader partai gerindra jakarta timur siap memperjuangkan dan memenangkan pak menjadi subianto
5328,2023-02-20,3270373243.0,5038,Hotel Aston Cirebon,kami kader partai gerindra jakarta timur siap memperjuangkan dan memenangkan pak prabowo menjadi presiden prabowo subianto,Positive,kami kader partai gerindra jakarta timur siap memperjuangkan dan memenangkan pak menjadi subianto
5335,2023-02-20,97205349.0,23930,Pati - Central Java,fahnoor inismyname agung mpu aku pilih dan dukung pak prabowo dah kali lho matian belain beliau selama sd dan besok aku pilih pak anies jadi presiden,Positive,fahnoor inismyname agung mpu aku pilih dan dukung pak dah kali lho matian belain beliau selama sd dan besok aku pilih pak jadi
5374,2023-02-20,890900204.0,14140,Sosial Tuit Regional Tangerang,dpc papera garut kobarkan gerakan pedagang dukung prabowo presiden don muzakir fokus kuasai teritorial pasar rakyat,Positive,dpc papera garut kobarkan gerakan pedagang dukung don muzakir fokus kuasai teritorial pasar rakyat
5386,2023-02-19,100294200.0,30213,Jember Jawa Timur Indonesia,panaskan mesin partai gerindra jember bersama puluhan ribu massa mlaku bareng prabowo jember panaskan mesin jelang pemilihan umum pemilu legislatif dan presiden ribuan simpatisan partai gerakan indonesia raya,Positive,panaskan mesin partai gerindra jember bersama puluhan ribu massa mlaku bareng jember panaskan mesin jelang pemilihan umum pemilu legislatif dan ribuan simpatisan partai gerakan indonesia raya
5397,2023-02-19,465280582.0,13675,jakarta,usung prabowo subianto calon presiden koalisi antarpartai masih dinamis,Positive,usung subianto calon koalisi antarpartai masih dinamis
5398,2023-02-19,465458275.0,12086,Pulau Impian,prabowo subianto usung prabowo subianto calon presiden koalisi antarpartai masih dinamis,Positive,subianto usung subianto calon koalisi antarpartai masih dinamis
5400,2023-02-19,70412517.0,12973,,malming nonton film adagium dengan pimpinan insya allah pak prabowo jadi presiden,Positive,malming nonton film adagium dengan pimpinan insya allah pak jadi
5413,2023-02-19,2887087309.0,15021,"DKI Jakarta, Indonesia",prabowo presiden,Negative,
5416,2023-02-19,465280582.0,13675,jakarta,deklarasi dukung prabowo subianto jadi presiden gerindra muba gelar khitanan masal,Positive,deklarasi dukung subianto jadi gerindra muba gelar khitanan masal
5417,2023-02-19,64635651.0,317655,Aceh,presiden jokowi menyampaikan sosok seperti prabowo subianto erick thohir sandi uno hingga mahfud md merupakan tokoh potensial di pilpres mendatang,Negative,jokowi menyampaikan sosok seperti subianto erick thohir sandi uno hingga mahfud md merupakan tokoh potensial di pilpres mendatang
5420,2023-02-19,1714809612.0,7719,Surabaya   ,gerindra gelar pesta rakyat di banten minta dukung prabowo presiden detiknews,Positive,gerindra gelar pesta rakyat di banten minta dukung detiknews
5421,2023-02-19,1714809612.0,7719,Surabaya   ,deklarasi dukung prabowo jadi presiden gerindra muba gelar khitanan masal,Positive,deklarasi dukung jadi gerindra muba gelar khitanan masal
5422,2023-02-19,55507370.0,381001,Pulo Gadung,deklarasi dukung prabowo jadi presiden gerindra muba gelar khitanan masal,Positive,deklarasi dukung jadi gerindra muba gelar khitanan masal
5427,2023-02-19,465423257.0,4280,Indonesia,gerindra bertekad wujudkan prabowo jadi presiden gerbang politik,Positive,gerindra bertekad wujudkan jadi gerbang politik
5432,2023-02-18,465423257.0,4280,Indonesia,gerindra bantul prabowo presiden ini harga mati kedaulatan rakyat,Negative,gerindra bantul ini harga mati kedaulatan rakyat
5442,2023-02-18,378712353.0,1187,Jalan Emperan,prabowo presiden gerindra menang semangat selalu wahai kader muda yg selalu berjuang nyata untuk rakyat sehat selalu untuk kita semua,Positive,gerindra menang semangat selalu wahai kader muda yg selalu berjuang nyata untuk rakyat sehat selalu untuk kita semua
5444,2023-02-18,132078023.0,135309,iNews Tower,ketua kelompok relawan jokowi hingga ponpes dukung prabowo presiden,Positive,ketua kelompok relawan jokowi hingga ponpes dukung
5445,2023-02-18,465280582.0,13675,jakarta,ketua kelompok relawan jokowi hingga ponpes dukung prabowo subianto presiden okezone news,Positive,ketua kelompok relawan jokowi hingga ponpes dukung subianto okezone news
5446,2023-02-18,465458275.0,12086,Pulau Impian,prabowo subianto ketua kelompok relawan jokowi hingga ponpes dukung prabowo subianto presiden okezone news,Positive,subianto ketua kelompok relawan jokowi hingga ponpes dukung subianto okezone news
5448,2023-02-18,47274731.0,1962348,Jakarta,ketua kelompok relawan jokowi hingga ponpes dukung prabowo presiden,Positive,ketua kelompok relawan jokowi hingga ponpes dukung
5451,2023-02-18,1113101557.0,24239,DKI Jakarta,kir pkb presiden ri,Negative,kir pkb
5454,2023-02-18,775002890.0,318,"Semarang, Jawa Tengah",kalem bos dia gak akan jadi presiden presidennya prabowo wapresnya jokowi tonggo sekelurahan sumber,Positive,kalem bos dia gak akan jadi presidennya wapresnya jokowi tonggo sekelurahan sumber
5464,2023-02-18,1513488384.0,16205,"North Sumatra, Indonesia",presiden jokowi bertanya kepada ppp siapa kelak capres saat menghadiri harlah ke partai persatuan pembangunan di ice bsd tangerang banten jumat jokowi pun menyebut sejumlah nama mulai dari prabowo subianto dan erick thohir,Positive,jokowi bertanya kepada ppp siapa kelak capres saat menghadiri harlah ke partai persatuan pembangunan di ice bsd tangerang banten jumat jokowi pun menyebut sejumlah nama mulai dari subianto dan erick thohir
5465,2023-02-18,2950549608.0,37265,"Medan Kota, Indonesia",presiden jokowi membahas soal capres dan cawapres saat menghadiri harlah ke partai persatuan pembangunan ppp di ice bsd tangerang banten jumat jokowi pun menyebut sejumlah nama mulai dari prabowo subianto dan erick thohir,Positive,jokowi membahas soal capres dan cawapres saat menghadiri harlah ke partai persatuan pembangunan ppp di ice bsd tangerang banten jumat jokowi pun menyebut sejumlah nama mulai dari subianto dan erick thohir
5467,2023-02-17,2887087309.0,15021,"DKI Jakarta, Indonesia",prabowo presiden,Negative,
5489,2023-02-17,74347065.0,383,"Tangerang, Indonesia",seperti yg sudh presiden selanjutnya yg akan terpilih adalah presiden yg pro oligarki kalo pak prabowo pro oligarki pasti terpilih di,Positive,seperti yg sudh selanjutnya yg akan terpilih adalah yg pro oligarki kalo pak pro oligarki pasti terpilih di
5490,2023-02-17,3706597332.0,4995,,komunitas emakemak petani jagung kami bertekat mendukung dan memperjuangkan pak prabowo sebagai presiden republik indonesia prabowo subianto,Positive,komunitas emakemak petani jagung kami bertekat mendukung dan memperjuangkan pak sebagai republik indonesia subianto
5491,2023-02-17,2221519400.0,11983,,apa pun yang ibu yanni cita citakan kami dukung kami dukung partai gerindra dan kami juga sangat dukung bapak prabowo jadi presiden di mendatang prabowo subianto,Positive,apa pun yang ibu yanni cita citakan kami dukung kami dukung partai gerindra dan kami juga sangat dukung bapak jadi di mendatang subianto
5494,2023-02-17,2221519400.0,11983,,pada november presiden mengatakan kepada ribuan relawannya agar memilih pemimpin yang memikirkan rakyat pada prabowo subianto,Negative,pada november mengatakan kepada ribuan relawannya agar memilih pemimpin yang memikirkan rakyat pada subianto
5495,2023-02-17,2887087309.0,15021,"DKI Jakarta, Indonesia",prabowo presiden,Negative,
5508,2023-02-17,2887087309.0,15021,"DKI Jakarta, Indonesia",prabowo presiden,Negative,
5518,2023-02-17,79178176.0,26069,Jakarta Capital Region,selamat akun perjuangan prabowo presiden,Positive,selamat akun perjuangan
5519,2023-02-17,420144565.0,304,tangerang,kewibawaan mu kharisma mu sebagai abdi negara yang tulus tak akan pernah pudar salam hormat saya untuk bapak presiden,Positive,kewibawaan mu kharisma mu sebagai abdi negara yang tulus tak akan pernah pudar salam hormat saya untuk bapak
5520,2023-02-16,117449840.0,7244,SMS Only: 081388998480,pilih ridwan kamil sebagai presiden ri tahun nanti untuk indonesia yang hebat maju dan bersatu,Positive,pilih ridwan kamil sebagai tahun nanti untuk indonesia yang hebat maju dan bersatu
5523,2023-02-16,623534401.0,4872,"Dublin City, Ireland",semoga pak yohanies sehat selalu agar bisa melihat pak ganjar atau pak prabowo menjadi presiden indonesia,Positive,semoga pak yohanies sehat selalu agar bisa melihat pak atau pak menjadi indonesia
5532,2023-02-16,46693036.0,46804,,ketua umum dpp partai gerindra prabowo subianto menegaskan bahwa dirinya siap melanjutkan kepemimpinan presiden joko widodo pada saya berniat untuk meneruskan agar indonesia kuat makmur dan jaya katanya usai bertemu relawan jokowi mania,Positive,ketua umum dpp partai gerindra subianto menegaskan bahwa dirinya siap melanjutkan kepemimpinan joko widodo pada saya berniat untuk meneruskan agar indonesia kuat makmur dan jaya katanya usai bertemu relawan jokowi mania
5533,2023-02-16,100715895.0,12747,unfinished pyramid,selasa februari secara resmi ia menyatakan dukungannya terhadap ketua umum partai gerindraprabowo subiantountuk maju pada pemilihan presiden pilpres prabowo subianto,Positive,selasa februari secara resmi ia menyatakan dukungannya terhadap ketua umum partai gerindraprabowo subiantountuk maju pada pemilihan pilpres subianto
5534,2023-02-16,18071520.0,839828,NKRI,ketua umum dpp partai gerindra prabowo subianto menegaskan bahwa dirinya siap melanjutkan kepemimpinan presiden joko widodo pada,Positive,ketua umum dpp partai gerindra subianto menegaskan bahwa dirinya siap melanjutkan kepemimpinan joko widodo pada
5547,2023-02-16,3066596334.0,106,"Denpasar Timur, Indonesia",seseorang yang berani itu gembira,Positive,seseorang yang berani itu gembira
5558,2023-02-16,22126902.0,1953891,"Jakarta, Indonesia",abu janda siap membagikan uang rp juta jika prabowo tidak jadi presiden,Positive,abu janda siap membagikan uang rp juta jika tidak jadi
5559,2023-02-16,2887087309.0,15021,"DKI Jakarta, Indonesia",untuk mengatasi situasi politik indonesia yg terpolarisasi dan terpecah pecah nantinya saya percaya prabowo sosok yg tepat melanjutkan pemerintahan ini prabowo presiden,Negative,untuk mengatasi situasi politik indonesia yg terpolarisasi dan terpecah pecah nantinya saya percaya sosok yg tepat melanjutkan pemerintahan ini
5561,2023-02-16,47932498.0,9227,Jakarta - Indonesia,presiden terpilih nanti bisa belajar dari awalnya penuh tantangan namun akhirnya happy ending kita sudah dewasa dan harus berjiwa besar usahakan low cost dalam berpolitik agar bisa banyak membantu rakyat miskin tweet,Positive,terpilih nanti bisa belajar dari awalnya penuh tantangan namun akhirnya happy ending kita sudah dewasa dan harus berjiwa besar usahakan low cost dalam berpolitik agar bisa banyak membantu rakyat miskin tweet
5564,2023-02-16,106976813.0,172725,"Kupang, Indonesia",amien rais beda jalan dengan prabowo subianto kini dukung anies baswedan jadi presiden lewat,Positive,amien rais beda jalan dengan subianto kini dukung jadi lewat
5565,2023-02-16,4024621994.0,15607,,maju presiden pakkkk,Negative,maju pakkkk
5569,2023-02-15,71436318.0,675030,Indonesia,saat amien rais doakan prabowo subianto jadi presiden tapi dukung anies baswedan di pilpres,Positive,saat amien rais doakan subianto jadi tapi dukung di pilpres
5570,2023-02-15,69183155.0,2207026,"Jakarta, Indonesia",anies baswedan mengungkap soal perjanjian dengan prabowo bahwa tidak akan melawan prabowo di kontestasi pemilihan presiden apakah itu masih berlaku di,Positive,mengungkap soal perjanjian dengan bahwa tidak akan melawan di kontestasi pemilihan apakah itu masih berlaku di
5576,2023-02-15,128601792.0,81525,,antek asing semoga saat terpilih jadi presiden di thn nanti pak tetap membela rakyat dan bukan,Positive,antek asing semoga saat terpilih jadi di thn nanti pak tetap membela rakyat dan bukan
