,Date,User ID,Tweet Count,Tweet Location,Tweet,label,Clean
3030,2023-03-21,46693036.0,46802,,partai keadilan sejahtera pks tak ambil pusing atas langkah kepala badan intelijen negara bin budi gunawan yang turun gunung mendukung prabowo subianto agar bisa memenangi pemilihan presiden pilpres jadi siapapun calon yang diinginkan oleh,Positive,partai keadilan sejahtera pks tak ambil pusing atas langkah kepala badan intelijen negara bin budi gunawan yang turun gunung mendukung subianto agar bisa memenangi pemilihan pilpres jadi siapapun calon yang diinginkan oleh
3031,2023-03-21,2887087309.0,15021,"DKI Jakarta, Indonesia",prabowo ganjar presiden dan wapres ri lawan kadrunkampret sama cebong hrs bersatu demi nkrilawan kadrun fpi hti khilafahisis,Negative,dan wapres lawan kadrunkampret sama cebong hrs bersatu demi nkrilawan kadrun fpi hti khilafahisis
3032,2023-03-21,121143089.0,18712,"Old Trafford,Manchester",seperti yang kita ketahui bahwa prabowo subianto sudah di usung oleh partai gerindra sebagai calon presiden untuk mengarungi pemilu akan tetapi prabowo belum mengumumkan siapa yang akan mendapinginya sebagai cawapres prabowo subianto,Positive,seperti yang kita ketahui bahwa subianto sudah di usung oleh partai gerindra sebagai calon untuk mengarungi pemilu akan tetapi belum mengumumkan siapa yang akan mendapinginya sebagai cawapres subianto
3033,2023-03-21,558402914.0,31217,,aku itu kali memilih pak sebagai presiden sebagai pemilih setia jujur aku kecewa dengan keadaan yang terjadi di indonesia apalagi ini dekat masa akhir periode presiden apa aku harus memilih pak tahun supaya keras dan tegas ke pembantunya,Positive,aku itu kali memilih pak sebagai sebagai pemilih setia jujur aku kecewa dengan keadaan yang terjadi di indonesia apalagi ini dekat masa akhir periode apa aku harus memilih pak tahun supaya keras dan tegas ke pembantunya
3034,2023-03-21,88352716.0,720057,Indonesia,kabar duet prabowoganjar menjadi penting bagi pan sebab partai ini mendukung ganjar sebagai salah satu calon presiden sesuai dengan hasil rapat kerja nasional,Positive,kabar duet prabowoganjar menjadi penting bagi pan sebab partai ini mendukung sebagai salah satu calon sesuai dengan hasil rapat kerja nasional
3035,2023-03-21,88352716.0,720057,Indonesia,jokowi menyiapkan duet prabowo ganjar untuk menghadapi anies baswedan upaya jokowi mendukung sejumlah tokoh untuk pemilu berlangsung di tengah agenda perpanjangan masa jabatan presiden,Positive,jokowi menyiapkan duet untuk menghadapi upaya jokowi mendukung sejumlah tokoh untuk pemilu berlangsung di tengah agenda perpanjangan masa jabatan
3036,2023-03-21,4097650214.0,4630,,pemilu presiden pilpres hingga pemilu kepala daerah pilkada nanti prabowo subianto,Negative,pemilu pilpres hingga pemilu kepala daerah pilkada nanti subianto
3038,2023-03-21,4097650214.0,4630,,selain melantik pengurus kamarudin juga memimpin deklarasi dukungan organisasi sayap partai gerindra itu terhadap pencalonan prabowo subianto menjadi calon presiden di pilpres prabowo subianto,Positive,selain melantik pengurus kamarudin juga memimpin deklarasi dukungan organisasi sayap partai gerindra itu terhadap pencalonan subianto menjadi calon di pilpres subianto
3040,2023-03-21,4097650214.0,4630,,elektabilitas prabowo subianto sebagai calon presiden capres unggul jauh di atas ganjar pranowo dan anies baswedan prabowo subianto,Positive,elektabilitas subianto sebagai calon capres unggul jauh di atas dan subianto
3041,2023-03-21,4482720013.0,7742,,saat ini prabowo kembali dideklarasikan sebagai calon presiden di pilpres oleh partai gerindra prabowosubianto,Positive,saat ini kembali dideklarasikan sebagai calon di pilpres oleh partai gerindra prabowosubianto
3043,2023-03-21,400179399.0,31089,INDONESIA,kepala bin budi gunawan doakan prabowo di depan presiden jokowi sukses pemilu,Positive,kepala bin budi gunawan doakan di depan jokowi sukses pemilu
3045,2023-03-21,726059647.0,7961,,presiden jokowi prediksi prabowo subianto bisa jadi presiden di ini alasannya,Negative,jokowi prediksi subianto bisa jadi di ini alasannya
3049,2023-03-21,2420416704.0,14379,jakarta,tidak saja di gerindra di partai lain pun jokowi secara terang mempromosikan prabowo sebagai calon presiden tegasnya prabowo subianto,Positive,tidak saja di gerindra di partai lain pun jokowi secara terang mempromosikan sebagai calon tegasnya subianto
3050,2023-03-21,2420416704.0,14379,jakarta,selain itu menurut dedy kebersamaan jokowi dengan prabowo juga bisa dilihat sebagai bentuk memperkuat dukungan presiden pada prabowo untuk kontestasi pemilihan presiden pilpres prabowo subianto,Positive,selain itu menurut dedy kebersamaan jokowi dengan juga bisa dilihat sebagai bentuk memperkuat dukungan pada untuk kontestasi pemilihan pilpres subianto
3053,2023-03-21,2410032319.0,9571,Alam Bawah Sadar,berita menhan kepala bin sebut aura presiden pindah ke prabowo subianto pengamat titik terang menangkan pilpres okezone news,Positive,berita menhan kepala bin sebut aura pindah ke subianto pengamat titik terang menangkan pilpres okezone news
3054,2023-03-21,2410032319.0,9571,Alam Bawah Sadar,berita menhan kepala bin sebut aura presiden pindah ke prabowo subianto pengamat titik terang menangkan pilpres okezone news,Positive,berita menhan kepala bin sebut aura pindah ke subianto pengamat titik terang menangkan pilpres okezone news
3059,2023-03-21,576755999.0,293028,"Kebumen, Indonesia",pak budi gunawan doakan pak prabowo presiden ri di tahun semoga tercapai dan dimudahkan jalannya aamiin ri,Positive,pak budi gunawan doakan pak di tahun semoga tercapai dan dimudahkan jalannya aamiin
3064,2023-03-21,465280582.0,13674,jakarta,kepala bin ungkap aura presiden sudah pindah ke prabowo pengamat titik terang dukungan prabowo presiden semakin terpancar halo semarang,Positive,kepala bin ungkap aura sudah pindah ke pengamat titik terang dukungan semakin terpancar halo semarang
3066,2023-03-21,1017294361.0,6950,,presiden jokowi prediksi prabowo subianto bisa jadi presiden di ini alasannya prabowo subianto,Negative,jokowi prediksi subianto bisa jadi di ini alasannya subianto
3076,2023-03-21,1021578788.0,2131,62,setelah kunjungan panen raya bersama presiden jokowi paslon ganjar prabowo menjadi perbincangan publik yang akan memenangkan pilpres,Positive,setelah kunjungan panen raya bersama jokowi paslon menjadi perbincangan publik yang akan memenangkan pilpres
3082,2023-03-21,117694469.0,2264,"Singapur, India",morningg kawan kadung rusak ekosistem tertanya gagal dan masih banjir pula ini selesaikan masalah apa tambah masalah kira hallo pak prabowo subianto dan pak presiden semoga sehat selalu ya pak selesaikan tugas sampai,Negative,morningg kawan kadung rusak ekosistem tertanya gagal dan masih banjir pula ini selesaikan masalah apa tambah masalah kira hallo pak subianto dan pak semoga sehat selalu ya pak selesaikan tugas sampai
3083,2023-03-21,117694469.0,2264,"Singapur, India",morningg kawan kadung rusak ekosistem tertanya gagal dan masih banjir pula ini selesaikan masalah apa tambah masalah kira hallo pak prabowo subianto dan pak presiden semoga sehat selalu ya pak selesaikan tugas sampai,Negative,morningg kawan kadung rusak ekosistem tertanya gagal dan masih banjir pula ini selesaikan masalah apa tambah masalah kira hallo pak subianto dan pak semoga sehat selalu ya pak selesaikan tugas sampai
3086,2023-03-21,212277468.0,26,Denpasar - Bali,rahajeng rahina nyepi tahun baru saka maret astungkara sami rahayu,Negative,rahajeng rahina nyepi tahun baru saka maret astungkara sami rahayu
3087,2023-03-20,2470403222.0,720,Indonesia,akhlakul al karimah akhlak mahmudah semoga,Positive,akhlakul al karimah akhlak mahmudah semoga
3088,2023-03-20,1878861787.0,28222,"Jakarta Utara, DKI Jakarta",trust indonesia merilis hasil survei soal elektabilitas calon presiden capres menjadi tokoh teratas kemudian disusul anies baswedan dan prabowo subianto,Positive,trust indonesia merilis hasil survei soal elektabilitas calon capres menjadi tokoh teratas kemudian disusul dan subianto
3094,2023-03-20,189190233.0,21546,"ÜT: -6.3480548,106.8316685",breaking news kedekatan presiden joko widodo dan prabowo subianto subianto lemahkan asa puan maharani maju pilpres info indonesia info indonesia,Positive,breaking news kedekatan joko widodo dan subianto subianto lemahkan asa puan maharani maju pilpres info indonesia info indonesia
3095,2023-03-20,2410032319.0,9571,Alam Bawah Sadar,kedekatan presiden joko widodo dan prabowo subianto subianto lemahkan asa puan maharani maju pilpres info indonesia info indonesia,Positive,kedekatan joko widodo dan subianto subianto lemahkan asa puan maharani maju pilpres info indonesia info indonesia
3098,2023-03-20,465280582.0,13674,jakarta,kedekatan presiden joko widodo dan prabowo subianto lemahkan asa puan maharani maju pilpres info indonesia info indonesia,Positive,kedekatan joko widodo dan subianto lemahkan asa puan maharani maju pilpres info indonesia info indonesia
3100,2023-03-20,46693036.0,46802,,menteri pariwisata dan ekonomi kreatif menparekraf sandiaga uno tak berani melangkahi ketua umum partai gerindra prabowo subianto seiring langkah dpw partai persatuan pembangunan ppp gorontalo mengusungnya sebagai calon presiden capres,Positive,menteri pariwisata dan ekonomi kreatif menparekraf sandiaga uno tak berani melangkahi ketua umum partai gerindra subianto seiring langkah dpw partai persatuan pembangunan ppp gorontalo mengusungnya sebagai calon capres
3101,2023-03-20,215989357.0,7454,,emakemak di kota medan dukung prabowo subianto presiden tribun timur,Positive,emakemak di kota medan dukung subianto tribun timur
3106,2023-03-20,88352716.0,720057,Indonesia,gagasan menduetkan prabowo subianto dengan ganjar pranowo untuk pemilu muncul jokowi menilai prabowo dan ganjar samasama bisa menjadi calon presiden ideal semuanya katanya,Positive,gagasan menduetkan subianto dengan untuk pemilu muncul jokowi menilai dan samasama bisa menjadi calon ideal semuanya katanya
3109,2023-03-20,18129942.0,1161352,Indonesia,usaha mengarahkan presiden penggantinya yang terbaru cobacoba menduetkan prabowo subianto dan ganjar pranowo untuk pilpres,Positive,usaha mengarahkan penggantinya yang terbaru cobacoba menduetkan subianto dan untuk pilpres
3125,2023-03-20,2420416704.0,14379,jakarta,tidak saja di gerindra di partai lain pun jokowi secara terang mempromosikan prabowo sebagai calon presiden tegasnya prabowo subianto,Positive,tidak saja di gerindra di partai lain pun jokowi secara terang mempromosikan sebagai calon tegasnya subianto
3126,2023-03-20,2420416704.0,14379,jakarta,selain itu menurut dedy kebersamaan jokowi dengan prabowo juga bisa dilihat sebagai bentuk memperkuat dukungan presiden pada prabowo untuk kontestasi pemilihan presiden pilpres prabowo subianto,Positive,selain itu menurut dedy kebersamaan jokowi dengan juga bisa dilihat sebagai bentuk memperkuat dukungan pada untuk kontestasi pemilihan pilpres subianto
3145,2023-03-20,300807131.0,22351,"Jakarta Capital Region, Indone",koalisi relawan provinsi nusa tenggara barat ntb menggelar agenda musyawarah rakyat ke xxiv musra di kota mataram seluruh relawan memberi isyarat mendukung ketum partai gerindra subianto menjadi calon presiden capres yg bertarung di pemilu,Positive,koalisi relawan provinsi nusa tenggara barat ntb menggelar agenda musyawarah rakyat ke xxiv musra di kota mataram seluruh relawan memberi isyarat mendukung ketum partai gerindra subianto menjadi calon capres yg bertarung di pemilu
3148,2023-03-20,3306771829.0,128403,Indonesia,wakil sekretaris dewan syuro partai kebangkitan bangsa maman imanulhaq menyebut pkb tak tertarik mengusung duet ganjar dan prabowo karena aspirasi para jajaran dewan syuro pkb tetap mencalonkan muhaimin iskandar sebagai presiden pada pemilu,Positive,wakil sekretaris dewan syuro partai kebangkitan bangsa maman imanulhaq menyebut pkb tak tertarik mengusung duet dan karena aspirasi para jajaran dewan syuro pkb tetap mencalonkan muhaimin iskandar sebagai pada pemilu
3149,2023-03-20,82923904.0,13560,Rahasia,vr baskoro inismyname fahnoor prabowo hebat capres abadi presiden anies ,Positive,vr baskoro inismyname fahnoor hebat capres abadi 
3153,2023-03-20,88352716.0,720057,Indonesia,kabar duet prabowoganjar menjadi penting bagi pan sebab partai ini mendukung ganjar sebagai salah satu calon presiden sesuai dengan hasil rapat kerja nasional,Positive,kabar duet prabowoganjar menjadi penting bagi pan sebab partai ini mendukung sebagai salah satu calon sesuai dengan hasil rapat kerja nasional
3154,2023-03-20,576755999.0,293028,"Kebumen, Indonesia",pengalaman bangsa ini sudah membuktikan kali dipimpin presiden dari militer kondisi aman terkendali itulah kenapa waktunya,Positive,pengalaman bangsa ini sudah membuktikan kali dipimpin dari militer kondisi aman terkendali itulah kenapa waktunya
3157,2023-03-19,1021578788.0,2131,62,duet paslon ganjar prabowo memiliki peluang menang sangat besar dalam pilpres karena memiliki dukungan dari presiden jokowi dan dari mayoritas masyarakat indonesia,Positive,duet paslon memiliki peluang menang sangat besar dalam pilpres karena memiliki dukungan dari jokowi dan dari mayoritas masyarakat indonesia
3158,2023-03-19,1044027295.0,2074,,terealisasinya pencalonan ganjar prabowo semakin mungkin karena mendapat dukungan dari presiden jokowi dan diyakini mampu menang dalam pilpres siapapun lawannya nanti,Positive,terealisasinya pencalonan semakin mungkin karena mendapat dukungan dari jokowi dan diyakini mampu menang dalam pilpres siapapun lawannya nanti
3160,2023-03-19,558402914.0,31217,,siapa pun presiden indonesia tahun tolong kembalikan marwah dan wibawa kpk ri sebagai komisi pemberantas koruptor,Positive,siapa pun indonesia tahun tolong kembalikan marwah dan wibawa kpk sebagai komisi pemberantas koruptor
3169,2023-03-19,1153424046.0,11649,,fahnoor inismyname bagus om nanti anies presiden ri pak prabowo boleh gabung sebagai menhan juga kok,Positive,fahnoor inismyname bagus om nanti pak boleh gabung sebagai menhan juga kok
3178,2023-03-19,465280582.0,13674,jakarta,komunitas pemuda di papua deklarasi dukung prabowo subianto presiden pasific,Positive,komunitas pemuda di papua deklarasi dukung subianto pasific
3179,2023-03-19,46693036.0,46802,,sayap partai gerindra jaringan rakyat indonesia raya jari raya mendeklarasikan dukungan kepada ketua umum partai gerindra prabowo subianto untuk maju menjadi calon presiden dalam pilpres sekaligus merapatkan barisan dan bergerak cepat,Positive,sayap partai gerindra jaringan rakyat indonesia raya jari raya mendeklarasikan dukungan kepada ketua umum partai gerindra subianto untuk maju menjadi calon dalam pilpres sekaligus merapatkan barisan dan bergerak cepat
3180,2023-03-19,465280582.0,13674,jakarta,komunitas pemuda di papua deklarasi dukung prabowo presiden pasific,Positive,komunitas pemuda di papua deklarasi dukung pasific
3183,2023-03-19,318831793.0,23159,Indonesia,pa jokowi kemana mana sllu bawa  sinyal sehati insyaallah presiden pa doa dan dukungan kami untuk,Positive,pa jokowi kemana mana sllu bawa  sinyal sehati insyaallah pa doa dan dukungan kami untuk
3184,2023-03-19,451958586.0,44234,Pekopon,gsp prabowo be like prabowo for presiden,Positive,gsp be like for
3185,2023-03-19,318831793.0,23159,Indonesia,contoh negarawan ga ada keraguan lagi pilih presiden,Negative,contoh negarawan ga ada keraguan lagi pilih
3187,2023-03-19,2385926900.0,63649,"DKI Jakarta, Indonesia",puan maharani capres pasangan prabowo ganjar kita diharap bersabar tunggu keputusan bu mega mbak ri kami berharap ganjar prabowo dong ayo sahabat twips kita hatrick kan pdip  bersama presiden jokowi like amp retweet,Positive,puan maharani capres pasangan kita diharap bersabar tunggu keputusan bu mega mbak kami berharap dong ayo sahabat twips kita hatrick kan pdip  bersama jokowi like amp retweet
3188,2023-03-19,1044027295.0,2074,,akan diajukan sebagai proposal politik oleh presiden jokowi kepada ketum pdip ganjar prabowo memantapkan diri sebagai duet maut dalam pilpres,Negative,akan diajukan sebagai proposal politik oleh jokowi kepada ketum pdip memantapkan diri sebagai duet maut dalam pilpres
3193,2023-03-18,465423257.0,4280,Indonesia,relawan sahabat muda prabowo deklarasi dukung menhan ri calon presiden pasific,Positive,relawan sahabat muda deklarasi dukung menhan calon pasific
3195,2023-03-18,2410032319.0,9571,Alam Bawah Sadar,jari raya sumsel siap menangkan prabowo subianto menjadi presiden wawberita,Positive,jari raya sumsel siap menangkan subianto menjadi wawberita
3196,2023-03-18,1038715302.0,18425,"Jakarta Capital Region, Indone",kode terang sepertinya begini hasil diskusi politiknya prabowo presiden ganjar wakil presiden the next leaders ri aaaamiiiin,Positive,kode terang sepertinya begini hasil diskusi politiknya wakil the next leaders aaaamiiiin
3199,2023-03-18,2470403222.0,720,Indonesia,jiwa prajurit sejati rendah hati,Positive,jiwa prajurit sejati rendah hati
3203,2023-03-18,3177957847.0,50174,Earth,inismyname orang jahat pilih orang jahat junjungane gak boleh di kritik pribadinya tapi idola orang lain seenak jidat diperlakukan rasis tuhan memisahkan yang baik amp yang buruk yang hianat amp yang amanah geng oportunis sak karepe dewe gus kalah nyalon lagi ngebet presiden,Negative,inismyname orang jahat pilih orang jahat junjungane gak boleh di kritik pribadinya tapi idola orang lain seenak jidat diperlakukan rasis tuhan memisahkan yang baik amp yang buruk yang hianat amp yang amanah geng oportunis sak karepe dewe gus kalah nyalon lagi ngebet
3206,2023-03-18,465280582.0,13674,jakarta,kalau sejak awal prabowo tetap oposisi bisa jadi presiden di koran pelita,Negative,kalau sejak awal tetap oposisi bisa jadi di koran pelita
3211,2023-03-18,2887087309.0,15021,"DKI Jakarta, Indonesia",prabowo presiden,Negative,
3212,2023-03-18,2887087309.0,15021,"DKI Jakarta, Indonesia",prabowo presiden,Negative,
3218,2023-03-18,1878861787.0,28222,"Jakarta Utara, DKI Jakarta",presiden joko widodo beberapa waktu lalu tengah berada di antara prabowo subiantoampganjar pranowo seperti diketahui elektabilitas prabowo amp sebagai capres tinggi di berbagai lembaga survei,Negative,joko widodo beberapa waktu lalu tengah berada di antara subiantoampganjar seperti diketahui elektabilitas amp sebagai capres tinggi di berbagai lembaga survei
3221,2023-03-17,161742024.0,8303,Jakarta,bang azwar saya dukung penuh pak jadi capres insya allah presiden ri adalah pak salam utk pak prabowo ya bang semangat ya bangjgn kendor,Positive,bang azwar saya dukung penuh pak jadi capres insya allah adalah pak salam utk pak ya bang semangat ya bangjgn kendor
3237,2023-03-17,465280582.0,13674,jakarta,relawan gupra hadir menangkan prabowo presiden di provinsi papua tengah pasific,Positive,relawan gupra hadir menangkan di provinsi papua tengah pasific
3238,2023-03-17,110364620.0,29611,Medan,pak prabowo dipeluk emakemak saya pernah katakan andai saja pak prabowo lebih sering keliling apalagi sudah turun kampanye dan bertemu langsung rakyat maka sejatinya pilpres sudah selesai ahlan wa sahlan the next mr presiden kami,Positive,pak dipeluk emakemak saya pernah katakan andai saja pak lebih sering keliling apalagi sudah turun kampanye dan bertemu langsung rakyat maka sejatinya pilpres sudah selesai ahlan wa sahlan the next mr kami
3239,2023-03-17,118646322.0,1457683,"Jakarta, Indonesia",pkb menyebut para kiai ingin prabowo subianto dan cak imin duet jadi calon presiden capres dan wakil presiden cawapres pada pilpres,Negative,pkb menyebut para kiai ingin subianto dan cak imin duet jadi calon capres dan wakil cawapres pada pilpres
3242,2023-03-17,1709238618.0,1005,Indonesia,mantap pak presiden era pdip habis karna akan jadi duel prabowo vs anies pdip anak bawang,Positive,mantap pak era pdip habis karna akan jadi duel vs pdip anak bawang
3249,2023-03-17,2410032319.0,9571,Alam Bawah Sadar,relawan gupra hadir menangkan prabowo subianto presiden di pasific,Positive,relawan gupra hadir menangkan subianto di pasific
3267,2023-03-17,99684750.0,1014,,anies baswedan presiden indonesia,Negative,indonesia
3268,2023-03-17,465280582.0,13674,jakarta,relawan emak emak muda di papua dukung prabowo subianto jadi presiden paraparatv,Positive,relawan emak emak muda di papua dukung subianto jadi paraparatv
3270,2023-03-17,4186003753.0,7717,,dan layak sebagai figur calon presiden dan lewat hal ini elektabilitas prabowo tertinggi di pilpres,Positive,dan layak sebagai figur calon dan lewat hal ini elektabilitas tertinggi di pilpres
3271,2023-03-17,1044027295.0,2074,,presiden jokowi mendukung pencalonan pasangan ganjar prabowo untuk pilpres,Positive,jokowi mendukung pencalonan pasangan untuk pilpres
3273,2023-03-17,106247388.0,16881,California,signal presiden jokowi kembali mengajak menteri pertahanan prabowo subianto dalam kunjungan kerjanya jumat maret mengikuti acara istigasah dan doa bersama rabithah melayubanjar di kompleks pendopo bersinar tabalong kalimantan selatan,Positive,signal jokowi kembali mengajak menteri pertahanan subianto dalam kunjungan kerjanya jumat maret mengikuti acara istigasah dan doa bersama rabithah melayubanjar di kompleks pendopo bersinar tabalong kalimantan selatan
3276,2023-03-16,465280582.0,13674,jakarta,relawan emak emak muda di papua dukung prabowo jadi presiden paraparatv,Positive,relawan emak emak muda di papua dukung jadi paraparatv
3278,2023-03-16,465280582.0,13674,jakarta,ratusan emakemak di makassar siap menangkan prabowo subianto presiden sulsel ekspres,Positive,ratusan emakemak di makassar siap menangkan subianto sulsel ekspres
3281,2023-03-16,46693036.0,46802,,provinsi sumatera utara sumut berpotensi jadi kantong suara bagi ketua umum prabowo subianto dalam kontestasi pemilihan presiden pilpres hal itu dapat dilihat dari hasil musyawarah rakyat musra ke relawan jokowi hasil dari forum yang,Negative,provinsi sumatera utara sumut berpotensi jadi kantong suara bagi ketua umum subianto dalam kontestasi pemilihan pilpres hal itu dapat dilihat dari hasil musyawarah rakyat musra ke relawan jokowi hasil dari forum yang
3283,2023-03-16,373141460.0,1452,,partai gerindra percaya diri sulawesi selatan sulsel bisa menjadi lumbung suara dan memenangkan prabowo subianto calon presiden cepres yang diusung pada pemilihan presiden pilpres mendatang,Positive,partai gerindra percaya diri sulawesi selatan sulsel bisa menjadi lumbung suara dan memenangkan subianto calon cepres yang diusung pada pemilihan pilpres mendatang
3284,2023-03-16,46693036.0,46802,,ketua dpd partai golkar jawa barat ace hasan syadzily menanggapi santai soal wacana duet prabowo subianto dan ganjar pranowo di pilpres yang sudah mengantongi restu dari presiden joko widodo jokowi sebab menurut ace presiden jokowi juga sudah,Positive,ketua dpd partai golkar jawa barat ace hasan syadzily menanggapi santai soal wacana duet subianto dan di pilpres yang sudah mengantongi restu dari joko widodo jokowi sebab menurut ace jokowi juga sudah
3286,2023-03-16,2221519400.0,11983,,situbondo dukungan terhadap prabowo subianto untuk menjadi presiden ri pada pemilu terus mengalir,Positive,situbondo dukungan terhadap subianto untuk menjadi pada pemilu terus mengalir
3299,2023-03-16,1119875790.0,3405,,calon presiden pilihan saya thn dan insyaallah pilihan saya di thn aamiin,Positive,calon pilihan saya thn dan insyaallah pilihan saya di thn aamiin
3310,2023-03-16,2335110374.0,36,"Sumalangka, Tondano, Minahasa",khusus yang kiri bawah saya kira bisa dijinakkan jika prabowo subianto benar jadi presiden ri periode,Negative,khusus yang kiri bawah saya kira bisa dijinakkan jika subianto benar jadi periode
3313,2023-03-16,2615192508.0,1956,,anakkolong ri kalo pak prabowo presiden dan pak jokowi mau jadi wakil boleh ga sih secara konstitusi,Negative,anakkolong kalo pak dan pak jokowi mau jadi wakil boleh ga sih secara konstitusi
3317,2023-03-16,111869546.0,19565,Texas,erick thohir cawapres terkuat menteri bumn menjadi primadona pilihan rakyat di bursa calon wakil presiden erick thohir menjadi sosok yang pas dengan siapa pun calon presidennya mau disimulasikan dengan ganjar maupun prabowo ataupun dengan yang lain,Positive,erick thohir cawapres terkuat menteri bumn menjadi primadona pilihan rakyat di bursa calon wakil erick thohir menjadi sosok yang pas dengan siapa pun calon presidennya mau disimulasikan dengan maupun ataupun dengan yang lain
3319,2023-03-15,2518915579.0,147645,Gosan ,nanti indonesia sudah nggak butuh pemimpin plonga plongo amp kagetan tolong pak kalau salah satu diantara kalian nanti yang jadi presiden atau wapres hindari kata kaget,Negative,nanti indonesia sudah nggak butuh pemimpin plonga plongo amp kagetan tolong pak kalau salah satu diantara kalian nanti yang jadi atau wapres hindari kata kaget
3321,2023-03-15,465280582.0,13674,jakarta,muhammad farid rayendra siap menangkan prabowo subianto presiden di pilpres,Positive,muhammad farid rayendra siap menangkan subianto di pilpres
3329,2023-03-15,2916147380.0,24838,Jakarta ,dari makassar kita wujudkan kemenangan prabowo presiden dan gerindra menangdipemilu ewako,Negative,dari makassar kita wujudkan kemenangan dan gerindra menangdipemilu ewako
3330,2023-03-15,2410032319.0,9571,Alam Bawah Sadar,disosialisasikan andi anhar emakemak siap menangkan prabowo subianto presiden inikatacoid,Positive,disosialisasikan andi anhar emakemak siap menangkan subianto inikatacoid
3332,2023-03-15,701272502.0,527,"Wonosobo, Indonesia",mantab presiden ri,Positive,mantab
3350,2023-03-15,189190233.0,21546,"ÜT: -6.3480548,106.8316685",breaking news abu janda dukung prabowo subianto presiden gerindra tentunya akan tingkatkan semangat kami nasional,Positive,breaking news abu janda dukung subianto gerindra tentunya akan tingkatkan semangat kami nasional
3361,2023-03-15,189190233.0,21546,"ÜT: -6.3480548,106.8316685",breaking news rngp tegaskan ganjar pranowo sebagai calon presiden ri,Positive,breaking news rngp tegaskan sebagai calon
