,Date,User ID,Tweet Count,Tweet Location,Tweet,label,Clean
7348,2023-01-24,2887087309.0,15021,"DKI Jakarta, Indonesia",maju prabowo presiden jgn sampe jatuh ke tangan imigrant yaman,Positive,maju jgn sampe jatuh ke tangan imigrant yaman
7351,2023-01-24,365412156.0,1291,,pak prabowo tahun tolong dilanjutin estafet ke presiden ri yaa prabowo subianto,Positive,pak tahun tolong dilanjutin estafet ke yaa subianto
7353,2023-01-24,68930552.0,823097,Jakarta - Indonesia,pilpres akan fokus pada isu lanjutkan jokowi atau perubahan denny menyampaikan ada tiga calon presiden yang memiliki elektabilitas tertinggi yakni ganjar pranowo prabowo subianto dan anies baswedan,Negative,pilpres akan fokus pada isu lanjutkan jokowi atau perubahan denny menyampaikan ada tiga calon yang memiliki elektabilitas tertinggi yakni subianto dan
7392,2023-01-24,1018719920.0,859,Jakarta,presiden jokowi memberikan sinyal dukungan kepada ketum gerindra prabowo subianto untuk pilpres prabowo subianto,Positive,jokowi memberikan sinyal dukungan kepada ketum gerindra subianto untuk pilpres subianto
7393,2023-01-24,2397120654.0,19655,Jakarta,anda pilih siapa  presiden indonesia erick thohir jokowi ridwan kamil ganjar pranowo erlangga puan maharani prabowo subianto anies baswedan total votes,Negative,anda pilih siapa  indonesia erick thohir jokowi ridwan kamil erlangga puan maharani subianto total votes
7394,2023-01-24,3364310719.0,3530,Indonesia,junior cium tangan dulu donk sama calon presiden sehat selalu pak prabowo berkahnya pdip gibran mau jateng atau langsung dki tinggal milih doank,Positive,junior cium tangan dulu donk sama calon sehat selalu pak berkahnya pdip gibran mau jateng atau langsung dki tinggal milih doank
7408,2023-01-24,46731939.0,1964,Simalungun,for koslap presiden ke,Negative,for koslap ke
7416,2023-01-24,23343960.0,2310129,Jakarta,ketua pbhi julius ibrani meminta supaya presiden jokowi tidak mempolitisasi intelijen menjelang pemilu pernyataan itu disampaikan menanggapi permintaan presiden jokowi yang meminta menhan prabowo mengorkestrasi intelijen lt,Negative,ketua pbhi julius ibrani meminta supaya jokowi tidak mempolitisasi intelijen menjelang pemilu pernyataan itu disampaikan menanggapi permintaan jokowi yang meminta menhan mengorkestrasi intelijen lt
7417,2023-01-24,87750382.0,1422,,rosiade pkb anies baswedan presiden,Negative,rosiade pkb
7418,2023-01-24,108560530.0,444,Jakarta,pkb dengan hati yg tulus dan ikhlas pak saya berdoa utk pak prabowo semoga beliau sehat barokah umur panjang umur dan terpilih menjadi presiden republik indonesia utk tahun salam sukses indonesia,Positive,pkb dengan hati yg tulus dan ikhlas pak saya berdoa utk pak semoga beliau sehat barokah umur panjang umur dan terpilih menjadi republik indonesia utk tahun salam sukses indonesia
7421,2023-01-23,4669741572.0,189,"Sepatan - Tangerang, Banten",maju kembali pak prabowo subianto mencalonkan diri menjadi presiden ri semoga tersemogakan apa yang di semogakan menjadi presiden di aamiin,Positive,maju kembali pak subianto mencalonkan diri menjadi semoga tersemogakan apa yang di semogakan menjadi di aamiin
7427,2023-01-23,1576955652.0,4380,Jakarta indonesia,prabowo presiden gerindra pkb menang,Positive,gerindra pkb menang
7431,2023-01-23,3239442296.0,167,Winongan pasuruan jawa timur ,bismillah perjuangan dimulai presiden ri,Negative,bismillah perjuangan dimulai
7442,2023-01-23,198417114.0,67415,Indonesia tercinta,inismyname wajib presiden zaman makin berat dunia terhempas kesulitan massal tekanan dalam negeri makin kencang indonesia membutuhkan presiden masak pohon bukan karbitan jangan tergelincir dg istilah king maker jadi presiden sekaligus bapak bangsa justru malah afdol,Negative,inismyname wajib zaman makin berat dunia terhempas kesulitan massal tekanan dalam negeri makin kencang indonesia membutuhkan masak pohon bukan karbitan jangan tergelincir dg istilah king maker jadi sekaligus bapak bangsa justru malah afdol
7443,2023-01-23,397673651.0,129730,Indonesia Raya ,ketua umum partai gerindra prabowo subianto memastikan partainya membuka komunikasi dengan semua partai politik parpol menjelang pemilihan presiden pilpres,Positive,ketua umum partai gerindra subianto memastikan partainya membuka komunikasi dengan semua partai politik parpol menjelang pemilihan pilpres
7446,2023-01-23,985916988.0,1260,"Bandung, Jawa Barat",kata sandiaga dalam ruangan ini menjadi hal positif antara kedua partai tersebut untuk memenangkan pemilu dan menjadikan prabowo subianto presiden,Positive,kata sandiaga dalam ruangan ini menjadi hal positif antara kedua partai tersebut untuk memenangkan pemilu dan menjadikan subianto
7447,2023-01-23,985916988.0,1260,"Bandung, Jawa Barat",bahkan sandi pun menegaskan dukungannya kepada prabowo subianto untuk presiden nanti,Positive,bahkan sandi pun menegaskan dukungannya kepada subianto untuk nanti
7452,2023-01-23,294348814.0,783,,fokus kita semua prabowo subianto presiden,Negative,fokus kita semua subianto
7455,2023-01-23,1341398533.0,2997,"Semarang, Jawa Tengah",indonesia menang prabowo subianto presiden prabowo subianto,Positive,indonesia menang subianto subianto
7456,2023-01-23,1018719920.0,859,Jakarta,beberapa komentar netizen pratama ingin indonesia di segani oleh bangsa bangsa lain solusinya percayakan kepada beliau untuk menjadi presiden republik indonesia periode prabowo subianto,Positive,beberapa komentar netizen pratama ingin indonesia di segani oleh bangsa bangsa lain solusinya percayakan kepada beliau untuk menjadi republik indonesia periode subianto
7459,2023-01-23,1692290179.0,35075,"Cianjur, Indonesia",doa setelah buka puasa senin dihati pertama bulan rajab semoga gus muhaimin presiden amp pak wapresnya amin yra,Negative,doa setelah buka puasa senin dihati pertama bulan rajab semoga gus muhaimin amp pak wapresnya amin yra
7464,2023-01-23,2320493293.0,1806,,aku dulu pendukung jokowi nanti aku akan dukung prabowo subianto untuk jadi presiden ri,Positive,aku dulu pendukung jokowi nanti aku akan dukung subianto untuk jadi
7478,2023-01-23,243177995.0,46789,Jawa Barat,maman imanulhaq doakan prabowomuhaimin jadi presiden dan wapres ri,Positive,maman imanulhaq doakan prabowomuhaimin jadi dan wapres
7485,2023-01-23,809861912.0,695,,inismyname pkb terlepas dari hak politik pak prabowoselain ingin jadi presidenapa tujuan beliau maju lagi apa tdk sebaiknya beliau jadi king maker saja jadi guru bangsa,Negative,inismyname pkb terlepas dari hak politik pak prabowoselain ingin jadi presidenapa tujuan beliau maju lagi apa tdk sebaiknya beliau jadi king maker saja jadi guru bangsa
7493,2023-01-23,1542610392.0,2089,#PrabowoPresidenGerindraMenang,sekber kebangkitan indonesia raya menandai solidnya koalisi dan pkb untuk mengawali tahun politik,Positive,sekber kebangkitan indonesia raya menandai solidnya koalisi dan pkb untuk mengawali tahun politik
7494,2023-01-23,1542610392.0,2089,#PrabowoPresidenGerindraMenang,januari resmi sekber kebangkitan indonesia raya koalisi amp pkb solid mengawali thn politik,Positive,januari resmi sekber kebangkitan indonesia raya koalisi amp pkb solid mengawali thn politik
7501,2023-01-23,456426648.0,769171,Indonesia,cek fakta presiden jokowi resmi usung ganjarprabowo di pilpres simak faktanya,Positive,cek fakta jokowi resmi usung ganjarprabowo di pilpres simak faktanya
7506,2023-01-23,110958319.0,12492,Taiwan,id betul saya harap indonesia bisa nambah utang lebih banyak lagi jika presiden pak atau pak hutang banyak artinya negara makmur rumah tangga banyak utang artinya rumah tangga yang makmur,Positive,id betul saya harap indonesia bisa nambah utang lebih banyak lagi jika pak atau pak hutang banyak artinya negara makmur rumah tangga banyak utang artinya rumah tangga yang makmur
7508,2023-01-23,502140136.0,1976,Indonesia,sorak sorai prabowo subianto presiden ri menggema kesira siap menangkan prabowo subianto,Positive,sorak sorai subianto menggema kesira siap menangkan subianto
7510,2023-01-23,465458275.0,12086,Pulau Impian,melalui sebuah pantun ridwan kamil doakan prabowo jadi presiden rmol,Positive,melalui sebuah pantun ridwan kamil doakan jadi rmol
7511,2023-01-23,2496101024.0,7633,Klaten,perwakilan kelompok tani sukabumi adam fauzi mengatakan dukungan kuat diberikan masyarakat terhadap sosok prabowo dan erick thohir sebagai calon presiden dan calon wakil presiden,Positive,perwakilan kelompok tani sukabumi adam fauzi mengatakan dukungan kuat diberikan masyarakat terhadap sosok dan erick thohir sebagai calon dan calon wakil
7513,2023-01-22,465458275.0,12086,Pulau Impian,kunjungi ulama di jatim prabowo subianto dapat doa mulus menjadi presiden rmol,Negative,kunjungi ulama di jatim subianto dapat doa mulus menjadi rmol
7514,2023-01-22,465280582.0,13675,jakarta,kunjungi ulama di jatim prabowo subianto dapat doa mulus menjadi presiden rmol,Negative,kunjungi ulama di jatim subianto dapat doa mulus menjadi rmol
7515,2023-01-22,465458275.0,12086,Pulau Impian,cari penerus presiden jokowi projo sodorkan nama ini untuk maju di pilpres,Positive,cari penerus jokowi projo sodorkan nama ini untuk maju di pilpres
7517,2023-01-22,4453651872.0,20,"Ciamis, Indonesia",gerindra,Negative,gerindra
7529,2023-01-22,1542610392.0,2089,#PrabowoPresidenGerindraMenang,pak pada rakornas kesira kesehatan indonesia raya mengajak para dokter perawat tenaga kesehatan tetap berjuang untuk kesehatan seluruh rakyat indonesia,Negative,pak pada rakornas kesira kesehatan indonesia raya mengajak para dokter perawat tenaga kesehatan tetap berjuang untuk kesehatan seluruh rakyat indonesia
7532,2023-01-22,3271449511.0,1846,,loyalitas adalah hal wajib di partai gerindra acara konsolidasi pengurus daerah dan pengurus cabang pira perempuan indonesia raya,Positive,loyalitas adalah hal wajib di partai gerindra acara konsolidasi pengurus daerah dan pengurus cabang pira perempuan indonesia raya
7537,2023-01-22,3271449511.0,1846,,xin nian hao gong xi fa cai selamat tahun baru imlek semoga kita semua senantiasa dikaruniai kebaikan dan kemanfaatan untuk sesama salam,Positive,xin nian hao gong xi fa cai selamat tahun baru imlek semoga kita semua senantiasa dikaruniai kebaikan dan kemanfaatan untuk sesama salam
7539,2023-01-22,1542610392.0,2089,#PrabowoPresidenGerindraMenang,trah kepahlawanan jelas amp mantaps,Positive,trah kepahlawanan jelas amp mantaps
7540,2023-01-21,194083131.0,41415,Indonesia,masuk ke tahun politik menunggu kartu truf megawatu pertarungan prabowo yang terakhir pemimpin paling sering ikut pemilu presiden airlangga hartarto  game changer mengubah arus politik dengan membangun kib yang punya tiket pasangan capres,Negative,masuk ke tahun politik menunggu kartu truf megawatu pertarungan yang terakhir pemimpin paling sering ikut pemilu airlangga hartarto  game changer mengubah arus politik dengan membangun kib yang punya tiket pasangan capres
7541,2023-01-21,465458275.0,12086,Pulau Impian,andre rosiade prabowo tokoh pemersatu bangsa cocok jadi presiden padang express,Negative,andre rosiade tokoh pemersatu bangsa cocok jadi padang express
7543,2023-01-21,1542610392.0,2089,#PrabowoPresidenGerindraMenang,selamat imlek semoga tahun ini menjadi awal kebahagiaan dan kebangkitan dari halhal buruk semoga semua masalah terselesaikan semua lukasakit disembuhkan gong xi fa cai,Positive,selamat imlek semoga tahun ini menjadi awal kebahagiaan dan kebangkitan dari halhal buruk semoga semua masalah terselesaikan semua lukasakit disembuhkan gong xi fa cai
7547,2023-01-21,2887087309.0,15021,"DKI Jakarta, Indonesia",prabowo presiden,Negative,
7548,2023-01-21,189190233.0,21546,"ÜT: -6.3480548,106.8316685",jokowi mengatakan setelah dia memenangkan pilpres dan maka saat ini adalah kesempatan bagi prabowo subianto untuk menjadi bakal calon presiden di pilpres,Positive,jokowi mengatakan setelah dia memenangkan pilpres dan maka saat ini adalah kesempatan bagi subianto untuk menjadi bakal calon di pilpres
7549,2023-01-21,189190233.0,21546,"ÜT: -6.3480548,106.8316685",jokowi mengatakan setelah dia memenangkan pilpres dan maka saat ini adalah kesempatan bagi prabowo subianto untuk menjadi bakal calon presiden di pilpres,Positive,jokowi mengatakan setelah dia memenangkan pilpres dan maka saat ini adalah kesempatan bagi subianto untuk menjadi bakal calon di pilpres
7550,2023-01-21,189190233.0,21546,"ÜT: -6.3480548,106.8316685",presiden joko widodo tidak mempermasalahkan jika pernyataannya terkait kemungkinan prabowo subianto mendapat jatah dalam pilpres dianggap sebagai sinyal dukungannya terhadap menteri pertahanan itu,Negative,joko widodo tidak mempermasalahkan jika pernyataannya terkait kemungkinan subianto mendapat jatah dalam pilpres dianggap sebagai sinyal dukungannya terhadap menteri pertahanan itu
7551,2023-01-21,465423257.0,4280,Indonesia,dpc gerinda lamsel dukung penuh prabowo subianto sebagai presiden lampungpro,Positive,dpc gerinda lamsel dukung penuh subianto sebagai lampungpro
7553,2023-01-21,465423257.0,4280,Indonesia,gerindra minta kadernya mulai pasang spanduk prabowo presiden,Negative,gerindra minta kadernya mulai pasang spanduk
7558,2023-01-21,354954138.0,2,"Indramayu, Indonesia",gerindra berdiri di kaki sendiri ini sudah di buktikan saat menjadi menteri saya berharap besok jadi presiden,Positive,gerindra berdiri di kaki sendiri ini sudah di buktikan saat menjadi menteri saya berharap besok jadi
7561,2023-01-21,98807795.0,11438,"Yogyakarta, Indonesia",anjg tapi iya lagi yg jadi presiden bakalan di,Positive,anjg tapi iya lagi yg jadi bakalan di
7563,2023-01-21,465458275.0,12086,Pulau Impian,ambisi gerindra di jadi partai nomor hingga prabowo presiden merah putih,Positive,ambisi gerindra di jadi partai nomor hingga merah putih
7565,2023-01-21,78210361.0,60382,Japan,thn saya akan pilih pak klo nyalonin jd presiden,Negative,thn saya akan pilih pak klo nyalonin jd
7566,2023-01-21,3693981253.0,34,"Jawa Barat, Indonesia",prasetyawatidprdprovinsijabardapilkabbogor,Negative,prasetyawatidprdprovinsijabardapilkabbogor
7570,2023-01-21,231138189.0,5230,"surabaya, jawa timur",presiden ri prabowo subianto,Negative,subianto
7586,2023-01-20,800313547.0,2179,Hell,kadangan suka mikir hal yg aneh dan kalo pikiran ini kurenungkan kembali agak lebih mendalam uweh kayaknya bisa aja kejadian deh kayak misal presiden kepilih nanti prabowo subianto  mean secara dealan emang udah waktunya,Positive,kadangan suka mikir hal yg aneh dan kalo pikiran ini kurenungkan kembali agak lebih mendalam uweh kayaknya bisa aja kejadian deh kayak misal kepilih nanti subianto  mean secara dealan emang udah waktunya
7591,2023-01-20,100715895.0,12747,unfinished pyramid,prabowo subianto ganjar pranowo dan anies baswedan menjadi tiga kandidat calon presiden atau capres yang mempunyai elektabilitas mumpuni berdasarkan hasil survei charta politika dan litbang kompas prabowo subianto,Negative,subianto dan menjadi tiga kandidat calon atau capres yang mempunyai elektabilitas mumpuni berdasarkan hasil survei charta politika dan litbang kompas subianto
7592,2023-01-20,3174993902.0,1881,"Tangerang, Indonesia",semoga saja putra terbaik bangsa pak prabowo subianto yg punya potensi untuk memimpin secara profesional amanah jujur bertanggung jawab bermartabat menjadi presiden aminn,Positive,semoga saja putra terbaik bangsa pak subianto yg punya potensi untuk memimpin secara profesional amanah jujur bertanggung jawab bermartabat menjadi aminn
7596,2023-01-20,100715895.0,12747,unfinished pyramid,dasco menegaskan bahwa gerindra telah satu suara memutuskan untuk mengusung kembali prabowo subianto maju calon presiden capres di pemilu,Negative,dasco menegaskan bahwa gerindra telah satu suara memutuskan untuk mengusung kembali subianto maju calon capres di pemilu
7597,2023-01-20,100715895.0,12747,unfinished pyramid,kami optimis insya allah setelah pak prabowo turun ke lapangan menyapa masyarakat insya allah pak prabowo subianto akan menjadi presiden kata dia seperti dalam keterangan tertulis yang diterima tempo rabu januari,Positive,kami optimis insya allah setelah pak turun ke lapangan menyapa masyarakat insya allah pak subianto akan menjadi kata dia seperti dalam keterangan tertulis yang diterima tempo rabu januari
7602,2023-01-20,100715895.0,12747,unfinished pyramid,jakarta menjelang pemilu situasi politik mulai menghangat dengan dihiasi namanama tokoh yang digadanggadang muncul menjadi calon presiden salah satunya prabowo subianto,Positive,jakarta menjelang pemilu situasi politik mulai menghangat dengan dihiasi namanama tokoh yang digadanggadang muncul menjadi calon salah satunya subianto
7604,2023-01-20,1018719920.0,859,Jakarta,ketua umum partai gerindra prabowo subianto masih menjadi yang paling banyak diminati kalangan masyarakat kelas bawah untuk maju dalam pemilihan presiden pilpres prabowo subianto,Positive,ketua umum partai gerindra subianto masih menjadi yang paling banyak diminati kalangan masyarakat kelas bawah untuk maju dalam pemilihan pilpres subianto
7607,2023-01-20,3174993902.0,1881,"Tangerang, Indonesia",saya dulu pendukung jokowi nanti saya akan dukung prabowo subianto untuk jadi presiden ri,Positive,saya dulu pendukung jokowi nanti saya akan dukung subianto untuk jadi
7609,2023-01-20,1225312609.0,3188,"Buncit Indah, Jakarta Selatan",itu sebabnya kita semua ingin agar ketua dewan pembina dan ketua umum partai gerindra prabowo subianto dalam pilpres maju sebagai calon presiden tutur muzani sabtu,Positive,itu sebabnya kita semua ingin agar ketua dewan pembina dan ketua umum partai gerindra subianto dalam pilpres maju sebagai calon tutur muzani sabtu
7614,2023-01-20,1225312609.0,3188,"Buncit Indah, Jakarta Selatan",sebelumnya presiden jokowi menyinggung soal kans prabowo subianto jika menjadi capres di pilpres,Positive,sebelumnya jokowi menyinggung soal kans subianto jika menjadi capres di pilpres
7615,2023-01-20,1225312609.0,3188,"Buncit Indah, Jakarta Selatan",ketua umum dpp partai gerindra prabowo subianto mengaminkan pernyataan presiden ri joko widodo jokowi yang mendukung dirinya sebagai capres di pilpres,Positive,ketua umum dpp partai gerindra subianto mengaminkan pernyataan joko widodo jokowi yang mendukung dirinya sebagai capres di pilpres
7616,2023-01-20,1225312609.0,3188,"Buncit Indah, Jakarta Selatan",prabowo subianto aminkan pernyataan presiden jokowi soal jatah pilpres,Positive,subianto aminkan pernyataan jokowi soal jatah pilpres
7620,2023-01-20,465280582.0,13675,jakarta,semoga saja putra terbaik bangsa pak prabowo subianto yg punya potensi untuk memimpin secara profesional amanah jujur bertanggung jawab bermartabat menjadi presiden aminn,Positive,semoga saja putra terbaik bangsa pak subianto yg punya potensi untuk memimpin secara profesional amanah jujur bertanggung jawab bermartabat menjadi aminn
7622,2023-01-20,317863682.0,635,Indonesia,berikan tugas baru jokowi makin yakin kinerja menhan prabowo tugas baru prabowo dari presiden jokowi pengamat kepercayaan ncid jokowi dan prabowo makin mesra jelang pilpres tambah kewenangan lebih jokowi makin percaya prabowo,Positive,berikan tugas baru jokowi makin yakin kinerja menhan tugas baru dari jokowi pengamat kepercayaan ncid jokowi dan makin mesra jelang pilpres tambah kewenangan lebih jokowi makin percaya
7625,2023-01-20,2321424644.0,605,Indonesia Raya,peranking makerjokowi dalam restu kepada calon presiden untuk pemilu prabowo subianto,Positive,peranking makerjokowi dalam restu kepada calon untuk pemilu subianto
7626,2023-01-20,157865745.0,3762,,hasil survei lembaga survei jakarta lsj merilis data menyebutkan pendukung prabowo subianto di pemilu termasuk pemilih loyal karena mereka memilih tetap mendukung pada pemilu prabowo subianto,Positive,hasil survei lembaga survei jakarta lsj merilis data menyebutkan pendukung subianto di pemilu termasuk pemilih loyal karena mereka memilih tetap mendukung pada pemilu subianto
7627,2023-01-20,157865745.0,3762,,untuk itu kita harus kerja sinergis kita harus bekerja sama semua unsur kita dan beliau minta kementerian pertahanan untuk menjadi semacam koordinator supaya indonesia selalu antisipasi prabowo subianto,Positive,untuk itu kita harus kerja sinergis kita harus bekerja sama semua unsur kita dan beliau minta kementerian pertahanan untuk menjadi semacam koordinator supaya indonesia selalu antisipasi subianto
7630,2023-01-20,157865745.0,3762,,lembaga yang dipimpin prabowo ini diminta menjadi lembaga yang mengkoordinasi informasi intelijen terkait pertahanan prabowo subianto,Positive,lembaga yang dipimpin ini diminta menjadi lembaga yang mengkoordinasi informasi intelijen terkait pertahanan subianto
7631,2023-01-20,1225312609.0,3188,"Buncit Indah, Jakarta Selatan",setelah itu presiden jokowi menjawab pertanyaan mengenai wejangan untuk prabowo subianto mempersiapkan diri menuju pilpres,Negative,setelah itu jokowi menjawab pertanyaan mengenai wejangan untuk subianto mempersiapkan diri menuju pilpres
7633,2023-01-20,1225312609.0,3188,"Buncit Indah, Jakarta Selatan",pernyataan presiden jokowi itu menjawab pertanyaan mengenai restu bagi prabowo subianto untuk pilpres,Positive,pernyataan jokowi itu menjawab pertanyaan mengenai restu bagi subianto untuk pilpres
7636,2023-01-20,157865745.0,3762,,kemudian isu migrasi pendukung prabowo subianto ke anies baswedan ternyata dominan terjadi di dunia maya media sosial prabowo subianto presiden,Positive,kemudian isu migrasi pendukung subianto ke ternyata dominan terjadi di dunia maya media sosial subianto
7645,2023-01-20,137560294.0,1932,"Denver, CO",untuk itu kita harus kerja sinergis kita harus bekerja sama semua unsur kita dan beliau minta kementerian pertahanan untuk menjadi semacam koordinator supaya indonesia selalu antisipasi prabowo subianto,Positive,untuk itu kita harus kerja sinergis kita harus bekerja sama semua unsur kita dan beliau minta kementerian pertahanan untuk menjadi semacam koordinator supaya indonesia selalu antisipasi subianto
7656,2023-01-20,440795943.0,756,,dasco mengungkapkan prabowo telah meminta izin langsung ke presiden jokowi soal keinginannya maju di pilpres,Positive,dasco mengungkapkan telah meminta izin langsung ke jokowi soal keinginannya maju di pilpres
7659,2023-01-20,294348814.0,783,,dasco mengungkapkan prabowo telah meminta izin langsung ke presiden jokowi soal keinginannya maju di pilpres,Positive,dasco mengungkapkan telah meminta izin langsung ke jokowi soal keinginannya maju di pilpres
7665,2023-01-20,440795943.0,756,,wakil ketua dpr ri sufmi dasco menjelaskan seluruh kader gerindra sudah mengamanatkan prabowo subianto maju sebagai calon presiden di pilpres,Negative,wakil ketua dpr sufmi dasco menjelaskan seluruh kader gerindra sudah mengamanatkan subianto maju sebagai calon di pilpres
7678,2023-01-20,137560294.0,1932,"Denver, CO",prabowo subianto lantaran prestasi dan kinerja sebagai menhan ri menjadi penopang penguatan kabinet indonesia maju dibawah kepemimpinan jokowimaruf prabowo subianto presiden ri,Positive,subianto lantaran prestasi dan kinerja sebagai menhan menjadi penopang penguatan kabinet indonesia maju dibawah kepemimpinan jokowimaruf subianto
7681,2023-01-20,465458275.0,12086,Pulau Impian,konsep kepemimpinan yg paripurna luar biasa semoga allah wazala selalu memberikan kekuatan kesehatan keberkahan dan perlindungannya kpd bapak prabowo subianto presiden ri ku amin ya rab,Positive,konsep kepemimpinan yg paripurna luar biasa semoga allah wazala selalu memberikan kekuatan kesehatan keberkahan dan perlindungannya kpd bapak subianto ku amin ya rab
7684,2023-01-20,137560294.0,1932,"Denver, CO",prabowo subianto di pemilu termasuk pemilih loyal karena mereka memilih tetap mendukung pada pemilu prabowo subianto prabowo presiden,Positive,subianto di pemilu termasuk pemilih loyal karena mereka memilih tetap mendukung pada pemilu subianto
7687,2023-01-20,137560294.0,1932,"Denver, CO",keberhasilan pemerintah menangani pandemi covid dengan sigap dan cepat sehingga kondisi ekonomi tanah air tetap kuat prabowo subianto prabowo presiden ri,Positive,keberhasilan pemerintah menangani pandemi covid dengan sigap dan cepat sehingga kondisi ekonomi tanah air tetap kuat subianto
7699,2023-01-20,440795943.0,756,,presiden jokowi secara terangterangan mengaku akan mendukung menteri pertahanan prabowo subianto di pilpres mendatang,Positive,jokowi secara terangterangan mengaku akan mendukung menteri pertahanan subianto di pilpres mendatang
7702,2023-01-20,1341398533.0,2997,"Semarang, Jawa Tengah",bantuan yang di samarang itu dideket rumahku kak daerah langganan banjir wkwk semoga pak prabowo subianto jadi presiden yakin pasti beliau bakal berupaya tangkal banjir deh prabowo subianto,Positive,bantuan yang di samarang itu dideket rumahku kak daerah langganan banjir wkwk semoga pak subianto jadi yakin pasti beliau bakal berupaya tangkal banjir deh subianto
7703,2023-01-20,294348814.0,783,,presiden jokowi secara terangterangan mengaku akan mendukung menteri pertahanan prabowo subianto di pilpres mendatang,Positive,jokowi secara terangterangan mengaku akan mendukung menteri pertahanan subianto di pilpres mendatang
7706,2023-01-20,2410032319.0,9571,Alam Bawah Sadar,karenanya adi beranggapan ketua umum dpp partai gerindra tersebut patut diperhitungkan dalam pemilihan presiden pilpres prabowo subianto,Positive,karenanya adi beranggapan ketua umum dpp partai gerindra tersebut patut diperhitungkan dalam pemilihan pilpres subianto
7707,2023-01-20,137560294.0,1932,"Denver, CO",dan hanya diikuti tiga capres dengan data hasil survei pasangan caprescawapres yang dipilih responden pada pemilu ucapnya prabowo subianto presiden,Negative,dan hanya diikuti tiga capres dengan data hasil survei pasangan caprescawapres yang dipilih responden pada pemilu ucapnya subianto
7708,2023-01-20,2320493293.0,1806,,aku dulu pendukung jokowi nanti aku akan dukung prabowo subianto untuk jadi presiden ri kayak relawan projo,Positive,aku dulu pendukung jokowi nanti aku akan dukung subianto untuk jadi kayak relawan projo
