,clean_manual
2821,alahu akbar insyahalah tidak ada yang mustahil sudah alah swt yang berkehendak amin ya alah
2822,mantapd insyalah wakil
2823,hasibuan mantapd insyalah wakil
2824,dpw provinsi papua barat berkomitmen memenangkan usungan di
2825,bangsat buzer itu pintar bohongpinter ngelez pintar bikin narasi adu dombapinter mengalihkan isyu pintar fitnah buzer mati sendiri atau bunuh diri masal
2827,masyalah pak god job paham para mahasiswa tentang proses pembangunan di akan baik bisa menarik investor asing dimasa amin
2828,huahahaha buzerp dan cebong bingung menjelekkan yang insya dengan cara lagi
2829,mengomong kau cok komut pertamina ahok menteri kebakaran terjd di era heru jkw yang melegalkan kpg tanah merah dengan bang ktp kalo kau menyalahkan tungu
2830,ingat malang berdarah karena sepak bola hapuskan banteng amp seluruh harga mati
2831,dan di timur akan segera menandatangani kesepakatan mengusung sebagai pada
2832,yang pasti pendukung siap menangkan pak sebagai
2833,tangapan dki jakarta terhadap
2834,kebohongan janji
2838,benar itulah sosok sebenarnya tidak salah jika suara hati nurani rakyatmasyarakat kebanyakan itulah suara kebenaran insya alah dengan mengikuti suara hati dengan tulus membawa keyakinan pilihanya akan bulat semangat
2841,madha fahnor kamu itu enggak mampu berpikir mana yang baik dan mana yang buruk kalo preferensimu itu bahwa sih gelarnya maka yang banget berjubel di tapi yang kayak pak engak ada yang menandinginya dalam segi apapun sebagai pemimpin nasional insya alah
2842,testimoni dki jakarta terhadap
2843,dia satu satunya tokoh yang bisa dan akan memajukan setelah di rusak okeh sih pinokio raja dustayg tidak suka pak hanya tidak punya akal alias sakit jiwanyapaham
2844,samosir psi sontoloyo negara ini kalo dipimpin mereka yang gagal paham dan penuh kebencian dengan kesuksesan pak insyalah
2846,fahnor ya pak menampak sehat dan segar sehat selalu ya pakterus kuat hinga sehinga pada satnya kurang sesuatu apapun kita menghadiri pelantikan dengan yang juga muda dan segar yaitu bpk
2847,pemimpin perubahan mencerdaskan anak bangsa sejahtera cerdas baik bijak ingin anak anak baik karakternya akhlaknya
2848,bong persiapkan diri anda menyaksikan pelantikan sebagai
2849,persiapkan diri bong menyaksikan dilantik sehat ya bong
2850,ketakutan yang luar biasa tidak bisa dipungkiri berpeluang di bagi mereka keamanan pemodal utama meracuni otak mereka akan keutaman pemenuhan kebutuhan hajat hidup dan kesejahteran
2851,dki enggak kenal kau busers cebongnga usah bawa yang korban kau salahkan bawa enggak paham enggak usah berkoar koar percuma enggak mendengarkan
2852,masih berandai padahal pak sudah purna tugas ya sudah nanti tahu pak sih ahog boleh nyagub dki lagi biar sih cusnul senang
2853,beberkan kriteria pendamping untuk
2854,insyalah pak periode dan siap untuk periksa kebijakan ugal ugalan selama berkuasa
2855,insyalah pak sd pasti pak ruhut sitompul memuji pak biasalah namanya dunia pangung sandiwara
2856,kahmi punya kapasitas pimpin hegara didukung hmi bacapres presidium korps alumni himpunan mahasiswa islam kahmi herman khaeron menyatakan didukung para kaderhmisbg bacapres pada
2857,relawan rampas diy siap bantu caleg dari koalisi perubahan samasama membutuhkan tujuanya memenangkan sebagai pada jogja
2858,kota malang siap sukseskan sangat memilih karena sudah terbukti sebagai pemimpin yang membela harapanya akan adil makmur dan sejahtera
2859,semakin melambung kau bismilah
2860,tanjung mungkin maksudnya adalah pilihan pada
2861,jika nanti ternyata pak yang di kita lihat nanti sih kutu loncat ini akan menjilat ludahnya sendiri
2862,
2865,lima alasan anak muda mengidolakan yang ketiga sunguh membagongkan covid senin maret ada meningal malam liverpol anfield gakpo deh gea manchester united emyu fan mu ten hag piranha
2866,masih ada pihak yang meragukan kepemimpinan dan kemampuan ini nasehat tokoh kristiani solo keberanian dan kesedian guna melanjutkan kepemimpinanya untuk dicalonkan sebagai adalah kebangan tersendiri bagi kami
2868,kenapa di cueki karena sudah jelas medan tidak suka ke tapi sukanya ke pak
2869,yang keluyuran ke luar negeri yang di amerika serikat
2871,alhamdulilah setelah sulsel sekarang sumatera barat insyalah
2872,semangat itu jangan pudarnext harus muda pintar cerdas dan bersahaja juara
2875,kenapa harus karena ini soal penegakan keadilan amp keberpihakan kepada kecil catet kecil ya
2876,ketua meminta maf kepada ketua surya paloh karena akan bersaing dengan di berbeda sikap namun keduanya sepakat menjaga berjalan damai selengkapnya kunjungi
2877,fahnor alhamdulilah luar biasa sumatera barat bersatu untuk demi keadilan insyalah
2878,kepengen cepat lihat apakah poltak merapat ke tidak
2879,astaqfirloh hobinya menyalahkan aniesya alah pak situasi tenang makmur
2880,ya enggak heranlah karena mereka lagi bingung fitnah lagi untuk
2881,gue yakin pilgub dki dengan ayat dan mayatnya tidak akan pernah laku di yakin seyakin yakinya ingin ulang sukses usung di pilkada dki pada
2882,ketua secara tegas menolak wacana untuk memasangkan wakil ketua dewan pembina dengan pada
2885,pastilah pasti ke
2886,dicintai di dalam dan di luar negeri
2888,welcome selamat jalan ebong khusnul khotima
2890,insyalah menang putaran saja biar menghemat dana
2891,fahnor promo lagi ah kang
2892,kota malang siap sukseskan
2893,dan gue serta seluruh kecuali cebongers yang belum insaf karena iri dengki tapi akan memilih pak sebagai insyalah amin ya rabalalamin
2896,mengatakan siap menghadapi di
2897,didu meminta tolong andai
2898,coba sebutin dong kerja selama itu
2899,karena salah makanya kita jadikan dia agar bisa membereskan kesalahanya amin
2900,peraturan mereka tidak pernah salah kalo salahliat no cebong dilarang protes kalo protesliat no kalo bukanliat no silakan tertawa sepuasnya kalo enggak ketawaliat no
2901,bersiap cari bekal pemenangan berikutnya tiga kemarin cari bekalnya di hutan tiga kedepan gantian di hotel di hutan oke di hotel juga siapks menang
2904,alhamdulilah insha alah
2905,kayaknya sipoltak sat pak dilantik di yaqin pasti gila benaran nih
2906,memang ok hal ada kaitanya pas kita
2908,dalam menghadapi sebelumnya telah mendeklarasikan mantan dki jakarta sebagai
2911,jeul pilihqn ku tapi
2912,yang salah wkwkwk yang benar
2913,pasmantap gaspol kita menangkan
2914,jika lihat pemimpin itu pertama lihatlah rumah tanga mereka jika dia bisa imam yang baik dalam keluarga terutama untuk istri dan anakanaknya insyalah pemimpin negeri juga akan baik insyalah
2915,setu mengajukan imb personal tanpa ktp hebat nih enggak pakai rt rw waduh kok doang yang kena fitnah kencang untuk
2916,akan mendapatkan serangan dari dua kubu satu dari kelompok kiri dan yang kedua dari kelompok kiri belum terlalu mateng alias baru coba kelompok kiri tapi satukan barisan dan buatkan tekad untuk menangkan
2917,fahnor bwahaha tanya saya waktu lu jungkir balik kayak menangis darah kayak di pilkada dki team pemenangan urusan dengan aye aye insyalah
2918,syaikhu mengakui sosok masih apabila kembali bersanding dengan pada
2919,ingin ulang sukses usung di pilkada dki pada
2921,pembohong masih yakin
2922,ketum merespons wacana duet dengan salahudin aniesandi pada
2923,tiba di kota palu disambut teriakan
2924,ketua gerakan raya menyatakan kesiapan menghadapi dalam pertarungan
2925,psisi sudah selesai di untuk
2926,idha benar untuk sat ini masalah kayak gagasanide untuk kedepan baru ini membuktikan bahwa visioner koalisi perubahan berjalan sesuai keinginan mayoritas ayo dan wujudkan semangat
2927,panik dan ketakutan luar biasa sih ruhut tua bangka dengan semakin banyaknya
2928,akhirnya waktu dinantinanti hadir juga latihan perempuan siaga latansa dpd kota bogor alhamdulilah berawal dan berakhir dengan senyuman kalian luar biasa menang
2929,id karena pak republik
2930,surya paloh pastikan ini terjadi jika
2931,didu terbukti kerja nyata tidak lah
2932,purnawirawan senior tni amp polri penuh sebagai ini baru warasorang pintar pintar profil letjen tni purn ediwan peraih adhi makayasa yang sowan ke kediaman
2933,bismilah makasar mulai sebar alat peraga di
2934,bismilah negara kesatuan republik dengan kemenangan telak dan menang di atas target amin
2935,oligarki buzer para bani kecebong butuh tapi butuh butuh perubahan pray tapi
2936,waras lipat kayak terserah lahsuka suka saja yang penting meminta untuk
2937,achmadi
2938,setuju bang berbagai cara dilakukan oleh antek rezim ini untuk memfitnah dan gagalkan dari aspek hukum hinga musibah kebakaran depo otak mereka sunguh dongok dan kocak banget insyalah
2939,bersih macam kau
2940,saja doakan juga untuk kaum cebong got selalu sehat supaya bisa menyaksikan pelantikan sebagai
2941,siap lawan di isyaratkan tutup peluang koalisi dengan pak sih yang enggak siap semangat pakinsya alah bpk
2942,wkwkwk kaum od buzerp ketakutan lihat pak nantinya segala cara fitnah adu domba dan kebencian mereka produksi mereka takut nanti enggak makan lagi dari ngebuzer dan menjilat pokoknya kayak mana salah pak
2943,saya sebagai negara berkewajiban untuk memenangkan sebagai dalam
2944,mpu kumat lagi sih miduk temanya lae aduh bikin provokasi oktober jika alah swt mengabulkan doa kami mungkin kalian bisa komisaris bumn karena mengkampanyekan
2945,jangan pernah lupakan kesombongan seorang terhadap habib riziq shihab
2946,alhamdulilah mantap insyalah
2947,jelas kagak ada yang larang neng om bowo sampai ubanan itu enggak neng yang lain jua bebas boikot grnd dan om bowo kembali ke pilihan masingmasing seperti abah sekecamatan dan mantap untuk insyalah
2948,untuk memang nape lo
2949,lu belum merdeka ya mending sana ke negeri cina jualan tempe bakalan dan ijasah nya palsu seperti jungjunan kamu conge
2950,insha alah pak amin ya alah
2951,kahmi punya kapasitas didukung covid mingu maret ada meningal besok senin plumpang tanah merah pertamina ariel liverpol manchester united man united
2952,petaka berulang di tanah plumpang ada meningal ariel
2953,insha alah pak amin ya alah
2955,testestest yang suka retwet like
2956,prima adalah baru cuma karena dekat dengan istana gugatan ditunda dikabulkan pengadilan negeri jakarta pusat segitu takutnya sampai gunakan kecil sebagai senjata menjegal sudah enggak yakin bisa menang ya
2957,pintar sebenrnya bicara alasan kenapa tidak om bowo terlalu alasan tapi yang jelas insyalah akan bersatu memenangkan
2958,mari bersatu padu memperbaiki negeri yang sudah porak poranda ini insyalah
2959,bowo sudah jelas enggak berani nentang bos belum terbukti makanya yuk kita buktikan di ini bersatu
2960,kata nanti pikir saja sendiri tong yang penting aing mah
2961,pak cebong stres
2962,barat bebas dari jangan masuk kandang perlu perubahan yang baik
2963,nih cebong kalap menjegal pak gila ya bong sampai pak
2964,asmara sampai ipin upin lulus sekolah gbakalan lihat saja pendukung buzer bakalan gembel merdeka
2965,koesmirah itu dimulai sat kader grnd mulai serang apalagi wakil gerinda sih mulai serang dari utang pilkada amp pura istikharah padahal dia tau sendiri isi perjanjian utangnya nya saling serang dan counter atack di mulai
2967,ngehe asmara didu saewad idha sir
2968,puluhan purnawirawan tni dan polri menyatakan untuk sebagai
2969,dumdum lu gobloknya sampai ubun dum ahok sat ini masih menjabat di pertamina kenapa yang lu serang takut amp lu enggak punya kerjan lagi begini amat lu mencari duitnya lawak jir
2970,sekali yang pak sebagai baru di
2971,achmadi jangan salah tafsir sesunguhnya mereka ingin juga nanti
2973,
2974,test penguna apakah yang di harapkan dengan penguna tiktok bawa mas pilihan obyektif terbaik rasional untuk di like retwet
2975,seret pak di
2979,sudah enggak salah jika memutuskan memilih untuk
2980,ketua menangapi soal yang diduetkan dengan untuk berpasangan dalam kontestasi soal mas sandi saya kira mas sandi sudah menjawab berkalikali di
2981,relawan mulanies makasar komitmen menangkan
2982,kayak sudah mulai nih kampanye yang salah jemuran kagak kering gegara hujan juga ulah ukraina kalah perang lawan rusia juga ulah tesla buka kantor di penang dan di itu juga gegara anie nasib
2983,sebagai negarawan ada baiknya lawan oligarki selamatkan
2984,bersihin yang dibersihin kalaupun ada yang harus dibersihin itulah otakmu yang kotor saya pengin tahu bagaimana nasibmu amp kawanmu para buzerp produsen ujaran kebencian saya berdoa mahluk seperti segera punah
2985,sebuah awal yang baik pak
2986,terhadap sebagai datang dari pegiat media sosial saeful zaman keren nih
2987,ahok sudah memperingatkan soal depo pertamina plumpang
2988,pemimpin cerdas dan jujur
2990,salie asmara makanya sampai keturunanku yang ke aku enggak akan pernah saya ke dan dia diberi umur panjang
2991,elektabilitas turun dan gagal salah satu penyebabnya adalah strategi musni umar dalam mengumbar rekam jejak
2992,mereka ketakutan sekiranya dilantik nanti mata pencarian mereka hapus
2993,waras pak yang ke
2994,pasti tahu
2996,gagal dicalonkan dan berkoalisi dengan mencalonkan
2997,ruhut memang biangkerok nya indonesiahidup
2999,seandainya syarat kapitalisme dari tesla yang disetujui aniesmas saewad sementara oposisi anti penjajahan ekonomi asing kecuali untuk yang teriak
3000,topik yang dibahas sebagai yang ke mengapa bu susi najwa dan tsamara dibawabawa drun masih sehat
3001,tenangtanki pertamina ng akan meledak lagijika karena akan gampang ngaturnyadan juga banjir dijakarta
3003,sajak republik apelo apelo
3004,wan abud bisanya sih bikin program berantakan
3005,fahnor karena pak negarawan mungkin saja seperti pilgub jakarta pak dan bergabung kekoalisi perubahan dan kembali untuk mas
3007,abw salam perubahan dan pebaikan untuk baik jaya pancasila abadi dan wakil di amin
3009,idha penyampaianya tenang terarah dan jelas serta bisa dipahami tidak pakai marah tidak pakai kata jamban dan tidak membuat bingung alah swt mentakdirkan pak pada nanti amin
3011,memang hal itu yang kita harap saya indak munafik ya agar tidak nanti tapi pembiaran dan pemberian pangung pada nya yang menerus berlaku bisa saja membalik keadan
3012,dumdum entar blunder juga apapun isunya satu komando pak
3013,pemimpin merakyat
3014,gunakan kahmi dan organisasi terlarang untuk
3017,cebong goblok akan slu mencari pembelan demi mencekal semangat ebong dungu
3018,walau sudah mantan ingat jakarta mantap pak sangat peduli kesedihan
3019,ul inzalah amanah pak
3020,bersatu lawan oligarki selamatkan
3022,alhamdulilah deny siregar sudah membayangkan saya harap anda sekeluarga dan kolega sudi kiranya di nanti
3024,wkwkwkwk alhamdulilah deny siregar sudah membayangkan saya harap anda sekeluarga dan kolega sudi kiranya di nanti
3027,benar banget yang dikatakan mendatang yang merasa susah setelah keoemimpinan mementingkan oligarki mari kita doakan di periode mendatang amin
3028,ketika aku zom masa logo nya agak blur judul beritanya tajem padahal capture sabar banget kita sih salam bekingan sampai welcome tapi pertamina
3029,bajer kok ngehe asmara didu saewad idha sir
3030,di amin yra
3031,luar biasa disambut teriakan setibanya di kota palu
3032,luar biasa disambut teriakan
3033,pastikan kita memilih ke
3035,pada panik dan ketakutan manusia yang enggak punya identitas
3036,kusut oh pendukung ternyata sudah diduga setelah didukung amerika maka sekarang disusun narasi pki untuk nanti sat pilgub narasinya jangan pemimpin kafir maka nanti sudah disiapkan narasi jangan yang didukung pki
3037,asmara untuk yang baik
3038,ikrar menangkan sebagai head topics
3039,insyalah pak periode
3040,amp ruhut sitompul bunuh diri
3041,mari kita lihat bagaimana pun para penjilat ini bertahan insyalah akan pernah
3042,menjelang pilihan selalu trending topic
3043,sudah di pasti yang ikn enggak bakalan di lanjutkan itu kemauan kemauan kamu saja tinggal sana
3044,bagaimana kalo yang kamu enggak bisa menjilat lagi sekarang saja kamu penjilat enggak
3045,bismilah untuk selamatkan dari oligarki
3046,fahnor alhamdulilah sudah menunjukan kinerjanya di dki selam kurang dan itulah yang membuat percaya dan yakin kepada tapi siapapun yang mng di kontestasi ini insyalah itu kemenangan
3047,jhon kau enggak usah koar tenaga kau habis masalah sebagai pak tidak itu suara yang memilih suara kau tapi insya semangkin dikuyo oleh begejil jin iprit kersaning gusti amin
3048,asmara hkpan gue mnjegala bosbiar lu tau ya gue mndukung pak baswedah baca brulang disebar juga gp silakan h
3049,magdalena hidup waktunya bersatu dalam gelombang perubahan insyalah
3050,fahnor saling ajak dalam kebaikan itu baik kok mari kita bersatu untuk yang baik
3051,fahnor ini baru sulsel dimana ada disitu ada lautan manusia kebaikan selalu mengikuti baik hanya mereka yang bersih nuraninya dan sehat akalnya yang terpangil untuk bersatu gerbong perubahan insyalah
3053,yakin ada yakin bahkan tanpa perlawanan dengan segala cara negatif dan negosiasi dari rezim yang berkuasa sat ini boleh dengan syarat yang dinginkan rezim aman begitu lanjutkan akankah cawapresnya boneka
3054,dan penguasa kayaknya ada yang kutu loncat lagi nih kali ini dia akan penjilat deh dia merengek meminta kartu angota hehehehe merdeka
3055,pak di amin ya robal alamin
3056,pegiat media sosial ini sebagai
3057,anak cucu pki enggak akan senang mereka berusaha menjatuhkan baik menang anak cucu pki kita tendang dari
3058,para hacker kawal pemenangan atas jangan sampai ada penghalalan cara busuk sbgmn tahu perhatikan server baik di cina maupun singapur karena cina merasa berkepentingan ingin menguasai nkri
3059,jika pemerintah dan para pendukung pemerintah berkeinginan untuk menunda dengan alasan negara tidak memiliki dana yang cukup untuk mengelar pada bagaimana jika langsung dilantik saja sebagai dengan alasan agar efisien
3060,dony enggak akan berani mereka bang tungu pak beres
3061,apel siaga perlu bikin hoaks dan memaki mereka yang menyerang covid sabtu maret ada meningal inalilahi ahok jep bismilah hahaha firmino malming malam mingu
3062,lah keruk sungai juga dilanjutkan atas perintah hakim ptun coba kurang tat ku hidup
3063,pengamat soal kebakaran depo plumpang semakin membuktikan pertamina memang abai ada meningal
3064,ini saya alah dibawah kepemimpinan sebagai republik akan baik sejahtera damai bangsanya
3065,jika suatu sat nanti presidendgn sendirinya buzerp seperti usnul ini akan menghilang entah kemanatau mungkin akan menjilat kepada penguasa yang baruseperti yang dilakukan oleh ruhut sitompultungu saja waktunya itu enga akan lama
3066,sambut deklarasi tangsel al out menangkan sebagai sesuai arahan ketum tangsel siapd cawapresnya jayabaya banten
3067,pastikan kita memilih
3068,ke
3069,inisiator gerakan nurani kebangsan gnk habib syakur ali mahdi al hamid menduga kuat bahwa politisasi identitas masih marak terjadi di hal ini jika memang sebagai nanti
3070,hasibuan hadapilah kenyatan akan dan kamu akan sesak nafas nanti tiap dan kejang
3072,coba sampai enggak retwet
3073,tua cebong kau bacot sampai mulut berbusa dan mati pun enggak mendengarkan
3074,amin yra
3075,amin yra
3076,ayo plumpang
3077,alhamdulilah jakarta puluhan purnawirawan perwira tingi tnipolri sebagai pada letjen tni purn ediwan menyebutkan pihaknya telah menemui di kediamanya dan berdiskusi hal
3078,pertaruhakan nya dan dia jual ke neraka agar dia bisa
3080,viva
3081,asmara is smart leader insyalah
3082,pertamina yang lalai yang salah serang om bisa lho
3083,dumdum btp om tiap jangan sampai tidak menyerang ya jangan lupa juga order tiputipu untuk angkat dan biar kelihatan ungul sampai nanti hutang triliun yang dibikin bisa lunas nih
3084,dihubungkan dengan ya om jangan lupa untuk menyerang jangan lupa juga bikin tiputipu supaya dan kelihatan ungul enggak enak nanti yang adalah
3085,mari kita lihat bagaimana pun para penjilat bermimpi rezim banteng ini bertahan insyalah
3086,sosok pemimpin yang pantas ditiru terciduk berpelukan dengan yang mukhrim
3087,kerjan cuma bisa ganti bikin program enggak ada yang becus
3088,enggak ngaruh bung
3089,enggak ada urusan memang pas
3090,lelete asmara didu saewad idha sir
3091,pemimpin yang amanahbekerja demi membahagiakan masyarakatnyatidak korupsiwalaupun kesempatan untuk korupsi tapi tidak dipergunakanyaitu lah aniesangat pantas untuk memimpin negeri inipresiden
3094,dengan izin alah kau menjiat ke lagi termehek mehek aku
3095,memang kerja dan tugasnys hanya untuk mengurusi bp yang luar biasa dicintai karena kerja cerdaskerja nyata kerja jujur nyata dan berwibawa gongongan hanya origami haha ha merdeka makmur
3096,jika tetapi lu tentang ikn dicabut oleh parlemen atas desakan ekstra parlemen tentu sebagai tidak bisa melanjutkan pembangunan ikn salah jika tidak melanjutkan pembangunan ikn
3097,jika tetapi lu tentang ikn dicabut oleh parlemen atas desakan ekstra parlemen tentu sebagai tidak bisa melanjutkan pembangunan ikn
3098,cuma kesal kaget murka dan janji lalu tidak di tepati yang itu sih baru di
3099,hijriah
3100,hijriah masehi
3101,sih sinting sudah keabisan akal nya nul nul relawan deh bubar lagi moncer sekarang paham kau nul amin ya rob
3102,mari kita mas sebagai salam perubahan dan perbaikan
3103,sabar bang kau sedang dalam ujian jangan dengarkan setan setan cuap cuap itu tanda yang tidak ada kemampuan saya yakin bang amin ya rob
3104,dekat pendukung simpatisan dan semakin buzerp recehan semakin panik dan ketakutan fitnah murahan bermutu dicari dalam lobang sampah tetapi tegar dan berkibar menuju
3106,pensiunan jenderal saja pak mosok kami enggak ya dukunglah
3107,kapasitas di atas kapasitas sat ini jika angap mumpuni ikut dia dulu jubir perlu diajari lagi
3108,dumdum santai saja sudah didepan mata pada waktunya
3109,betul banget bang mpul toidipak bawesdan waktu sangat berprestasi gemilang pantas mendatang karena pak bisa mensejahterakan memakmurkan memakmurkan tenaga kerja asing
3110,yang aneh itu lu kalo memang surveynya bawah yang artinya peluang terpilihnya sangat kecil lantas kenapa isi twit lu setiap sat fitnah mulu
3111,eka enggak usah bu soalnya menang kok pak pasti
3112,sebenarnya para pembenci dalam hati mereka mengakui bahwa memang sangat layakamp pantas sebagai dibandingkan dengan jago mereka yang tidak bisa diandalkan shg untuk menutupi kekecewanya mereka akan mencari kesalahan sekecil apapun mereka stres angap saja hiburan
3113,asmara pak pantas
3114,as insyalah
3115,eka santai kok
3116,ribu sangat
3117,beri kuliah di ntu singapura refly jangan dibandingkan dengan lain covid jumat maret ada meningal bismilah cipung ya alah plumpang pn jakpus prima jep klop firmino
3118,surabaya rasanya ada yang aneh di negeri ini jumat ada meningal
3119,presidium korps alumni himpunan mahasiswa islam kahmi herman khaeron menyatakan didukung para kader hmi sebagai bacapres pada punya kapasitas memimpin negara setelah sukses
3120,id yang pasti
3121,koalisi perubahan tidak butuh berkoalisi dengan karena sudah terpenuhi bahkan dari untuk mencalonkan sebagai
3122,insya alah dan wakil di amin
3123,kun agus harimurti yudhoyono wakil negara kesatuan republik mendampingi sebagai negara kesatuan republik fayakunamin
3124,achmadi halo sdr hasto kristianto masalah pembangunan ikn merupakan amanat undangundang pun pada wajib melanjutkan pembangunan ikn tidak berarti tidak menjalankan undangundang begitu juga dengan jika
3125,giat sapa sl menjaga info aspirasi nya pemuda anak bangsa yang sl mengharap perubahan dan perbaikan harapan mas dan mas pemimpin perubahan dan perbaikan harapan dan wakil
3126,mugia agus harimurti yudhoyono wakil negara kesatuan republik mendampingi negara kesatuan republik amin
3127,saewad berarti yakin
3128,hebat nih pak didukung oleh sebagai
3129,dari sebagai
3130,namanya juga hoaker sampai matipun tapi sakit hati apalagi di sat pak menjabat betapa ngilunya hatiku
3132,sgera dan sterusx menuju perubahan alah swt meridhoi amin
3133,nanti usulkan ke ya mbak agar ada kementerian urusan bangun jalan kabupaten
3134,insya alah apakah formulae bisa sukses tanpa sory dont think sok
3135,mari kita mas sebagai salam perubahan dan perbaikan
3136,id insya alah di amin
3137,telah didukung koalisi perubahan dan sebagai bacapres peluang memenangkan belum bisa dipastikan
3138,pilihan yang rasional
3139,dalam menyaksikan bulat sebagai pada itu selengkapnya
3140,siapapun peminpin nya siapapun wakil nyayg penting dan dan wakil nya
3141,sudah gurem dan ghoib serang cuma sebatas doang nanti mereka mendadak bacot lagi kok meskipun suara di cuma kurang dari
3142,mas dan pengusung akan memilih yang terbaik dan berpeluang untuk menang dan relawan al out untuk memenangkan siapapun cawapresnya yang penting nya
3143,prestasi wan bayar di jakarta budaya sepeda di negara tropis pol bajaj eks rektor universitas no di setelah itb amp ui tanpa pernah dekan indonesa ke
3144,selama ini otaknya enggak pernah direfres sekarang dia sedikit kebangan menikmati prestasinya pak sekalian ketika pak dilantik nanti di ada poin untuk mendekati
3145,usung sebagai
3146,mari kita mas sebagai
3147,pak sukses tiktoknya supaya besok tahu bisa bikin konten pelantikan pak
3148,keraguan terhadap kebijakan ke depan seolah keyakinan mereka kalo amp rumusan gampang kalahin banteng cuma naik mercy
3150,insya alah pak
3152,wahai kau firzalaksana dajal yang galauanies
3155,husni welcome selamat jalan ebong khusnul khotimah
3156,damai maf yaku jelasin biar pada tau deh enggak salah bacaku ini siap bisa baca kanh
3157,pak enggak akan ada lagi cerita yang beginian nkri bisa dan gemilang perlu pemimpin yang punya integritas capable kredible briliancerdas revolusioner dan independen merdeka
3158,tanjung enggak tau malurai gedek dulu di hina sekarang di pakai nanti jis juga begitu secara tidak langsung mengakui keberhasilan sang
3159,mengajak kader untuk mas sebagai
3160,jika ragu lanjutkan ikn gegara proyek ini
3161,sir pak is the best
3162,menjegal selaku di maka atas dasar sistim hukum dan konsitusi dasar sebagai stakeholder dengan segala hak beban dan tangung jawab harus segera mengambil alih tupoksi kpu jika tidak atau undur lalu
3163,dki jakarta akan al out menangkan sebagai
