,clean_manual
8076,anak sholeh piloih gus mahasin kakak kandung gus baha
8077,masak sih bong
8078,bolong mudahan asal amp yang sudah tercemar korupsi berani anjukan lu hukuman mati terhadap koruptor amp perampasan aset koruptor sudah muntah lit kelakuan grombolan seakan manusia suci walau koruptor amp kotor tapi dipuja dibutakan pendukungnya
8079,jubir sesuai keahlianya yaitu komunikasi
8080,penjegalan dinilai berakibat fatal semakin terbendung receiver username artinya firaun kontra usher kades pagi cak nun mesi use on
8081,pedas utang pemerintah naik rp janjinya ekonomi meroket ternyata utang yang meroket receiver username artinya firaun kontra usher kades pagi cak nun mesi use on
8082,rais cuma qorun dan haman firaun juga pelihara buzer penjilat yang tugasnya meneror receiver username artinya firaun kontra usher kades pagi cak nun mesi use on
8083,dibandingkan refly waktu mahasiswa sudah menduga akan receiver username artinya firaun kontra usher kades pagi cak nun mesi use on
8084,tka china dinomorsatukan rusuh morowali disinyalir bisa terjadi lagi ada keadilan receiver username artinya firaun kontra usher kades pagi cak nun mesi use on
8085,usai diperiksa kpk hercules kembali bentakbentak wartawan baik saya selesaikan kalian receiver username artinya firaun kontra usher kades pagi cak nun mesi use on
8086,bagaimanapun caranya batal dicalonkan zulfan ada upaya deadlock receiver username artinya firaun kontra usher kades pagi cak nun mesi use on
8087,hmi probolingo ancam turun jalan jika revisi jabatan kades disahkan receiver username artinya firaun kontra usher kades pagi cak nun mesi use on
8088,bandingkan era soekarno rocky gerung kenapa tibatiba bangsa ini rakus receiver username artinya firaun kontra usher kades pagi cak nun mesi use on
8089,sudah kenal lama refly waktu kuliah ketua senat mahasiswa apapa receiver username artinya firaun kontra usher kades pagi cak nun mesi use on
8090,meminta maf kasus ham masa lalu gatot nurmantyo cuma bisa dilakukan abri receiver username artinya firaun kontra usher kades pagi cak nun mesi use on
8091,bawaslu khawatirkan metode dimanipulasi karena pesanan receiver username artinya firaun kontra usher kades pagi cak nun mesi use on
8092,siap diperiksa kpk lagi hercules jangan dipangil ditelepon saja datang receiver username artinya firaun kontra usher kades pagi cak nun mesi use on
8093,kata yaqut soal usulan biaya haji naik rp juta haji bagi yang mampu receiver username artinya firaun kontra usher kades pagi cak nun mesi use on
8094,disebut pernah anak emas elit amerika bisa boneka paman receiver username artinya firaun kontra usher kades pagi cak nun mesi use on
8095,yusuf mansur mengaku ingin gampang tinggal sujud doang receiver username artinya firaun kontra usher kades pagi cak nun mesi use on
8096,hercules kembali ancam wartawan usai diperiksa kpk jangan macamacam saya sikat kalian receiver username artinya firaun kontra usher kades pagi cak nun mesi use on
8097,koalisi memanas perombakan kabinet reshufle hanya isu receiver username artinya firaun kontra usher kades pagi cak nun mesi use on
8098,heran menkeu sebut pendapatan negara naik angota dpr kok miskin malah bertambah username artinya firaun kontra usher kades pagi cak nun mesi use on
8099,sambo dituntut seumur hidup mahfud md dengar ada gerakan meringankan hukuman receiver username artinya firaun kontra usher kades pagi cak nun mesi use on
8100,bela cak nun soal firaun jatim pak tidak bereaksi kok kenapa netizen heboh pansos username artinya firaun kontra usher kades pagi cak nun mesi use on
8101,heboh foto syur bendum hipmi disebar via akun ig pribadinya diduga kena hack receiver username artinya firaun kontra usher kades pagi cak nun mesi use on
8102,keterpilihan meroket lampaui dan yang turun tajam receiver username artinya firaun kontra usher kades pagi cak nun mesi use on
8103,bandar pemodal demo kades besok lusa ada demo lain tuntutan perpanjangan jabatan priode tolak rencana dekrit
8104,tersingkir refly menduga hanya dikuti paslon usai pertemuan palohluhut receiver username artinya firaun kontra usher kades pagi cak nun mesi use on
8105,viral video syur bareng ketua dprd punya tersebar mahasiswi dipenjara pengacara terima receiver username artinya firaun kontra usher kades pagi cak nun mesi use on
8106,viral beredar video hot pamer payudara angota dprd muba dari fpdip ngeles itu dirinya receiver username artinya firaun kontra usher kades pagi cak nun mesi use on
8107,mengurus saja kucluk kritik pedas rizal ramli ke sana main tiktok lagi receiver username artinya firaun kontra usher kades pagi cak nun mesi use on
8108,ngeri kesaksian netizen yang bersebelahan kamarnya di hotel tempat diduga fery irawan lakukan kdrt terhadap vena melinda receiver username artinya firaun kontra usher kades pagi cak nun mesi use on
8109,jamiludin kehadiran rk di golkar terlalu seksi untuk menarik bergabung kib receiver username artinya firaun kontra usher kades pagi cak nun mesi use on
8110,gmni tolak perpanjangan jabatan kades jangan gunakan dagang sapi receiver username artinya firaun kontra usher kades pagi cak nun mesi use on
8111,kepala bin ramal gelap dan penuh ketidakpastian winter is coming receiver username artinya firaun kontra usher kades pagi cak nun mesi use on
8112,ranpur tni lindas pemotor ibu dan anak di area blindspot hinga tewas di purwakarta receiver username artinya firaun kontra usher kades pagi cak nun mesi use on
8113,bentangkan spanduk pinokio di peringatan aksi kamisan jangan bohong receiver username artinya firaun kontra usher kades pagi cak nun mesi use on
8114,makjleb disinyalir nafsu bi episode gelap sri mulyani dibogkar misbakhun receiver username artinya firaun kontra usher kades pagi cak nun mesi use on
8115,asmara semiga dilancarkan ya acaranya
8116,mereka telah bersusah payah mencari celah untuk menahan laju nya baswedanrakyat semakin cinta dan mendambakan alahu akbar
8117,pak
8118,inshalah ganti pak koruptor akan dihukum mati makanya para koruptor mengunakan berbagai macam cara untuk supaya pak tidak karena petugas
8119,sosok mas harapan milenial yang berada di eropa
8120,bertangung jawab atas yang dilakukan apakah ini pemimpin masa depan
8121,terima kasih pak dari jakarta yang tulus
8122,tapi amp jangan lupa di awal pejabat negeri ini yang statement over confidence bahkan terkesan jumawa setelah itu covid ngamuk di amp korban jatuh baik nyawa maupun ekonomi stop keluarkan statement jumawa kali ini
8123,berbahagialah seluruh bandung dan sekitarnya akan berjumpa dengan dalam acara jalan sehat berpikir sehat rezeki sehat berjuang sehat memantapkan dan memenangkan secara sehat pada untuk keadilan sosial amin
8124,harus menangmari kita berikhtiar dan berdoa bpak salam hngat dari ntb
8127,ini alasan relawan solo pencalonan memiliki visimisi yang luar biasa sosok yang sangat visioner pandangan terhadap ke depan baik sangat gamblang bisa difahami kalangan
8128,amin
8129,eh malah yang muncul pemenang untuk tahu cebong buzer menyengir lagi stres kayak kejadian pilgub dki jakarta ahok vs ternyata pemenangnya adalah aniesbaswedanbuzerpcebong ganjaris padatengkurep mengeleparhahaha
8130,relawan simpatisan dan pendukung abw diharapkan untuk berswafoto selfie dengan atribut dan menguploadnya ke akun sosial media masingmasing mengunakan hastag dan setiap kamis
8131,amp pendirian pusat studi asean covid kamis januari ada meningal cak nun eliezer jaksa kades minions fajri depok sleman dilarang tingalin kesambet gengsi kang emil maljum malam jumat
8132,mileanies sulsel luncurkan gerakan kamis manies ini tujuanya relawan mileanies yang abw di sulawesi selatan bergerak mereka kini meluncurkan program baru yakni gerakan
8133,bahaya makjleb disinyalir nafsu bi episode gelap sri mulyani dibogkar misbakhun kesambet firaun kontra kades depok eliezer bonsang yati
8134,babeh aldo firaun itu memakmurkan rakyatnya yang dia siksa tuh asing noh morowali bagaimana kesambet firaun kontra kades depok eliezer bonsang yati
8135,era kayak berharta yang miskin kesambet firaun kontra kades depok eliezer bonsang yati
8136,pengamat jika setuju jabatan kepala desa demokrasi dalam bahaya kesambet firaun kontra kades depok eliezer bonsang yati
8137,bawaslu khawatirkan metode dimanipulasi karena pesanan kesambet firaun kontra kades depok eliezer bonsang yati
8138,nahloh hina islam petarung rusia dibanting lawan kesambet firaun kontra kades depok eliezer bonsang yati
8139,heboh pria semaput dipukuli waria gegara masalah open bo warganet auto bambang kesambet firaun kontra kades depok eliezer bonsang yati
8140,kritik aturanya sendiri pengamat hanya tukang stempel kesambet firaun kontra kades depok eliezer bonsang yati
8141,rais cuma qorun amp haman firaun juga pelihara buzer penjilat yang tugasnya meneror kesambet firaun kontra kades depok eliezer bonsang yati
8142,ubedilah badrun kritik cak nun masuk ke jantung kekuasan ada meningal
8143,penyidikan baru kpk sudah tetapkan tersangka dugan korupsi di kemhan kesambet firaun kontra kades depok eliezer bonsang yati
8144,amp bebas kisah zaim saidi berada di penjara bareskrim mabes polri kesambet firaun kontra kades depok eliezer bonsang yati
8145,serahkan soal reshufle ke saya enggak diajak bicara kesambet firaun kontra kades depok eliezer bonsang yati
8146,heboh link iklan judi slot kembali susupi situs pemerintah kesambet firaun kontra kades depok eliezer bonsang yati
8147,kasus polisi pengabdi mafia uya kuya dan kamarudin simanjuntak dilimpahkan ke polda metro jaya kesambet firaun kontra kades depok eliezer bonsang yati
8148,meminta maf cela firaun sebut cak nun dicibir sombong egois dan arogan kesambet firaun kontra kades depok eliezer bonsang yati
8149,ramai soal firaun zulfan lindan sekarang sudah sintesis megajokowi kesambet firaun kontra kades depok eliezer bonsang yati
8150,refly harun sebut hanya dikuti dua pasangan saja tersingkir kesambet firaun kontra kades depok eliezer bonsang yati
8151,muhaimin tionghoa puluhan dibatasi hak politiknya kini tunjukkan peran strategisnya kesambet firaun kontra kades depok eliezer bonsang yati
8152,video fery irawan sujud meminta ampunan vena melinda publik pantas enggak ada job nangisnya engak menjiwai kesambet firaun kontra kades depok eliezer bonsang yati
8153,santainya cak nun sat merokok depan luhut yang disebutnya sih haman kesambet firaun kontra kades depok eliezer bonsang yati
8154,nahloh mahfud md bongkar adanya pesanan hukuman ferdy sambo di bawah seumur hidup kesambet firaun kontra kades depok eliezer bonsang yati
8155,standar ganda guntur romli serang ceramah cak nun padahal sering mengatai firaun juga kesambet firaun kontra kades depok eliezer bonsang yati
8156,ramai mirip raja firaun rais sebodohbodohnya raja bisa cengkeram kekuasan kesambet firaun kontra kades depok eliezer bonsang yati
8157,pesan surabaya ingatkan ternyata yang dulu bagus kesambet firaun kontra kades depok eliezer bonsang yati
8158,kecewa putri dituntut pengacara keluarga yosua bebaskan saja kesambet firaun kontra kades depok eliezer bonsang yati
8159,rizal ramli pada waktunya akan terbuka sri mulyani hanya beban kesambet firaun kontra kades depok eliezer bonsang yati
8160,ngeri viral video kendaran taktis tni lindas pengendara motor di purwakarta kesambet firaun kontra kades depok eliezer bonsang yati
8161,kalo saya setuju di
8162,ini diangap loyalis hengkang satusatu dari pemprov dki jakarta kesambet firaun kontra kades depok eliezer bonsang yati
8163,nahloh kena imbas tuntutan bharada instagram diserbu hinga reaksi yang ikut tolak kesambet firaun kontra kades depok eliezer bonsang yati
8164,parah tua murid gunting paksa rambut guru gegara enggak terima rambut anaknya dicukur kesambet firaun kontra kades depok eliezer bonsang yati
8165,heboh cak nun sebut dipimpin firaun bernama gus mus mengungkap sosok cak nun yang sebenarnya kesambet firaun kontra kades depok eliezer bonsang yati
8166,viral muncul suara desahan perempuan sat live sepak bola piala fa kesambet firaun kontra kades depok eliezer bonsang yati
8167,giliran guntur romli dirujak benarkah pernah sebut firaun begini faktanya kesambet firaun kontra kades depok eliezer bonsang yati
8168,geger ruang fraksi psi dki digeledah kpk anak buah giring ganesha membantah kesambet firaun kontra kades depok eliezer bonsang yati
8169,fadli zon cak nun hanya manusia merdeka tapi raksasa kesambet firaun kontra kades depok eliezer bonsang yati
8170,hadir di pelantikan rektor itb mahfud md rizal ramli titipkan pesan penting kesambet firaun kontra kades depok eliezer bonsang yati
8171,pengamat politisi tidak jujur revisi lu desa belum masuk prolegnas kesambet firaun kontra kades depok eliezer bonsang yati
8172,ketua kpu dilaporkan ke polda metro jaya hasnaeni sidik jari saya sudah berlaku kesambet firaun kontra kades depok eliezer bonsang yati
8173,ngeri polisi tewas tersambar krl rekanya sat buang air kecil di pingir rel kesambet firaun kontra kades depok eliezer bonsang yati
8174,gereja ingris larang pernikahan sejenis kesambet firaun kontra kades depok eliezer bonsang yati
8175,mixue ditegur lpom mui gegara diduga logo halal kesambet firaun kontra kades depok eliezer bonsang yati
8176,viral bocah jenius dari daerah tertingal di nanti juara kompetisi matematika dunia kesambet firaun kontra kades depok eliezer bonsang yati
8177,terungkap jejak beredarnya b motor bodong yang diduga hilang di polres sika kesambet firaun kontra kades depok eliezer bonsang yati
8178,fenomena ngemis online di tiktok bikin resah mensos risma keluarkan surat edaran kesambet firaun kontra kades depok eliezer bonsang yati
8179,sebelum viral cak nun sebut firaun ternyata kerap dituding firaun oleh pembencinya kesambet firaun kontra kades depok eliezer bonsang yati
8180,polisi tewas tertabrak krl comuter line di bogor angota brimob kesambet firaun kontra kades depok eliezer bonsang yati
8181,tiba di kpk hercules ancam hajar wartawan kesambet firaun kontra kades depok eliezer bonsang yati
8182,fod estate diangap bermasalah dan akan diselidiki pansus tapi meminta dilanjutkan kesambet firaun kontra kades depok eliezer bonsang yati
8183,permintan maf cak nun tidak menghilangkan substansi kritiknya kesambet firaun kontra kades depok eliezer bonsang yati
8184,terkuak uang suap pmb unila mengalir ke muktamar nu dan pdnu kesambet firaun kontra kades depok eliezer bonsang yati
8185,punya masa lalu begini bikin surya paloh takut dijauhi sampai rela ketemu kawan lama luhut kesambet firaun kontra kades depok eliezer bonsang yati
8186,cak nun sebut seperti firaun bikin publik pecah suara ada engak sih firaun yang baik kesambet firaun kontra kades depok eliezer bonsang yati
8187,bentrokan di morowali buktikan pemerintah lemah hadapi investor kesambet firaun kontra kades depok eliezer bonsang yati
8188,ivan gunawan meminta bunda corla balikin uang saweran rp juta nikita mirzani gue tungu pengembalian uang itu kesambet firaun kontra kades depok eliezer bonsang yati
8189,ceramah cak nun sebut firaun tuai kontroversi memang sih dia kesambet firaun kontra kades depok eliezer bonsang yati
8190,satu loyalis mundur dari komisaris ancol jakarta ini penyebabnya kesambet firaun kontra kades depok eliezer bonsang yati
8191,diserang kucing hitam hinga patah kaki kamarudin simanjuntak beberkan serangan gaib selama membela kasus brigadir kesambet firaun kontra kades depok eliezer bonsang yati
8192,percintan polisi rilis motif pembunuhan angela hindriati soal menguasai harta korban kesambet firaun kontra kades depok eliezer bonsang yati
8193,gempa magnitudo guncang pacitan timur malam kesambet firaun kontra kades depok eliezer bonsang yati
8194,suami siri hasnaeni disebut mencatut laporan ke polisi kondisi kejiwan wanita emas stabil kesambet firaun kontra kades depok eliezer bonsang yati
8195,kata beny kisworo rekam jejak cerminkan nilainilai islam kesambet firaun kontra kades depok eliezer bonsang yati
8196,asmara pak memang betul pantas dan ada bandingnya untuk aniesforpresidenri
8197,manipulasi diduga telah dilakukan internal kpu haidar nafis saya mendapatkan cerita serupa kesambet firaun kontra kades depok eliezer bonsang yati
8198,gabung golkar pengamat strategis dan saling menguntungkan kesambet firaun kontra kades depok eliezer bonsang yati
8199,banda aceh kia ombudsman dan komnas ham becus bekerja kesambet firaun kontra kades depok eliezer bonsang yati
8200,bps dki catat penduduk miskin jakarta turun persen kesambet firaun kontra kades depok eliezer bonsang yati
8201,tuntutan jaksa ke bharada jangal dan tidak logis kesambet firaun kontra kades depok eliezer bonsang yati
8202,anak hasnaeni moein temui ketua kpu klarifikasi isu dugan pelecehan kesambet firaun kontra kades depok eliezer bonsang yati
8203,serikat pekerja morowali beberkan kronologi bentrok di pt begini mereka yang menyerang duluan kesambet firaun kontra kades depok eliezer bonsang yati
8204,kritisi aturanya sendiri bukti tidak mengetahui yang ditandatanganinya kesambet firaun kontra kades depok eliezer bonsang yati
8205,sh akan difitnah dan dihancurkan oleh cebong karena mereka takut oligarki akan berakhir dan koruptor akan dipenjarakan oleh
8206,selamat kang emil yang banga dengan folowers nya yang saya barat
8207,saja hehehehe sejak jaman duluelo enggak pernah menang catat perlu narasi ini itu takdir kita buktikan perlu repot menjatuhkan blio jatuh sendiri
8208,anda keliru para buzer rp diamdiam dikeheningan malam dengan khusyuk berdoa agar di maka job mereka untuk menghina memojokan memfitnah akan amp rezeki mereka akan mengalir deras
8209,alumni ugm pencapresan mirip barack obama maka jika obama as ke akan di
8210,diketahui lembaga lsj merilis data yang menyebutkan bahwa jika hanya dikuti tiga dan
8212,banjir di new york pun salah pak abies karena dia diangap dunia kali ya pak shg ind bisa adil makmur
8213,pemimpin cerdas selamatkan
8214,yoi bray berikutnya harus dan ahok doble
8215,bismilahi tawakaltu walahaula walakuata semiga alah senantiasa cak nun melawan rezim zalim ini takbir
8216,yang bilang pak ya inshaloh bila memberi amanah baru yang jelas asal usulnya jelas asli ijazahnya jelas track record kinerjanya dan itu diakui dunia
8217,menjawab deadlock cawapres koalisi siapapun cawapresnya mas relawan akan di posisi relawan yang bekerja menaikan elektabilitas dan popularitas
8218,berani nya bandingkan wak kak kak kak kak gilelu ndro yang satu pecatan menteri amp gabener sementara yang lainya walikotax amp presidensi kalo alah swt mengizinkan lagi wkwkwkwk
8219,luar biasa pak
8220,kau urus ini juga enggak fuck cuma obok obok karena sudah clear takut dapurmu enggak ngebul ya nanti
8222,rugi kalo golput harus tapi di
8223,pastikan akan aktifkan kembali fpi dan hti jika dipilih di
8224,dengan ramainya firaun sat ini maka kita bisa ambil kesimpulan bahwa pak tidak pernah melapor penghinan dirinya kalo kita memakai standart tidak salah kita dorong kom
8225,hobis video perzinahan dan
8226,nahloh medsos kejaksan digeruduk netizen bunuh ayam bunuh nyawa manusia cuma dari ayam pagi gen firaun dalam mimpi rafi richard eliezer kesambet sambo
8227,heboh foto syur bendum hipmi disebar via akun ig pribadinya diduga kena hack morning gen firaun dalam mimpi rafi richard eliezer kesambet sambo jasuke playstore
8228,dugan korupsi beras bansos oleh terbukti perumda pasar jaya beberkan sumber beras yang menumpuk morning gen firaun dalam mimpi rafi richard eliezer kesambet sambo jasuke
8229,ngotot fpi dilarang jika selamat marif jangan cuma cari muka morning gen firaun dalam mimpi rafi richard eliezer kesambet sambo jasuke
8230,bps dki catat penduduk miskin jakarta turun persen morning gen firaun dalam mimpi rafi richard eliezer kesambet sambo jasuke playstore
8231,viral seorang ibu sebut rumah tiko aura negatif hinga meraung warganet aura kasih ada enggak bu morning gen firaun dalam mimpi rafi richard eliezer kesambet sambo jasuke
8232,guntur romli pernah sebut firaun andi sinulinga simpatisanya santai saja borobro lapor polisi morning gen firaun dalam mimpi rafi richard eliezer kesambet sambo jasuke
8233,edan nikita mirzani siap dibakar jika bohong soal bunda corla tungak pajak rp miliar morning gen firaun dalam mimpi rafi richard eliezer kesambet sambo jasuke playstore
8234,jawab seruan luhut lawan ot kpk ya jauhi korupsi itu saja morning gen firaun dalam mimpi rafi richard eliezer kesambet sambo jasuke playstore
8235,disamakan seperti penasihat firaun luhut binsar titip salam ke cak nun ini katanya morning gen firaun dalam mimpi rafi richard eliezer kesambet sambo jasuke playstore
8236,tersingkir refly menduga hanya dikuti paslon usai pertemuan palohluhut morning gen firaun dalam mimpi rafi richard eliezer kesambet sambo jasuke playstore
8237,viral beredar video hot pamer payudara angota dprd muba dari fpdip ngeles itu dirinya morning gen firaun dalam mimpi rafi richard eliezer kesambet sambo jasuke playstore
8238,cak nun hina layaknya firaun gibran skakmat dana haters sudah cair morning gen firaun dalam mimpi rafi richard eliezer kesambet sambo jasuke playstore
8239,soal informasi intelijen jangan sudah kejadian saya baru diberi tahu morning gen firaun dalam mimpi rafi richard eliezer kesambet sambo jasuke playstore
8240,data bps jumlah miskin naik jatim dan morning gen firaun dalam mimpi rafi richard eliezer kesambet sambo jasuke playstore
8241,berkaca pada refly harun bocorkan syarat bisa morning gen firaun dalam mimpi rafi richard eliezer kesambet sambo jasuke playstore
8242,sebut pernah berjuang untuk demokrasi rizal ramli begitu berkuasa dia preteli morning gen firaun dalam mimpi rafi richard eliezer kesambet sambo jasuke playstore
8243,mundur dari komisaris ancol geisz chalifah sampaikan kekhawatiranya pada heru budi morning gen firaun dalam mimpi rafi richard eliezer kesambet sambo jasuke playstore
8244,tertawakan klaim fery irawan athala mama sampai meminta tolong ke beri dia pekerjan morning gen firaun dalam mimpi rafi richard eliezer kesambet sambo jasuke playstore
8245,bikin gaduh satu negara bharada dituntut penjara dalam kasus brigadir adilkah morning gen firaun dalam mimpi rafi richard eliezer kesambet sambo jasuke playstore
8246,jenazah tka yang tewas dalam kerusuhan pt begini diserahkan ke kedubes china morning gen firaun dalam mimpi rafi richard eliezer kesambet sambo jasuke playstore
8247,firaun jahat kenali gelar dan namanama tokohnya yang terkenal morning gen firaun dalam mimpi rafi richard eliezer kesambet sambo jasuke playstore
8248,fahri hamzah mata ke refly heran darimana kursinya ya morning gen firaun dalam mimpi rafi richard eliezer kesambet sambo jasuke playstore
8249,kader golkar airlanga langsung beri jabatan waketum morning gen firaun dalam mimpi rafi richard eliezer kesambet sambo jasuke playstore
8250,tersangka kerusuhan pt begini ditahan polisi mereka terancam hukuman penjara morning gen firaun dalam mimpi rafi richard eliezer kesambet sambo jasuke playstore
8251,dokter tifa sebagai darah soekarno harus cawapres bagi atau morning gen firaun dalam mimpi rafi richard eliezer kesambet sambo jasuke playstore
8252,akibat sakit hati wna asal china dibunuh secara sadis pakai ekskavator begini kronologinya morning gen firaun dalam mimpi rafi richard eliezer kesambet sambo jasuke playstore
8253,viral video pkl banjiri kota tua satpol p singung morning gen firaun dalam mimpi rafi richard eliezer kesambet sambo jasuke playstore
8254,cak nun meminta maf setelah bilang firaun warganet alhamdulilah menyadari morning gen firaun dalam mimpi rafi richard eliezer kesambet sambo jasuke playstore
8255,mencuri di rumah angota tni dua pelaku babak belur bagaimana dengan maling uang morning gen firaun dalam mimpi rafi richard eliezer kesambet sambo jasuke playstore
8256,beda dengan sambo putri candrawathi cuma dituntut penjara adilkah morning gen firaun dalam mimpi rafi richard eliezer kesambet sambo jasuke playstore
8257,hina di sosmed gibran mengaku kasihan sat tahu karyawan unibi ini langsung kehilangan pekerjan morning gen firaun dalam mimpi rafi richard eliezer kesambet sambo jasuke
8258,sidang keluarga cak nun dihajar sabrang emha ainun nadjib disebut goblok dan sesat usai kata firaun morning gen firaun dalam mimpi rafi richard eliezer kesambet sambo jasuke
8259,wow nyayur ternyata segini harta kekayan taufik angota dprd dki yang digeledah kpk morning gen firaun dalam mimpi rafi richard eliezer kesambet sambo jasuke playstore
8260,sebut firaun cak nun dipenjara karena menghina morning gen firaun dalam mimpi rafi richard eliezer kesambet sambo jasuke playstore
8261,arief poyuono proyek lumbung pangan ngapusi morning gen firaun dalam mimpi rafi richard eliezer kesambet sambo jasuke playstore
8262,ngeri wna china tewas dibunuh pekerja tambang di sulawesi ditindih pakai ekskavator morning gen firaun dalam mimpi rafi richard eliezer kesambet sambo jasuke playstore
8263,astaga sule ajak main judi slot ini situsnya morning gen firaun dalam mimpi rafi richard eliezer kesambet sambo jasuke playstore
8264,sudah ada tersangka kpk pangil ketua dprd dki prasetyo edi dan mohamad taufik morning gen firaun dalam mimpi rafi richard eliezer kesambet sambo jasuke playstore
8265,penghinan dan ujaran kebencian ini satusatunya pasal yang bisa menjerat cak nun morning gen firaun dalam mimpi rafi richard eliezer kesambet sambo jasuke playstore
8266,luhut lawan ot sahroni salahnya publik lihat maling ketangkap morning gen firaun dalam mimpi rafi richard eliezer kesambet sambo jasuke playstore
8267,ubedilah badrun kritik cak nun masuk ke jantung kekuasan morning gen firaun dalam mimpi rafi richard eliezer kesambet sambo jasuke playstore
8268,psi caplok janganjangan ada kepentingan oligarki di belakangnya morning gen firaun dalam mimpi rafi richard eliezer kesambet sambo jasuke playstore
8269,pelajar hamil di luar nikah di ponorogo dpr daerah lain morning gen firaun dalam mimpi rafi richard eliezer kesambet sambo jasuke playstore
8270,tercaduk asn dan thl disuruh purapura pembeli sat kunjungi pasar airmadidi sulut morning gen firaun dalam mimpi rafi richard eliezer kesambet sambo jasuke playstore
