,clean_manual
5842,bersihkan polri dari oknum jahat pelindu ng rezimbuzer rptka rc nagaoligarki pkc rcdikendalikan dibawah medagriusut korupsi rezim ini said didu tegaskan ada agenda yang harus dilakukan jika
5843,intinya ingin lu sampaikan karena yang enggak becus dan enggak dahkl diliatseburuk apapn namanya pendukung dan bagi yang suka enggak suka tanpa ada keluhan jis ini bagi yang netral jis pnentu pilihan
5844,pusat tidak selesai ini juga bisa menembak tapi sayang saksi yang yau itu memang rekayasa untuk serang
5845,betul terlarangnya menurut rezim ini yang paham islam mah tahu yang dilakukan fpi itu untuk melakukan perintah alah menjalankan amar maruf dan nahi mungkar ini saya alah pak tahu mana yang boleh dan mana yang tidak
5846,tenang pasti akan ke jayalah selalu
5847,yang kemarin grace bilang kalo pak akan demo berjilid jilid enggak bisa masuk ujaran hasutan danatau mengajak kepada perbuatan jahat ya walopun belum sat ini kejadianya
5848,di saya pribadi meminta kepada untuk seperti ini dan para buzer di tangkap dan dihukum
5849,enggak serius nih kayak dong serius memenuhi keinginan relawanya untuk bersedia kandidat nanti
5850,samosir akbar alah swt mengangkat derajat bang republik dan seterusnya agar keadilan dan kesejahteran dinikmati oleh seluruh amin ya rabal alamin
5851,abaikan ocehan mereka yang jelas takut di lengserkan dan borok nya terbongkar hanya kekuasan yang berusaha menjegal
5852,samosir alhamdulilah rabal alamin alah swt ridho mengangkat derajat bang republik dan seterusnya agar keadilan dan kesejahteran dinikmati oleh seluruh amin ya rabal alamin
5853,yang panik dan sangat takut hanya buzerp murahanyg kerjanya hanya fitnah nebar kebencian dan mengadu domba
5854,gurem saja sok perintah insya kalo psi nyungsep dari
5855,mas ada salam anak anak milenium di kabupaten kebumen dp dan dpw aliansi nasional sejahtera hadiri acara dpd kabupaten kebumen mancing mania sejahtera
5857,ini kecamatan di kebumen menyatakan sikap deklarasi pelantikan pengukuhan pengurus aliansi nasional sejahtera kabupaten kebumen kecamatan gombong sempor karang anyar karang bayam sejahtera
5858,kata korban pengusuran kampung akuarium pemimpin adil yang sebenarbenarnya itu bernama sangat pantas yang setuju silakan rampl
5859,tenang setelah akses akan dibuat
5860,akan informasi
5863,mas seandainya itu vs bagi saya pun yang saya bersyukur karena nya dulu saya
5864,waras pasti ingin mencetak sejarah bahwa lahir dari tubuh makanya begitu cepat dan sigap mendeklarasikan yang diangap begitu potensial untuk
5865,hahaha cukup sampai dp jangan dpo hahahahahahahaha
5866,ini wis edan
5867,dumdum bismilah semkin di fitnah dan di hujat pahala pak baswedanmakin mantap
5868,back janji sudah ditunaikan tidak mencalonkan justrus yang ya lah masa perjanjian sampai menang nanti lagiadh boleh wo sah tua umat juga sudah kapok enggak lagi yuk
5869,persis ketika pilkada jakarta tahu jika jakarta akan di suriahkan tapi kenyatanya jakarta kota kelas dunia sesumbar serupa juga muncul ketika nyapres jika akan ada demo besaran enggak sekalian perang dunia ke pecah
5871,amin saya doakan agar koalisi yang terbentuk mampu mewujudkan urutan ke meskipun masih jauh sekali dari jadwal kpu yang sudah ditetapkan
5872,mah kecilnanti patungan bayarnya selesai lo ketika pak
5873,dp nol juga kerjanya
5875,koalisi ini berjalan dengan lancar dan enggak ada ganguan apapun dan wakil
5876,golkar harus pikirkan perekambangan bangsa ini kelompok sendiri monitoring dan audit program sat ini audit tentukan sikap
5877,jakarta saksi kemampuan untuk memimpin negeri ini bahwa tidak ada diskriminasi selama memimpin jakarta golongan ras dan agama dirangkul bersatu surya tjandra eks wamen dan pentolan psi yang kini siap
5878,sajak alhamdulilh saya lumayan pintar kalo ada twiter begini senyumi saja insyalh
5879,bertekad untuk sukseskan sebagai
5880,wong ngapak ayo pada pak semangat lur
5881,periode saja jangan
5882,ke takbir
5884,bro
5885,biarkan saja mereka sampai enggak nafas pun mending naikin bro
5886,jangan mimpi pak pak mampu menyaingi pak misal bagibagi sembako dulu du endorse pula pak rambut putih wajah berkerut mimpi
5887,mah cemen ketika menginginkan dan kacung
5888,asmara saja didu saewad idha sir
5889,insyaloh
5890,asmara insyah alah
5891,dumdum itulah hebatnya sudah enggak pantas lagi gubernurharus
5892,ini keren bang mari berjuang membantu pak
5893,kita lihat ye apakah dan pendukungnya akan rela sat jejak digital itu pahit bro
5894,ia the best cerdaspantas pimpin setelah sukses pimpin jakarta menginginkanya
5895,pak moga semakin kuat
5896,asmara berikan suaramu kepada partaipartai pengusung bpk
5897,diaplikasikan ke seluruh pak swt merestui
5898,adi prayitno pksdemokrat untuk provokasi poros lain umumkan jagoanya covid sabtu februari ada meningal bakri leoniel nduk sultan dewa malming malam mingu
5899,surabaya pakai strategi playing victim menang pakai strategi identitas jual ayat mayat menang lalu sekarang kombinasikan keduanya sekaligus dan berharap bisa menang
5900,ganteng sudah menempati janjinya untuk tidak untuk periode masa jabatan sudah selesai sebagai negara berhak kok periode dan itu dilindungi lu
5901,milan kalo enggak yakin dengan poling ilc buatlah poling sendiri supaya anda yakin yang benar inginkan tapi kalo masih yang polingnya tingi jangan sampai jantung anda berhenti berdetak
5902,ya sudah silakan kalian berbahagia atas tinginya kami akan berjuang karena koalisi pendukung sudah terbentuk dan bergerak agar pak
5903,rais jangan kasih kendor gaspol periode saja jangan
5904,asmara apapun sukuagamaras dan partainyanies pilihan nex
5905,said didu tegaskan ada agenda yang harus dilakukan jika
5906,samosir alhamdulilah rabal alamin alah swt mengangkat derajat bang republik dan seterusnya amin ya rabal alamin
5907,kalo itu sih fitnah sygku itu adalah fakta sygku kalo adek yang deklarasikan periode lagi pak deh ya senang lah sygku cume kita yang sedih amp menderita sygku yang bikin kita senang pak lah nye sygku nkri bisa baik amp bermartabat betul betul sygku
5908,alah swt mengangkat derajat bang republik dan seterusnya amin ya rabal alamin
5909,berenti mengikuti karena
5910,ufc ufc jeka saragih
5911,ntb akan siap memenangkan
5912,golkar jaya lagi
5913,marilah kita doakan alah swt menjadikan bp rashid amin ya rabal alamin
5916,cakep nenk sekarang wis wayahe melu kabehanies
5917,kita berdoa dan perjuangkan bpk dan mas tahu nya amin wow di sini ada video yang sangat menarik
5918,pak dan karena saya merasa yang kompeten dan kelak sukses selalu
5919,siap pak ke
5920,pak karena saya merasa yang kompeten dan kelak sehat selalu pak
5921,akan stadion yang akan di bangun jika amin
5922,tahu amin ya robalalamin
5923,pak memang mantap untuk
5924,wah nat kau kenapa hebat yang mencintainya mata kau masih bisa melihat dengan terangkan lihatlah sambutan kepada dimana kau kuat lihat knyatan itukh grace siapkan dirimu insyalah
5926,dgnputra fahnor pak bagus pak bagus mas bagus diantaranya
5927,aku untuk dan umat pilihan nya
5928,alhamdulilah ada klarifikasi sudah jelas ya pak enggak ingkar janji yang di tuduhkan oleh yang iri hati pak baswedantetap semangat pak kami selalu mu amin
5929,amin saya doakan agar koalisi yang terbentuk bisa menghantarkan ke doa ini dijabah oleh alah swt dan jangan lupa agar koalisi berikhtiar maksimal
5930,doanya ya bong supaya pak periode
5931,insyalah jika tidak ada kecurangan dari rezim amp para perangkatnya
5932,asmara sudah waktunya berubahin saya alah pak
5933,au ah elap timbul tengelam sambil gebrak mejax saya kini satnya pindah untuk
5934,lah antum jangan menjelekkan ysmua tahu dia becus krjapnter mengomong doangbpk identitaskrng mending kita doakan supaya belio ke itu yang pentingtau enggak dasar kodok ijo
5935,coba cek ini deh twibonize melalui link terima kasih
5936,mari bersatu lawan oligarki
5937,kamu sukanya menakutin berhatihati pada sesuatu yang wajar sih hebatnya
5938,sunguh suatu prediksi yang sangat keliruklo seandainya ditahun nanti ada yang demopertanyanya yang didemokan dan masalahnya kok ada demo berjilid jilid bukankah pilihan
5939,dibanding seluruh umat manusia loh dan ada diangap seperti ra sementara menumpuk hutang janji menumpuk hutang negara salam esemka dan salam triliun
5940,lupakan yang lain
5941,laksana masa sih kayaknya engak deh buktinya pasukan bajer ketengan jam ngamuk maki fitnah hoax dulu kalo yakin terjungkal ya diam saja lah justru cebong yakin pak di makanya kerja keras
5942,
5943,amin saya doakan agar koalisi perubahan mengantarkan ke
5944,alhamdulilah ini telah di resmikan rumah sekretariat aliansi nasional sejahtera kabupaten kebumen oleh ketua kordinator presidium sir insya alah rumah konsolidasi kolaborasi relawan
5945,alhamdulilah pelaksanan deklarasi relawan pemimpin wilayah papua berjalan lancar dan sukses barakalah para relawaninsya alah amin
5946,jangan keras kali bang mengkritik wowok biarkan saja wong sudah tengelam gituwajar kalo buzerpnya pada panik blingsatan gituinsya alah
5947,didu itu artinya bahwa dia yakin
5948,milenial kebumen bersatu berjuang menang majulah majulah menang sejahtera sejahtera
5950,saya dulu sekarang pindah teman relawan yang dulu pindah ke di daerah saya insyaloh dan hanya akan memperpanjang rekor abadi saja
5951,enggak usah ribut ilc hapy toh cuman pengulangan amp dipenuhi dagelan amp badut
5953,persatuan pak nkri periode salam sa setia sampai akhir
5954,men nanti tungu ke
5955,termasuk buzerp recehan dan murahan semakin panik dan ketakutan
5956,tv generasi muda ide briliant tapi kadang tidak sejalan dengan rezim penguasa nungu rezim penguasa yang mampu menyalurkan ide briliant generasi muda salah satu nya bang
5957,ruhut kacau kau pak di
5958,alhamdulilahbarakalahufiqum jazakumulah khairan katsiransmg alah swt mudahkan sgl urusan pak amin yarobal alamin
5959,waras hanya kaos yang bicarantar kalo saya pendukung nyakita tungu ditungu yang lainayo kompetisi yang sehat adu argumentasi jangan adu domba kritik sampai habis pendukung tumbuh seperti rumput
5960,perbaikan amp perubahangt
5961,apakah psi mulai yakin kalo pak akan
5962,dki kami akan menangkan
5964,secara langsung psi sudah akui
5965,hebat bro
5966,masih enggak bisa terima kenyatan saja lo siap kejang lo
5967,ke
5968,gue sih percaya cebong punah
5969,sudah kalah ya kalah jangan alasan enggak ahok itu menang belajar terima kenyatan ye bong
5970,fix pak sudah enggak ada lawan
5971,waras ini pendukungnya pinokio blon sih petugas parte dungu planga plongo pada stres lihat antusiasme menyambut bebas dari cengkraman bodoh
5972,pertama figur yang diangap sebagai antitesa kedua yang diusung belum menentukan yang akan mendampinginya mengarungi kontestasi nanti jamur sangup
5975,sedang membangun koalisi dengan dan untuk mengusung sebagai di
5976,tidak ada lagi buzer kebal hukum we newsworthy
5977,insya alah amin
5978,jangan begitu mas kita masih butuh kecebong mainan mampus mereka
5979,yang jelas
5980,hanya bag untuk menjatuhkan yang tiba maka cara itu yang sekarang dipakai untuk menjatuhkan atau siapapun yang berpotensi kuat memimpin di
5981,sir memilih pak untuk amin
5982,kalo dan parpol pengusungnya sudah jelas serius memenuhi keinginan relawan untuk serius kandidat nanti nul bagaimana nul serius enggak sih enggak kasihan ganjaris enggak bisa nyapres nul kalo cuma didukung
5983,koalisi bersatu kib yang terdiri dari golkar kapan dan golkar akan bergabung dengan koalisi perubahan yang mengusung sebagai
5984,kalo ada pr purnatni polri yang duk panies siap akan awasi tps dijaga berarti ada tanda dugan curang oke kalo para purna tni polri yang duk panies lakukan hal harus yang oke mungkin harapan para purna kalo kesejahteran diperhatiken
5985,grace sudah mulai kelihatan takut kehilangan pangung nya serta pasrah pak mjdi maka berasumsi pak bisa di demo besaranini pernyatan menuai kebencian amp provokatif begini lah respon politisi instan
5986,atau asal jangan saja
5987,alhamdulilah selalu terdepan saya percaya poling ini daripada abalnya atau insyalah
5988,waras makanya perlu perbaikan dan perubahan
5989,ane semangat bro
5990,cuma yang pandas mantap
5991,gorengan mu basi bonganies kecebong penganguran dan gelandangan
5992,mana buzurp nih bro
5993,tokoh nasional berpikir amp berjiwa dan seluruh ketua memikirkan akan masa depan negeri ini sebaiknya tidak perlu ada yang hanya menghamburkan uang saja sdgkan hutang semakin melambungsebaiknya secara aklamasi kita angkat saja sebagai
5994,wasekjen hermawi taslim mengatakan tiga dalam koalisi perubahan yakni dan sudah siap mendaftarkan sebagai di ke kpu
5995,di depan sekber koalisi perubahan rocky gerung jangan terlalu menang nanti ada yang bawa perasaan covid jumat februari ada meningal sore kris qris hoax sangup david beckham roney ryan gigs
5997,djoe yang penting yang lain terserah
5998,ya alah ya rahman ya rahim ku mohon kepadamu di jumat ini jadikanlah mas rasbid amin ya rabal alamin
5999,menuju perubahan dan perbaikan untuk yang baik
6001,ini gambaran ketika hukum tidak berjalan dengan baik yang terjadi pengadilan jalanan tidak ada lagi ceritanya buzer kebal hukum yang setuju retwet
6003,idha komen cebong pasti bawa yaman atau kadrun insyalah periode
6004,dewan pimpinan daerah dpd keadilan sejahtera kota bogor launching posko pemenangan di kelurahan untuk memenangkan pada kamis februari
6005,setingan yang original cuma penyambutan ke
6006,ya yang penting
6007,menyambangi kantor dp menteng jakarta pusat kedatangan disambut langsung ketua agus harimurti yudhoyono
6008,horehore
6009,horehore anoes jagoan lo mana
6012,grey horehore
6013,mana mu ane
6014,grey amies horehore presuden
6015,para buzerp panas nih bro
6016,andrisugiarto horehore
6017,burhanudin lonte rezim kelojotan gorenganya pas tiket melebihi tapi sayang gorengan lonte rezim itu akan sia sia karena pak akan segera
6018,horehore
6019,hore hore
6020,ane mana mu sudah tiket elum
6021,amin yang ke nanti
6023,fahnor ariteus bagi pendukung silakan mampir lapak pendukung ketawa ayomau diskusi mari hal yang pastiprabowo itu nanti kita kok diskusi beratringanmarikopiudut dan gorengan biar yang atur
6024,hargai mereka yang membenci karena mereka juga seorang pengemar yang telah habiskan waktunya hanya untuk melihat amp mancari setiap kesalahan mereka juga perlu makan anakisterinya insyalah
6025,pemimpin yang dinantikan dirindukan di joglo mas setiap awal bulan subuh wekasan baldatun thayibatun wa rabun ghafur insyalah negeri ini mendapatkan berkah alah swt wes wayahe akhlakul karimah
6026,ridho nenang
6027,pak memang nanti
6028,amin saya doakan agar koalisi yang terbentuk menjadikan ke
6029,lanjutkan makian kau ruhut semakin kau caci semakin melambung energi rkyt pendukungnya mengebu untuk memastikan waras pasti mendukungnya lulusan dalam dan luar negeri ijazahnya pasti asli mantan rektor intelektual cerdas ber integritas
6030,amin selalu sehat dan panjang umur supaya bisa serah terima jabatan dengan
6031,yang membuat saya sangat maka pak untuk di pak untuk yang baik
6032,insya
6033,waras nihtak kenalkan pak dari nasdemdemokrat dan dan sudah memenuhi keren lah kamunya masih angkat isue basingak laku masayo bangun jangan dikamar saja
6034,terimakasih tidak mendung fud malah pada pindah haluan kebijakanya pro dengan
6035,saya selalu dan pak agar bisa di
6036,ketua golkar airlanga hartarto buka suara kabar duet dengan di via detikbali
6037,research and consulting smrc memprediksi dan memiliki peluang dalam cil
6038,lah dongok lagi cebiloe mengomong anak hihi cebi dongok anak tapi bacapres track record akademis dan pengalaman memimpin ada contoh mantan rektor dan ketua etik kpk paham sampai sini cebs
6039,percuma bong bro
6040,langkah menuju terang benderang rocky gerung sengol begini katanya
6041,nah ini pernyatan yang benar barakalah pak
6042,samosir di manuver kemanapun sudah ketetapan kuat tergoyahkan tampil prima yang namanya suara hati nurani murni maka bersyukurlah kita fokus sampai pada waktunya semangat
6043,sudah capek kita terpecah belah karena redzm ini yang memecah belah sesama anak bangsamerusak sistem tatanegara kitaundang undang kitakonstitusi kitastop kadrun cebongmove on menuju perubahan dan baruanies
6044,yang sih yang kelojotan ada waktunya nanti ente bareng kita kritisi kebijakan bro karena pemerintah itu butuh kaca spion agar tidak nabrak jangan kaya lu malah kaca spion di gadaikan
6045,dan mencalonkan sebagai koalisi perubahan moch muaz ar rifqy aktifis mahasiswa prabumulih
6046,masih bagus cuma muntah jika buzerp kelojotan diatas aspal nih dengan ini nih
6047,insha alah semuanya dilancarkan olh alah swt sampai memangil amin
6049,alah memberikan kelancaran dan kemudahan bagi pak untuk pasa
6050,setuju
6051,koalisi perubahan semakin solid menangkan
6052,dan alhamdulilah pak tuntaskan kriteria itu dan yang faham dan memilih pak di nanti untuk presidenamin
6053,grace natalie mimpi hti dan fpi supaya bisa bangkit lagi kabar id brimob golkar psi
6054,the real president pada
6055,alhamdulilah pada akhirnya dan mencalonkan sebagai hj nurlisna angota dprd kota prabumulih prabumulih
6056,reshufle hanya karena soal pilihan sebagai namanya bunuh diri masih ingat surabaya yang dipecat malah tahu
6057,duh berasa pikiran gegara lihat hard gumay di yutupnya deny sumargo bilang tg ciri indonesi takut banget sih
6060,pilihankuanies
6061,perempuan bangsat yang enggak tau malulaksana pelacur murahan yang selalu berhalusinasianies
6062,narasi dengan foto enggak narasi yang disampaikan berjudul seruan ketua kahmi ke kader di yakusa tayang pada november
6063,tikadrun ya alah ya rahman ya rahim ku mohon kepadamu di jumat ini jadikanlah mas rasbid amin ya rabal alamin
6064,jika ada empat paslon bertarung dan diprediksi head tapi head di putaran kedua jika berlangsung dua putaran maka dua yang diperkirakan melengang adalah dan
6065,ini bukti keseriusan dan parpol pendukungnya memenuhi tuntutan relawan untuk kandidat bagaimana enggak kasihan ganjaris kok enggak ada parpol yang merespon aspirasi ganjaris mosok yang diusung
6066,mereka sih hapy bro tapi anehnye buzerp amp haters sekarat kejangkejang bro restorasi koalisi perubahan menghadirkan keadialan sosial untuk kesejahteran bro makan saja minumnya manis cawapres nye boleh saja yang penting nye pak bro
6067,insya alah bpk kita amin
6068,pertama saya pendukung baik di dki maupun nanti kedua pak sendiri yang bilang jangan ada lagi cebongkampretkadrun tapi kalian tidak ikuti imbauan pak sekali berbanding terbalik dengan keinginan pak
6069,sudah waktunya berubah ini saya alah
6070,berarti berubah negara demokrasi yang baik berkemajuan dan berkeadilan mongo yang setuju rampl
6071,kebijakan ktum untuk beti mandat bacapres tentukan pasangan nya yang dan satu pemahaman nanti nya dalam menjalan roda pemerintahan dan mengutamakan kepentingan nya dengan sesuai perubahan dan perbaikan harapan satu
6072,keren yang diusung parpol vs yang diusung
6073,ir gagah dan cerdas mudah dan berkualitas republik tahu sampai berjuang demi nya koalisi parpol kekuatan tiga parpol yang sangat pemimpin perubahan dan perbaikan harapan
6074,yth pengurus datang menghadiri acara yang menghadirkan bpkanies sebagai hanya karena rindu akan sosok pemimpin yang kredibel mencintai dan ingin ada perubahan yang baik dari rezim sekarang tidak perlu dor prize
6075,insya alah di
6076,memang kenapa ane
6077,sejumlah elite dan nasdemkerap melontarkan kata solid sat berbicara kepada sebagai di
6078,syadat snyumin saja bang insya alah
6079,buzerp panik dan ketakutan buzerp recehan dilelangdiobral murah
6080,uang ada nih oh ternyata cuan ya
6081,dumdum punya masa lalu insya alah bpk kita
6082,bantelah situ yang penting kami ribu janji boleh dikesampingkan demi berdaulat sejahtera religius dan makmur dan itu hanya bisa ketika ribu di bowo tlh mengecewakan dan pimpinan du ngu
6083,semangat demokratsp selamat bmi ke tahu bintang muda kompak sl dan berbagi dengan yang lain nya kita raih kemenangan sapa nya dpc dan dpac pada kec cisoka kab tangerang banten siap mensukseskan dan memenangkan satu
6085,pada akhirnya akan
6086,terima kasih kepada kaum cebonger yang setiap sat meningkatkan popularitas yakin
6087,sohibuliman tap semangat perjuangan sapa ingin yang terbaik untuk perubahan dan perbaikan harapan bisa mewujudkan harapan nya dengan kesejahteran dan murah nya bahan pokok dan twrsedia nya bahan pokok di nya
6088,wis wayahe
6089,pada satnya akan ikhlas hantarkan akan bangsa terbaik sepanjang sejarah
6090,betul pak sudah tuntaskan sebagai gubdki sekarang sudah waktunya berkiprah di isemoga amin yra
6091,untuk dan pileg sudah ada satu koalisi tiga dan yang mengusung sebagai yang pantas sebagai wakil
6092,jangan khawatir juta bpk insya alah kita di
6093,dumdum jauh baik insya alah dia lah kita
6095,insya alah kau akan gila keras ketika sudah yakin ferdinand saya tertawa keras ketika ada dalam daftar kpu
6096,mantab pak fix amin
6097,dan insya alah akan pada waktunya ini sampai suara mas melampaui batas sejahtera pilihan yang obyektif rasional masuk akal terbukti rekam jejak kerja nyata bela wong cilik
6099,keadilan sejahtera kepada sebagai di membuat para relawan langsung tancap gas
6100,insya alah ke amin
6102,ngeri buzer nya pemerintah tapi alhamdulilah semakin buzer semakin kuat pak insyalah pak akan amin alahuma amin
6103,dia tau pak yang menang nanti dia takut tidak ada jatah lagi di pemerintah maka nya dia lagi isu perpanjangan
6105,teruskn perjuangan nrasi tahi kucing mu bang sampai mu yang sktang terjungking di lalu ente pindh prtai lagi ente klah jauh dari baru sbntr di dunia ada prtai yang brni mnclonkn nah ente pning aku tante
6106,nah sekarang kesampingkan ego demi bangsa iso opo ora
6107,asmara insyaloh pak biar para buzer dan tkg fitnah bertobat sebelum mati amin
6108,masif safari bawaslu tidak punya alasan tindak sebagai pelangaran covid kamis februari ada meningal tempe bakwan kampus purwokerto cirebon golkar maljum malam jumat
6109,forum komunikasi pendeta pendukung segera terbentuk relawan
6111,bacapres menyatakan pihaknya dan keadilan sejahtera sat ini sudah bersiap untuk perjalanan ke depan menghadapi hal itu
6112,rupanya saya sejalan punya pengalaman dengan deny indrayana bahkan saya pastikan diluar sana puluhan juta yang senasib dengan saya sudah satnya wes wayahe mewakili untuk perubahan amp perbaikan ayo rapatkan barisan kita sebagai yang teramanah insya alah
6113,meledak amp dahsyat bro biru putih kuning ijo semuenye khofifah cawapres bro koalisi perubahan benar dahsyat solidkuat amp perkasa bro hebat mantap keren bro
6114,statement deny indrayana ternyata sejalan pemikiran saya dan yang pokok historis cara pandang saya sebagai pendukung setia ternyata dalam proses perjalananya sudah menyimpang dari tujuan awal maka sekarang waktunya memperbaiki melalui sebagai pemimpin terlayak
6115,gue luruskan bro supaya jhon sutorus kagak sesat dan sangat menyesatkan bro mengapa surya paloh menemui golkar bro surya paloh ajak golkar gabung koalisi perubahan bro nye luar biasa kuning ijo biru kib gabung ke koalisi perubahan
6116,go forum kabah membangun fkm dan amanat nasional membentuk koalisi tiga organ relawan untuk ketiganya melaunching kuning ijo biru kib sebagai simbol mempersatukan terhadap
6117,menurut saya adalah tokoh yang rekam jejaknya mendekati kedua parameter yang saya pegang konstitusi dan antikorupsi kata deny dalam keterangan tertulisnya rabu februari
6118,dan diprediksi melaju ke putaran kedua jika dikuti tiga
6119,bareng bestie purwnti kita penuh pak sebagai no pak ke insyalah amin
6120,deklarasi kepada sebagai bismilah insyalah kita penuh kita berjuang saya dan menang pak amin
6121,safari kebangsan menjemput harapan telah dilakukan oleh yang berbuah keyakinan parpol untuk mengusungnya sebagai kandidat oleh koalisi perubahan sehinga memang betul betul sebuah dari kehendak
6122,patut dan pantas
6123,pak
6124,tim dan temui di kantor menyatakan ketiga parpol yang tergabung dalam koalisi perubahan pksdemokratnasdem solid sebagai pada
6125,alhamdulilah tim kecil ke tiga parpol bertemu pertemuan yang seperti sl di lakukan untuk membahas dan strategi nya kita sepenuh nya biar perubahan dan perbaikan harapan terwujud amin kami an dpac pada kec cisoka kab tang
6126,berharap nanti memang dan pak di
6127,dumdum insya alah kita di
6128,pilgub dki hutang budi kepada hti amp fpi tujuan hti amp fpi jelas akan menghapus pancasila amp sudah menjadikan negara khilafah amp menerapkan hukum islam janji hti akan bangkit jika hti fpi pasti akan bangkit kembali
6129,malam mbak ajeng salam sahabat sapa dari kec cisoka kab tangerang nya kita menangkan perubahan dan perbaikan harapan bisa terwujud nya amin
6130,ya harus nya begitu lah hopipah di luar bag koalisi perubahan perbaikan nya tapi semangat nya amin
6131,kayanya mimpi om deny ambyar om deny mengharapkan kib usung ambyar bro hasilnye kuning ijo biru kib gabung koalisi perubahan koalisi perubahan sangat solid kuat amp perkasa semuenye hebat mantap keren bro
6133,mngpa surya paloh temui golkar karena surya paloh politisi ulung konsisten menemui golkar ajak gabung ke koalisi perubahan hasilnye luar biasa kuning ijo biru gabung ke koalisi perubahan solidkuat amp perkasa semue akhirnya hebat kuat perkasa bro
6134,ayo kita rame dan usung yang ke
6135,dumdum sing penting
6136,skrinsut nih cuitan awak siapapun kayak kayak kayak kayak kayak akan tap awak nyinyir jika kbijakanya tidak pro awak kayak kalian tipikal manusia pemuja kalap mabok kepada sorg paham kalian bong
6137,isue ya bagaimana ya kenyatanya pak pantas
6138,berdasarkan temuan lsn dalam kali ini publik terhadap para semakin mengerucut pada tiga tokoh saja yaitu dan
6139,jika kpu jurdil insyalah pak
6140,tiga kelompok relawan itu telah membangun kesepakatan yang menyatakan komitmenya untuk eks dki jakarta sebagai di
6141,jika kpu jurdil insyalah pak
6142,andre memastikan tidak mempermasalahkan jika mencalonkan diri sebagai di mendatang
6143,insyalah pak
6144,dan telah mendeklarasikan terhadap sebagai atau namun hinga kini ketua dp surya paloh belum melakukan pertemuan atau kunjungan balik kepada kedua
