,clean_manual
0,info
1,politisi menjawab soal diduetkan kembali dengan mantan dki jakarta dalam mendatang
2,lanjut pak kita kawal sampai
3,alah swt menyelamatkan bangsa dan negara republik dari para penghianat amanat ya alah yang maha pengasih lagi maha penyayang angkatlah derajat bang republik dan seterusnya amin yra
4,kasihan ya makanya sudah tekad keluarga saya
5,kader yang mana menterinya impor pangan
6,jika tidak ada deklarasi dari pendukung maka ini bermanfat
7,suara
8,rais akan bila gagal pada
9,dulu gunernurnya
10,kpk bergerak keadilan bagi seluruh
11,
12,bisa karena ada yang mendukungnya
13,pikirin kenapa bisa kalah
14,pejabat itu dari lu kritik partainya
15,enggak terkejut
16,lanjut
17,ya sudah kita yang pro akan selalu berada di luar istana
18,herianto cerdas sangat
19,begitu sibuknya kalian urus kami rekam jejak yang kalian posting tidak mencerminkan prestasi sesunguhnya sudah cerdas menilai tenang saja
20,id insya alah bang mjd
21,mantap
22,itu sih konspirasi pasukan cebong sakit hati yang sangat kesel usung cebong punah
23,presidenlihat video asad mahrizal
24,menyatakan kader memenuhi kriteria wakil cawapres pendamping di
25,gabung ya di relawan barisan nasional koalisi bersatu bnkab untuk gerakan perubahan cal chat
26,iklas gabung ya relawan plase cal
27,insyalah pak doain saja ya biar kamu penganguran buzerp kerjan enggak kere kayak sekarang kasihan
28,agar kasus rs sumber waras tuntas pembangunan kak cepat jakban mampus
29,ayo kita perjuangkan sampai
30,tidak ada yang lain yang lain tidak palsu berarti pengkhianat jangan lupa ngopi sebelum imsak
31,fahnor bowo pengkhianat
32,berakal tidak akan mengulang kesalahan yang
33,rg dengan adanya wacana koalisi yang berangotakan lima pendukung istana terlihat seperti sedang dikeroyok ketum keroyok yang angota baik kok ditakuti takut ya
34,penjelasan oleh sebagian saksi kunci pendukung ab patut dijadikan tolak ukur untuk menaikan untuk perubahan
35,moga nkri aminaminamin
36,kenapa takut
37,pak yakin itu
38,achmadi yuk kita
39,apapun judul lagunya
40,mviral glombang bagi abw sebagai pada meningkat
41,tiga dari koalisi perubahan yang mengusung menargetkan suara mantan dki jakarta itu sat bisa mencapai persen di ta
42,id mari kita
43,ini benaran bertanya kah benaran iya sudah diganti pelaksana namanya pak heru jabatan cuman saja sampai pak heru dari lucunya ngisi kekosongan bukanya pakai yang sudah dipilih malah yang fre pas
44,menang tapi priode
45,insya alah pak dan agama di negeri ini bangkit dan harmoni dalam bingkai nkri
46,mundur dari menyerahkan sepenuhnya pada kpu yang akan dijadikan
48,gara postingan ini saya tambah yakin bahwa tuduhan itu tidak berpengaruh pak yang memang untuk di
49,kenapa gen memilih simak penjelasan rasional obyektif untuk perubahan masa depan
50,saligia next amin
51,advokat siap berjuang siap membela pernyatan sikap tim relawan advokat
52,takut saja kalian
53,pertanyan sederhana memang traget dari awal mengapai juga dan bisa di menhan saja lagi pas bagaimana tolong samapikan ke ayah dan biaya kampanye ayah bisa di manfat pangunan di rezim selanjut nya
54,kita lihat saja presidenyaruhut loncat kemana lagi di lapangan sudah menang tinggal admnya saja jangan sampai lengah diputarbalikan suaranya apalagi kardus di gembox sangat rawan sekali
55,wind of change
56,gaspol memang gantian ye giliran
57,memerlukan sebagai amin ya rab
59,jika permainan jujur
61,ribu
62,fathur kusut optimisme harus berjuang untuk mewujudkan itu penting
64,pak yang dan yang mendoakan hinga biar menghanguskan rencana jahat mereka hempaskan yang penuh halusinasi biar stres sendiri sih nganu yang tidak bisa kerja
65,tni meminta bantuan banser atau apan kayak akan kawal agar ada restorasi yang adil sejahtera baru keadilan ditegakan disejahterakan kawal no other no else
66,makar swt bagus dan berlaku ini saya pak the next aminx yra
67,sebelumnya ketua majelis syura umat rais menyatakan sepakat untuk sebagai jika gagal atau tidak tiket
68,yang mengusung sebagai di
70,ini dicopot dari jabatanya
71,memang yang lain bisa pidato seperti ini yang disampaikan adalah kenyatan pernyatan yang cuma bisa janji apalagi pakai gebrak meja terlebih yang cumanya dekati enggak usah adu debat dengan putus kalian
72,ragunan
73,gerakan muda bergerak merangkul merajut tenun kebangsan perubahan sejahtera
74,kereta cepat cepat cepat
75,pak ustadz mana yang hafus ditemui dan ustadz juga tahu saja yang ditemui barokalah pak dan gus baha
76,insalah alah berkehendak pak siapapun lawan nya bilamana takdir beliu yang akan mensejahterakan indonseia menuju perubahan baik
77,gsp
78,lu jadin masjid dan takjil sebagai materi cerita bohong
79,romadhon ketika amal dilipat gandakan ketika doa dijabah pak menyepi insya alah
80,kita doakan bu tatak sehat agar bisa melihat pak di lantik yang ke
81,bismilah bi idznilah alah meridhoi pak
83,sudah diam lo doain saja pak entar lo para buzerp kagak ngemid cari nasi bungkus kayak begini kere
85,selama ini sih curut sitompul enggak waras lagi memfitnah
86,festival hadrah seprovinsi timur ishari nu gema abw via
87,festival hadrah ramadhan ishari nu gema abw
88,mantap benar deh untuk nya saja mantap dan oke
89,insya alahsehat pak
90,jsp dan wakil sat sudah hampir masuk ke jurang kehancuran china meminta apbn jaminan proyek kereta api cepat
92,sat di madinah mashalah sampai penjual di madinah pun tahu pak bismilah pak bidznilah
93,samosir sabar
94,salam perubahan dan perbaikan untuk baik jaya pancasila abadi dan wakil di amin
95,insya alah
96,gerakan perubahan menuju yang baik
97,rezim sunguh jahat membodohi dengan menabrak konstitusi hanya untuk ambisi kekuasan sudah punya sikap tegas bahwa di adalah hanya anieslah sosok yang akan membawa perubahan yang baik menuju keadilan
98,samosir insya alah alah mengabulkan doa kami di tidak dicurangi oleh manusia zholim
99,waras alhamdulilah keinginan akal sehat unk dan mengawal pak keinginan pak kalian juga melihat ya aura pemimpin sudah terlihat amin
100,pertama yang saya bilang takut itu bowo dan koalisinyayg kedua ves kami tidak cinta metro tv tapi kami cinta yang moga nkri ketiga apakah kalian juga cinta abu janda dan ferdinand yang dukunh bowo karena kalian deh mirip mrkini lagu baru karena pembaharuan
101,berdiri berkomitmen untuk membangun perubahan untuk yang baik menuju peradaban baru ke nya duta peradaban pendukung dalam mengusung sebagai setuju enggak fathur
102,nakula pecah jutan jemah teriakan ke
103,benar yang amanah memiliki ciri rasa kepedulian sosial amp memiliki solusi mengatasi masalah tidak diragukan didukung yang menginginkan perubahan dan perbaikan ayo rapatkan barisan memangil semangat
104,insyalah malah naik bila
105,cent mohon doanya pak dipilih nya ya paham
106,koalisi perubahan dan siap antar
107,peneliti senior center isc chairul ansari mengungkapkan empat alasan ungul dari dan dalam bursa untuk mendatang
108,fahnor sikap yang sat yang
109,dan dalam mengenai kandidat untuk di
110,dalam menghadapi sebelumnya telah mendeklarasikan mantan dki jakarta sebagai
111,ini saya alah
113,terbaru mengenai bursa untuk yang dilakukan center isc menemukan bahwa ungul dari dan
114,mungkin terbaik di untuk yang terbaik di nusantara nya cebong ulah marah biasa bae itu nyata
115,
116,pas insya alah periode dan amin alahuma amin
117,ketua badan pembina organisasi keangotan dan kaderisasi bpopk dp herman khaeron buka suara soal adanya isu yang mengusung menko polhukam mahfud md sebagai pendamping pada
118,dalam beberapa bulan terakhir dibandingkan dua kandidat yang digadangadang pada dan
119,sampai detik ini masih setia bagi yang masih setia di like komentar dan twet dengan bismilah akan terbaik
122,siapakah yang pantas periode suara berikan suara anda link tolong forward ke group dan temantemanmu ya
124,wahai baik dikenal solid ayo folow acount dan agar tembus juta folower sd rabu februari menang lihat video ayiceopesantrenpolitikcom
125,samosir marm saya penuh sedangkan serahkan pada yang kompeten yakni
128,madani sudah cerdas dengan kecerdasan itu dukunganya untuk bung as usaha amp upaya dilakukan hanya karena semata dan kemengan adalah hanya miliknyabarokaloh
129,wajib di lanjutkan selanjutnya maka dari itu jangan jakarta sudah korban kedunguan
130,pengasuh p darul ulum rejoso jombang restui di
131,saya ke
133,papazola sejak yang pertama sd ini semuanya tidak ada yang mampu mewujudkan sumpahnya derita ibu pertiwi ini semakin parah ini saya pertolongan dan ridhonya segera menghadirkan bung as president amin
134,takut dengan pembiayan kereta cepat kasih tahu tidak usah ikutan berbahaya begitu adalah asli
135,saja anak muda cerdas inshalah
136,waras insyalah menang amin ya rab
138,nanti akan ada twet poto dengan pak kiyai judulnya kiyai nu memberikan kepada untuk
139,saya penuh dulu dan untuk ribu
140,saya dulu dan untuk ribu
141,pak menteri pertahanan sat pak
142,bahrawi insya alah pak kalo manusia alim agama itu seperti drum isi air kalo air nya isi sedikit goyang coba air nya ful enggak goyang sekali kalo islam jelek menjelekkan sesama islam itu islam nya
143,bung jaga kesehatan anda is the best jaga kehormatan sha alah anda
144,nanti pak
145,fahnor kok saya enggak yakin saya percaya pak di nanti buktinya lihatlah miniatur nkri yaitu jakarta yang pesat selama dipimpin pak
146,prediksi gwklau pasti nyungsep
147,samosir berjuang itu butuh keberanian dan keahlian perjuangan itu butuh pengorbanan pak menuju super power
148,di deh
149,efek positif pecalonan sebagai ini kata ketua kota serang
150,asmara setuju yang penting nya tahu
151,cayah lihatlah yang dipecat jonan susi rizal ramli lalu bandingkan dengan yang tersisa akan tersimpulkan enggak perlu baik dan pintar yang penting bisa jilat
152,mudahan republik
153,amin insyalah ke maka perubahan itu akan nyata sebagai contoh kbi berubah sesuai pak korupsi akan diganti kelebihan bayar pembangunan spektakuler satu atau dua sisanya ganti yang sudah ada
154,ng ok
155,rafi nagita nasibnya enggak akan jauh beda bohir yang sekarang lagi sibuk ngamanin periode
156,saya akan kalo untuk ke
157,insya alah menjatuhkan pilihan untuk pak sebagai demi perubahan
158,biarkanlah cebong otak pada blon gas pol untuk perubahan ulah marah dia bong
159,pak moeldoko membantah tudingan bahwa peninjauan kembali pakai yang dilayangkan untuk menjegal sebagai enggak ada hubunganya dengan suka berhalusinasi
160,wakil ke dan ke jusuf kala jika mengaku telah mengusulkan wakil ke usungan jika mengungkap ada dua kriteria yang mendampingi
161,sejumlah elemen yang berlatarbelakang akademisi pengusaha hinga kelompok milenial yang bergabung dalam relawan koalisi teman kita mendeklarasikan untuk di
162,iya nih berat melawan nya karena pendukung kita cuma otak kodok mending saja lah dari pada malu karena sudah yang waras
163,vs khofifah
164,pilihlah begitulah pesan untuk perubahan
165,pesan saya untuk pilihan nya panas tuh kuping ebong
166,mesjid karena suka bernarasi soal dirinya di dalam mesjid
167,dalam beberapa bulan terakhir dibandingkan dua kandidat yang digadangadang pada dan
168,dalam mengenai untuk peneliti senior dari center isc chairul ansari menyajikan empat alasan mengapa memiliki keungulan dari dan
169,hidup ke
170,mahfud md eric aniesandika perkasa ini baru kuat kita prabowoeric kata gusdur satnya masa tua dan juga
172,dengan segala cara berusaha mengagalkan rencana untuk sebagai kata nuim hidayat manuver firli bahuri di kpk untuk memperkarakan dalam kasus formula ada yang menyatakan sepengetahuan jelasnya
174,bagaimana deklarasi saja belum sungut doang ngabocot eweh bukti mimpi doang dia gas pol untuk perubahan cebong buzerp sudah mendapatkan receh belon tuh
175,di sisi lain lembaga lsi juga menunjukan elektabilitas antara tiga potensial di yaitu dan kuat
176,mending yang sudah pasti tv
177,dan saya berpesan agar nanti semakin mantap
179,dibandingkan dua kandidat yang digadangadang pada dan
180,dan saya sangat yakin ke
183,koruptor menyebar
184,viva peneliti senior center isc chairul ansari memaparkan empat alasan ungul dari dan dalam bursa untuk
186,sebagus apapun kerjamu dimata sih pembenci tetaplah jelek aniesbaswedan aniesbaswedan
187,siti nurmarkesi adalah tokoh golkar yang juga bupati kabupaten kendal perjuangkan mas di
188,jangan curhat dong ah kita doakan
189,andai pak sandi ini enggak menerima pinangan cawapres dan wagub bisa dki andai yang kepilih bisa cawapres bisa
190,buzerp recehan panik dan ketakutan
191,sudah hilang akal buzerp recehan untuk memfitnah
192,bidik firli jangan sampai lolos lihat video
193,faktanya dalam video tidak ada pembahasan wakil maruf amin dan raja salman arab saudi di gambar thumbnail merupakan editan dari beberapa gambar yang berbeda selengkapnya di
194,sebuah kanal youtube bernama suasana mengungah video berdurasi menit dengan judul meroketbangbangraja slaman amp wakil sukseskan
195,salah wakil maruf amin dan raja salman sukseskan
196,toktok
198,toktok
200,fahnor toktoktok
201,lo saja menyarankan jangan sampai pas pimpin negeri ini sekarang lo suruh psapes banget hidup lo
202,yang pertama tama penjarah ini jika
203,saya terkecewakan yang ke kali hadirkan lah kompetisi yang sehat dan fair insya alah pak akan nya di
204,pengasuh p darul ulum rejoso jombang restui di kebersaman dalam keadilan sosial bagi seluruh mp relawan
206,kita doakan saja mudahan amin
207,fahnor yang jelasgua enggak punya wni keturunan arab yang didukung fpihtipapks dan kadrunista lainya itu ajasih belum lihat sih kalah enggak akan sembuh gua wakakakakakak
208,di teriak menuntut berikut harus meneruskan rejim terdahulu namun kelakuan gerombolan nya di dki ngobrakabrik pencapaian
209,yang selalu di hujat dan di fitnah oleh para pembenci
210,sang perubahan mari kita sebagai republik priode
211,insya alah pak republik
212,soal duet aniesandi di jubir sangat mungkin demikian pihaknya menyerahkan sepenuhnya wakil cawapres kepada mp hero relawan
213,bukalah yang tertutup amin
214,selama di maka iblis dari bani cebong seperti adek ini akan selalu berusaha sekuat tenaga mengangu untuk mengagalkn pencalonan sebagai capreskrn iblis akan kepanasan kalo baik
215,gas pol untuk perubahan
216,coba gas pol untuk perubahan jangan marah lah itu pilihan ane terserah lu siape ke memang gue pikirin
217,
218,fungsi bumn dimata dan diselaraskan dengan pikiran ekonomi bung hata is the best
219,realistis saja bang enggak cuma bola itu benar tapi swing voters beralih itu pasti swing voters itu pendukung loyal soalnya sekarang sisa pendukung loyal saja lu bacot naikin elektabilitas sory enggak ya
220,andriana saya pak ke jaya jaya jaya
221,diwanga didu lu buta itu ada tulisan the next masalah belum juga enggak ada yang termasuk on
222,ketika koruptor dieluelukan ciri negeri sudah dikuasai mafia silakan menilai
223,bagus itulah patriot bangsa tidak apapun tidak masalah yang penting berbuat baik sesuai dengan kemampuan bagi bansa ini kami butuh keteladanan dan perubahan bangsa ini
224,luhut nanti jaminan penjarah dulu jika
225,inshalah perjanjian dengan china maupun kontraknya pasti dibatalkan seperti ygterjadi di malaysia begitu mahatir pm mantan pmnya masuk penjarah
226,lucu saja terendah tapi saban topik cebong seputaran saja jangan terpopuler untuk sih miduk jejak digital fitnah caciany bisa dipertangung jawabkan nanti dipengadilan
227,pak
228,ini saya alah pak
229,samosir luas semakin paham bahwa baik akan ujian dalam menghadapi zalim mereka gerah putus asa karena sebentar lagi akan lahir pemimpin yang benar amanah untuk mewujudkan perubahan kearah yang baik sosok yang ditakdirkan dan diamanatkan
230,buka puasa kampung batuah kalimantan selatan sekitar penghuni kampung ini menyatakan sikap mas
231,didu inimah sedekah pak jelas foto terpanpang dan ada tulisan alasanya karena pelakunya tapi jumatan dimasjid maka itu kampanye anda sehat
232,untuk
233,itu kata anda kata kami yang mayoritas menghendaki pak
234,iya memang kenapa mereka ini ingin membela bangsanya yaitu negara kesatuan republik agar kedepan bermartabat dan disegani oleh kawan maupun lawan saya meyakini jika pak ini saya alah negara akan tentram damai
235,buzer bayaran nya yang timbul sat sat mendekati pejuang bagi para malingprampok koruptor yang mengalami kemiskinan selama hampir tahu ini para maling akan berjuang untuk agar di yaman
236,samosir alhamdulilahtadi sembako dari tim suksesnya pak pak yang ke goblok ya batal deh puasanya
237,realistis saja yang dihadapi koalisi dengan dana berlimpah kekuasan butuh pendamping yang siap mensuport tidak hanya elektabilitas tapi juga logistik saya siapapun cawapresnya enggak masalah yang penting menang pada parpol tau strategi yang
238,pengin punya yang cerdas visioner dan amanah
239,sudah mandul serangan densy ke
240,gas pol untuk perubahan cebong buzerp biarkan jangan di tangapi mending gas pol untuk perubahan republik
241,silaturahmi bagus urusan saya arus perubahan
242,pak amir seandainya pak tolong disampaikan kepada untuk menunjuk pak jonan menhub lagi
243,gas pol untuk perubahan republik
244,gantian
245,ramaikan halal bihalal pada tanggal mei
246,alaidid sulit lah wong dari sekarang saja fihak sudah kesulitan mencari celah salahnya di mana hanya kecurangan yang bisa mengalahkan aniesin saya alah dengan izinya
247,chairul ansari memaparkan empat hal yang menyebabkan ungul dari dan dalam bursa
250,ungul dari dan dalam bursa untuk
251,pengin tau dongsiapa saja yang ingin pak
252,sosok mahfud md digadangadang untuk wakil pasangan ataupun dalam kancah simak berita selengkapnya di
253,saewad ini saya alah pak amin
254,
264,peneliti senior isc chairul ansari memaparkan ada empat alasan ungul dari dan dalam bursa untuk
265,sejumlah kelompok mendorong bacapres mengandeng wakil bacawapres dari kalangan perempuan pasalnya jumlah pemilih perempuan cukup dalam
266,telah mengantongi lima wakil sebagai pendamping yang telah diusung sebagai pada mendatang
267,palembang berhasil ungul atas dan di kabupaten musi banyuasin muba dan ogan ilir oi
268,daripada dan dalam mengenai kandidat untuk di
270,terbaru mengenai bursa untuk yang dilakukan center isc menemukan bahwa ungul dari dan
272,kaum milenial kepada mas meminta tolong berikan komentarmu siapakah yang pantas wakil untuk mendampingi perubahan sejahtera
273,menyatakan bahwa ada empat faktor yang membuat ungul daripada dan dalam mengenai kandidat untuk di
276,razin sd razin said sd sd rorn ng arogan
277,ini dulugak tau sekarang mungkin sekarang kumpulin kuali barbardan nanti kalah pasti katanya begini lagi ealah capek banget deh
278,keren bong pusing klilingkan lu lihat gamabar ini the next insyalah terwujud amin
279,asmara menteri hijriyah di hijriyah
280,itu dulu bro ini sha alah sb sudah pintar amp ingin perubahan di lini oke
281,peneliti senior center isc chairul ansari membeber empat alasan ungul dari dan dalam bursa untuk
282,simak ataupun ahli tarot ramal itu keturunan dan suka pakai topi poskota
283,mahfud md dinilai tidak mendampingi bertarung di karena bagian dari rezim pemerintahan bagaimana menurutmu tulis di kolom komentar ya
284,sir mp relawan harus netral pada sikap bisa menyelamatkan bangsa ini termasuk karir setelah turun dari kursi jika tidak netral nasibnya terancam pasca purna tugas tirulah sikap netral surabaya di masa akhir jabatanya pada tahu
285,sir mp relawan harus netral pada sikap bisa menyelamatkan bangsa ini termasuk karir setelah turun dari kursi jika tidak netral nasibnya terancam pasca purna tugas tirulah sikap netral surabaya di masa akhir jabatanya tahu
286,didu tinggal di lantik ke
287,terimakasih anda telah membicarakan saya nex
288,yang fenomenal menolak uang sogok dari pengembang pulau wdktu jumlahx milyar ini moga unik jarang ada dindonesia seperti beliaurindu pemimpin seperti ini pak republik
289,insya alah
290,iya saja didukung apalagi
291,bibit bebet bobot dan indentitas jelas kakeknya seorang pejuang kemerdekan diakui negara nkri diberikan gelar pahlawan dan cucunya mantan terbaik tuntas melaksanakan mas ditunjuk untuk memilih
292,ditungu saja bpk jangan panik dan stres begitu lah
293,menjatuhkan sangat sulit karena dia jujur amanah dan bersih insya alah republik dan iblisnya lari tungang langang
294,dari beberapa yang komentar kok yang yasudah kelihatan yang di nanti
295,menginginkan perubahan ke arah yang baik pilihlah tapi masih seperti sekarang ini bahkan mungkin parah dari sekarang pilihlah cs dan kronikroninya
296,yantobaemo iya dong mending gas pol untuk perubahan republik ini jangan marah biasa saja
297,lu saja yang butuh kami tidak butuh gantipresiden faktanya perubahan sepertinya oposan laginasbubg lagicr bohir lagi betulkah jalan yang dijual ada ngakunya perubahan bukanya naikmalah nyosor
298,the best pak yang di rindukan jelata yang waras pastinya
299,saewad pak sudah tua istirahat nikmati hidup jangan menyusahkan diri sendiri
300,saya berharap pak yang
301,ini saya alah dimudahkan dan dilindungi alah bisa mengawal pak amin
302,fahnor modal menurut tawarkan misi atau gagasan membuat langkah langkah untuk republik ini tawarkan rekam jejak sat karena visi misi bisa dikarang dan dibuatkan tapi rekam jejak adalah bukti bisa uji
303,betul
304,samosir
305,pak menteri kalah ditikungan mulu abangda yang akhlaknya super duperitu ganti
306,lapor beli token listrik prabayar di pln mobile rincian sb listrik pln denom rp biaya layanan rp metode pembayaran melalui va bayar rp kwh yang didapat harga kwh rpkwh
307,siap cerdas
308,abdilahtoha insya alah pak
309,fahnor itu aneh diam saja salah dia sudah biasa kalo kasih pendapat beda lagi narasi eluh pejabat ngadih pendapat belum sudah meminta bukti perubahanya dimana aneh
310,kira jujur saya konsisten tidak akan dia apalagi gabener drama
311,
312,jika sebagian ada yang diluar perlu dipertanyakan apakah mereka kelompok pro koruptor sdgkan benar praktek korupsi di harus diberantasdilawan karena jelas telah merusak tatanan negara dan kehidupan
313,kenapa para pendukungnya kok selalu menyerang bukankah sampai sekarang tidak ada satu partaipun yang mengusung sebagai
314,kayak nya gue mulai bosan punya yang kelahiran nya dari suku nanti gue pengin punya yang kelahiran nya dari suku sunda seperti bang yang kelahiran dari kuningan barat
315,alhamdulilah untuk mas di hadir di tingkat desa bismilah mas the next amin sir relawan pemilugembira
316,asmara saya perubahan untuk ke insyalah kabul
317,insya alah pak amin ya rabalalamin
318,gantian amin
319,siap siap penjarah
320,betul narasi lo den kesimpulan mya cuma satu sudah tersingkir dan menurut lo punya jejak hitam satu satunya jalan cuma pak yang untuk di merdeka
321,gue herankok ada ya yang banga koruptorsampai rela menjemput dan menyambut secara meriahsudah jls ini penjhat malah di kasih pangung ada saja kelakuanya lbs
322,bedah lsi ungul dari lsi ini pelajaran berharga bagi ketiga yang digadangadang di termasuk bagi sendiri mp
326,untuk perubahan ibu pertiwi amin
328,gas pol untuk perubahan ibu pertiwi
329,gas pol untuk perubahan ibu pertiwi menuju jaya
330,gas pol untuk perubahan ibu pertiwi menuju jaya para cebong buzerp blon jangan marah
333,said mengangkat pns amin
334,komen sudah lengkap mewakili pikiran saya hanya menambah poin yang belum ab belum tentu bisa ikut bahkan pun mungkin merapat ke tim jkw takut lol jangan kalo kasus korupsi di pemda dki diusut juga menuduh takut picik dan picek
335,tingkat dewa apalh kami sb ingin perubahan
337,seorang peneliti senior dari center menyatakan bahwa ada empat faktor yang membuat ungul daripada dan dalam mengenai kandidat untuk di
339,gas pol untuk perubahan ibu
340,yuk samasama berikhtiar dan bertawakal
342,mas pemerhati dan pelestari seni dan budaya untuk untuk perubahan baik seni dan budaya berkembang go internasional
343,gas pol untuk perubahan ibu pertiwi kutu loncat jangan marahmarah
344,saewad is
345,fahnor alhamdulilah saya berhasilmenghantarkan bpk pembantu bpk jokowinsya alah saya akan menghantarkan bpk kalo disono sudah pendukungnya seperti tuan abu janda
347,ketakutan dan koalisi kalo sudah takdir
350,ajakan erdogan kepada negaranegara yang berpenduduk mayoritas islam untuk bersatu melawan teroris zalim israel salah satunya jakarta diam berarti saja dengan yang dilakukan teroris israel laknatulah terhadap bangsa palestina
351,ng kayaknya ada yang enggak beres block saja jaga
352,dulu enggak percaya sekarang dia yakini ini yang timbul dan tengelam eits itu dulu sebelum kecebur kolam sekarang ya begitu deh
353,yang terkejut tiap detik itu buzerp cebong lihat semakin mantul yang merasa cebong buzerp blon jangan marah
356,bagi saya biasa saja di foto selfie lagi sholat saya ingin perubahan di republik ini saya
357,percaya deh kalian wahai cebong dan kadrun sampai kiamat tapi adalah ilham aidit begitu
358,nakula anakolong lasan sauya nbyl yantie hanya piala dunia bokeptik tok ektp dan masih lainya hanya yang
359,cebong itu blon biarkan saja gas pol untuk perubahan ibu pertiwi cebong otak nya datar sudah takdir bisa nya cuma ngeles memfitnah yang merasa dirinya banget jangan marah lagi cebong blon
361,jangan suka menghina tahu hanya wong gemblungorang gila yang percaya
363,tikadrun ini salah satunya
364,kondisi ini peluang
365,contoh proyek dancokan yang harus ada perubahan dan perubahan itu baru ada jika pak bego lo
366,asmara insya jurdil pada merdeka
367,yuk samasama berikhtiar dan bertawakal pak
369,dalam mengenai untuk peneliti senior dari center chairul ansari menyajikan empat alasan mengapa memiliki keungulan dari dan
370,saya dan untuk
371,jajak pendapat lembaga lsi memperlihatkan pemilih subiantosandiaga pada lalu mayoritas memberikan sebagai
372,samosir luas sudah paham siapasiapa pemimpin yang bermuka munafik hanya percaya kepada sang pemimpin sejati dialah pemimpin yang benar dititipkan untuk melakukan perubahan perbaikan kedepan yang baik pilihan semangat
373,ini seorang profesor buzer tidak butuh buzers pemilihnya sudah juta dan ini sha alah miskin itu benar harus dibantu digarong bansos nya yang harus diberantas maling bansos neng
375,esteh manis kayaknya segar tuh
